House,Stone,172 sq.m.,2,5,1,Available,Not available,Old Renovation,1800 sq.m.,,,,,,Lorri › Akner,"$15,000",USD,"Վաճառվում է երկհարկանի առանձնատուն (տուֆ) 172 մ2 1800մ2 հողատարածքով (18 ակր) գեղատեսիլ վայրով, Ալավերդու հարևանությամբ, Լոռու մարզի Ակներ գյուղում (40 կմ դեպի Վրաստանի սահման) : Հողամասում կան պտղատու ծառեր (խնձորի ծառեր, սալոր, դեղձ, խաղող) :Продаётся двухэтажный дом (туф) 172 м2 с участком 1800м2 (18 соток) с живописным месте, недалеко от Алаверди, в селе Акнер, Лорийская область (до границы с Грузией 40км) на участке есть плодовые деревья (яблони, сливы, персик, виноград) торг уместен, пишите здесь или в WhatsAppFor sale two-storey house (tuff) 172 m2 with a plot of 1800m2 (18 acres) with a picturesque place, near Alaverdi, in the village of Akner, Lori region (up to the border with Georgia 40km) on the plot there are fruit trees (apples, plums, peach, grapes) the trade is appropriate, write here or in WhatsApp",Dec-12-2022_21-18,,,https://list.am/en/item/18652958,"Electricity, water supply",,Swimming pool
House,Stone,159 sq.m.,2,5,1,Partial Furniture,1 spot,Old Renovation,86 sq.m.,,,,,,"Երևանյան փողոց 284, Տաշիր","$25,000",USD,"The house is in normal condition, has a cattle barn, a basement is located on the main street of the city. 1 floor is not habitable.Translated from Armenian",Dec-12-2022_21-18,,,https://list.am/en/item/17531645,,House is Finished,
House,Stone,300 sq.m.,2,4,2,Not available,2 spots,Partial Renovation,100 sq.m.,,,,,,"Նարեկացի փողոց, Վանաձոր","$18,000",USD,"The house is located in the 3rd part, it has partial renovation, the windows have been replaced (Euro), the house is sunny, it is located in the front part of the sun, it has a fertile land.The garage and cellars are located on the first floor of the house.Price negotiable.Translated from Armenian",Dec-12-2022_21-18,,,https://list.am/en/item/17227585,,House is Finished,
House,Stone,110 sq.m.,1,2,1,,,Major Renovation,110 sq.m.,,,,,,"Zaqaryan street, Vanadzor","$47,000",USD,"Own house is located in front of the rectory.All utilities are available. One part of the house has been fully renovated. There are also built-in wardrobes. There is a heating system.There is a large garage in front of the house.There is also another small house nearby, not renovated. After renovation, it can become rooms. The price is negotiable.Translated from Armenian",Dec-12-2022_21-18,,,https://list.am/en/item/17551810,,,
House,Bricks,604 sq.m.,4+,8+,3+,Not available,3 or more spots,Partial Renovation,,,,,,,"Զաքարյան փողոց, Վանաձոր","$250,000",USD,"A house for sale at 46 Zakaryan Street, Vanadzor. The house has 3 floors, each 168 square meters. M and attic 100 sq. A total of 604 square meters. M. There is a 5x12 m garage attached to the house. The ceiling height is 3 meters. All doors and stairs are made of oak. Electricity is fully available and there is also a heating system. It needs cosmetic renovation, the walls are plastered.Translated from Armenian",Dec-12-2022_21-18,,,https://list.am/en/item/18687231,"Electricity, water supply, natural gas, sewerage",House is Finished,
House,Stone,750 sq.m.,1,5,1,,,No Renovation,,,,,,,Lorri › Alaverdi,"$20,000",USD,"Առկա է ընդարձակ այգի, բերքառատ պտղատու ծառերով։",Dec-12-2022_21-18,,,https://list.am/en/item/13128321,,,
Country House,Stone,156 sq.m.,2,5,1,Not available,Not available,No Renovation,1600 sq.m.,,,,,,"Աշոտաբերդի փողոց 19, Ստեփանավան","$19,000",USD,"A plot of land with a beautiful forest view is for sale in the upper part of Ashotaberd district. It has an asphalted road from the central road. A two-story building is built on it, the 1st floor is made of concrete and the 2nd floor is made of plywood. Provided with drinking water and electricity. For details, call the specified number. Owned.Translated from Armenian",Dec-12-2022_21-18,,,https://list.am/en/item/18074517,,House is Finished,
House,Stone,81 sq.m.,2,4,1,By agreement,1 spot,Partial Renovation,1200 sq.m.,,,,,,"Улица Вазгена Сарксяна, Yerevan","$50,000",USD,Two-story stone house with all utilitiesTranslated from Armenian,Dec-12-2022_21-18,,,https://list.am/en/item/18041950,,House is Finished,
House,Stone,239 sq.m.,3,8+,1,,,No Renovation,1000 sq.m.,,,,,,Lorri › Tashir,"$27,000",USD,"Address, Tashir city, Sayat-Novai street, near the school. The price is negotiable. The walls are double-layered.Translated from Armenian",Dec-12-2022_21-18,,,https://list.am/en/item/18273823,,,
House,Stone,2500 sq.m.,1,5,1,Available,Not available,Old Renovation,,,,,,,Lorri › Gargar,"$28,000",USD,Обсудим по телефону,Dec-12-2022_21-18,,,https://list.am/en/item/17712334,,,
House,Monolith,160 sq.m.,1,5,3+,,,Old Renovation,1000 sq.m.,,,,,,Lorri › Spitak,"$11,000",USD,"The house is located in the village of Saralanj, Spitak region. The village is gasified, has internet TV. The house is for sale in a closed version.Translated from Armenian",Dec-12-2022_21-18,,,https://list.am/en/item/17962337,,,
House,Stone,330 sq.m.,2,8+,2,Not available,3 or more spots,No Renovation,950 sq.m.,,,,,,Lorri › Vanadzor,"$115,000",USD,"Վանաձոր, Նիզամու 47/7, Կիսակառույց, բնակելի մակերեսը' 220 քմ, ավտոտնակ և նկուղ' 110 քմ, հարմար է նաև որպես հյուրատուն կամ այլ բիզնես նպատակներով օգտագործելու համար, հարևանությամբ առկա է դպրոց, խաղահրապարակ, հանգստի գոտի։Սակարկելի...",Dec-12-2022_21-18,,,https://list.am/en/item/16309489,,,
House,Stone,400 sq.m.,3,6,2,,,No Renovation,1000 sq.m.,,,,,,"Իսահակյանի փողոց, Վանաձոր","20,000,000 ֏",AMD,Near the front seatfruit treesThe building was built in 1994Call for questions.Translated from Armenian,Dec-12-2022_21-18,,,https://list.am/en/item/17064485,,,
House,Bricks,190 sq.m.,2,3,1,Available,1 spot,No Renovation,3500 sq.m.,,,,,,Lorri › Spitak,"$32,000",USD,"A capitally built house in a leather factory district is for sale.Three-storey (attic), basement monolithic, interior walls are plastered, uninhabited.It is provided with gas, water, electricity, sewerage,has a barn, garage, 3500 sq. M. Orchard.The area is completely fenced.In the same yard is the second house with all the amenities of 162 square meters.In the pictures you can get acquainted only with the layout of the brick house.Translated from Armenian",Dec-12-2022_21-18,,,https://list.am/en/item/12117014,,House is Finished,
House,Stone,600 sq.m.,2,8+,2,,,No Renovation,,,,,,,Lorri › Stepanavan,"$5,500",USD,"A half-built two-storey house is for sale in Stepanavan. On the left bank, V Hambardzumyan str. , Is the former Ardshinbank street, the land area is 600 square meters, the floor area of the house is 120 square meters. It is marked with a yellow mark on the map.Translated from Armenian",Dec-12-2022_21-18,,,https://list.am/en/item/14332279,,,
House,Stone,230 sq.m.,2,5,1,,,Old Renovation,270 sq.m.,,,,,,Lorri › Vanadzor,"$32,000",USD,"A 2-storey detached house is for sale in Dimats district. The area of the land is 270 square meters, the area of the residential house is 230 square meters. The house needs repairs. There is gas, electricity, water. It has a garage (with a box), cattle shed, cellars.Price: $32,000.Translated from Armenian",Dec-12-2022_21-18,,,https://list.am/en/item/18539100,,,
House,Stone,120 sq.m.,2,8+,3+,,,No Renovation,300 sq.m.,,,,,,Lorri › Stepanavan,"$15,000",USD,"Unfinished house, shop, land, city Stepanavan Charents 143Translated from Armenian",Dec-12-2022_21-18,,,https://list.am/en/item/15969029,,,
House,Stone,240 sq.m.,2,8+,2,,,Old Renovation,1720 sq.m.,,,,,,Lorri › Vardablur,"24,000,000 ֏",AMD,"The house is suitable for living, as he used it as a guest house, he always has: Water, gas, sewerage. Large garden, garage, barn with separate gate.Translated from Armenian",Dec-12-2022_21-18,,,https://list.am/en/item/17934753,,,
House,Stone,100 sq.m.,1,3,1,,,No Renovation,,,,,,,Lorri › Dsegh,"2,000,000 ֏",AMD,"Վաճառվում է երեք սենյականոց քարե տուն Դսեղ գյուղի գյուղամեջում։ Ունի վերանորոգման կարիք, ունի հողակտոր։",Dec-12-2022_21-18,,,https://list.am/en/item/17966626,,,
House,Stone,90 sq.m.,1,3,1,,,No Renovation,110 sq.m.,,,,,,Lorri › Dsegh,"$4,000",USD,"Վաճառվում է հին քարե տուն Դսեղ գյուղում, Թումանյանի տուն թանգարանի մոտ։ Ունի վերանորոգման կարիք, տանիքը պետք է սարքվի։ Կա նաև հողակտոր։",Dec-12-2022_21-18,,,https://list.am/en/item/17966788,,,
House,Stone,650 sq.m.,1,5,1,By agreement,1 spot,Old Renovation,500 sq.m.,,,,,,"Улица Месропа Маштоца 92A, Ванадзор","$29,000",USD,"Одноэтажный дом, старый ремонт, имеется гараж, сарай и большой участок, ремонт старый, цена договорная, также можем осмотреть обмен на 3-4 комнатную квартиру.",Dec-12-2022_21-18,,,https://list.am/en/item/18682455,"Electricity, water supply, natural gas, sewerage",House is Finished,
House,Stone,320 sq.m.,2,8+,3+,,Not available,Major Renovation,1000 sq.m.,,,,,,Lorri › Stepanavan,"$200,000",USD,"A 320-square-meter building of an existing 4-room vacation house with a pine and spruce wooded area of 1000-2 square meters is for sale at Antarai 1, StepanavanTranslated from Armenian",Dec-12-2022_21-18,,,https://list.am/en/item/18583082,,,
House,Stone,95 sq.m.,1,4,1,Partial Furniture,1 spot,Old Renovation,400 sq.m.,,,,,,"Նանսենի փողոց 1, Ստեփանավան","$35,000",USD,"A stone house and summer house, 4 rooms with their own furniture, fruit trees, and a separate stone building of about 20 sq/m. Alley, next to the forest. A house for sale in Stepanavane, 100t/m, a garden near the forest, 5-8 Nansen Street 1Translated from Armenian",Dec-12-2022_21-18,,"Air conditioner, fridge, stove, washing machine",https://list.am/en/item/17628426,"Electricity, water supply, natural gas, sewerage",House is Finished,Gazebo
House,Stone,98 sq.m.,1,4,1,Available,1 spot,Old Renovation,200 sq.m.,,,,,,"Surb Nshan street, Stepanavan","7,500,000 ֏",AMD,"4 rooms, 2 corridors, kitchen, bathroom, there is a 55 square meter building next to the house, which can be used as a barn or garage, fruit trees, the house is located on 409 Division Street, the house has water, gas, electricityTranslated from Armenian",Dec-12-2022_21-18,,,https://list.am/en/item/18055213,"Electricity, water supply, natural gas, sewerage",House is Finished,
Country House,Monolith,110 sq.m.,3,3,1,,,Partial Renovation,1000 sq.m.,,,,,,Lorri › Vanadzor,"$16,000",USD,"There are fruit trees,The entire area is fencedA beautiful view can also serve as a recreation area.There is an opportunity to increase the land area.There is a clean stream nearby.There will also be a booth,Call for all questions.Translated from Armenian",Dec-12-2022_21-18,,,https://list.am/en/item/18203995,,,
,Stone,1500 sq.m.,,4,,,,,,,,,,,"3rd lane 3rd street, Darpas","$15,000",USD,"1.5 հարկանի տուն իր 1500 քմ հողամասով։ Ունի ավտոտնակ, անասնաշենք, մշտական ջուր, գազ։ 1900 քմ վարելահող։",Dec-12-2022_21-18,,,https://list.am/en/item/15126779,,,
House,Stone,200 sq.m.,2,5,2,,,Partial Renovation,,,,,,,"Վարդանանց փողոց 49/1, Վանաձոր","$55,000",USD,"A private apartment is for sale, it is in good condition, it has a basementTranslated from Armenian",Dec-12-2022_21-18,,,https://list.am/en/item/18441352,,,
House,Bricks,200 sq.m.,1,4,1,Partial Furniture,1 spot,Cosmetic Renovation,200 sq.m.,,,,,,Lorri › Gugark,"$26,000",USD,"The house is residential, there is gas, water, electricity, it has a basement with the entire surface of the house, a garage and a barn. They live in the house to this day.Translated from Armenian",Dec-12-2022_21-18,,,https://list.am/en/item/18482670,,House is Finished,
House,Stone,225 sq.m.,2,5,1,,,Partial Renovation,800 sq.m.,,,,,,"Քոթեջ 4, Վանաձոր","$40,000",USD,"House for sale!With all utilities225 sq. M. House, garage800 square meters of land65 square meters - livestock buildingplot with fruit treesTranslated from Armenian",Dec-12-2022_21-18,,,https://list.am/en/item/17781823,,,
House,Stone,162 sq.m.,2,5,1,By agreement,1 spot,Partial Renovation,41 sq.m.,,,,,,"Երևանյան փողոց, Տաշիր","$13,000",USD,"The private house is for sale. The address is written Yerevanyan, it is wrongly written LoriRegion of Mykhailovka Kalininolarge plot of landcattle ranchpantrygarageconstant water, gas, lightNEGOTIABLEMIKHAILOVKA VILLAGETranslated from Armenian",Dec-12-2022_21-18,,,https://list.am/en/item/18527108,,House is Finished,
House,Stone,245 sq.m.,2,5,1,Not available,2 spots,Old Renovation,600 sq.m.,,,,,,"7-я улица Тавроса 22, Ванадзор","$28,000",USD,"Срочная продажа! Дом сухой, в хорошем состоянии, требует ремонта. Удобное месторасположение, школа, магазины, остановка поблизости. 5 комнат, санузел в доме, гараж, большой зал над гаражом, подвал. Срочно.",Dec-12-2022_21-18,,,https://list.am/en/item/18279545,,House is Finished,
House,Stone,210 sq.m.,3,3,2,Partial Furniture,Not available,Euro Renovation,,,,,,,Lorri › Alaverdi,"$60,000",USD,"A 3-storey building with furniture and appliances is for sale. The 1st and 2nd floors are existing shops, the 3rd floor has 3 rooms. Apartment:The price is final.Translated from Armenian",Dec-12-2022_21-18,,,https://list.am/en/item/18353717,,House is Finished,
Country House,Wooden,100 sq.m.,2,6,3+,Available,1 spot,Designer Renovation,600 sq.m.,,,,,,Lorri › Stepanavan,"$39,000",USD,Продается коттедж гостевой дом под чудесным лесом Степанавана. Также есть джакузи.,Dec-12-2022_21-18,,,https://list.am/en/item/18396183,,,
House,Wooden,53 sq.m.,1,2,1,Available,Not available,Partial Renovation,2470 sq.m.,,,,,,Lorri › Pushkino,"$19,000",USD,"A country house with its own plot of land is for sale in Pushkino community, Lorva marz. The house is partially renovated and heated.It has a kitchen, a bedroom, a living room and a large covered terrace. The summer house has a cellar, a barn, a pantry, gardens and a vegetable garden. There is 400 square meters of land next to the summer house.The garden has tall fir trees, fruit trees, berriosas and vines.In the yard there is a barbecue, a summer kitchen, a besetka (for 20 people)Appliances, furniture and dishes are included in the price.Call only between 10:00 and 21:00. Price is negotiable for real buyers.Translated from Armenian",Dec-12-2022_21-18,,,https://list.am/en/item/18355799,,,
House,Stone,95 sq.m.,1,4,1,Not available,Not available,Old Renovation,2300 sq.m.,,,,,,Lorri › Gugark,"$14,000",USD,"Hassen village, Gugark 14 street, house 45. The house has fruit trees and a 20 m barn.Translated from Armenian",Dec-12-2022_21-18,,,https://list.am/en/item/18182123,,,
House,Stone,120 sq.m.,1,4,1,,,Old Renovation,1300 sq.m.,,,,,,Lorri › Shirakamut,"$14,000",USD,"It has ""water"" gas and is located in the center of the villageTranslated from Armenian",Dec-12-2022_21-18,,,https://list.am/en/item/17685737,,,
Country House,Stone,100 sq.m.,1,3,1,Available,Not available,Euro Renovation,2000 sq.m.,,,,,,Lorri › Spitak,"12,000,000 ֏",AMD,"Own house for sale in Spitak city, 3 rooms, with all utilities and built-in cupboards. The door of the house is iron, high quality bars are placed on the windows. The garden is cultivated with productive trees. Call for details.Also exchange with car at extra cost on your partTranslated from Armenian",Dec-12-2022_21-18,,"Fridge, stove, washing machine",https://list.am/en/item/17499698,"Electricity, water supply, natural gas, sewerage",,
House,Stone,2500 sq.m.,1,2,1,Not available,Not available,No Renovation,,,,,,,Lorri › Vanadzor,"$3,000",USD,"The house is located in Aznvadzor village, it is very suitable for cattle breeding, it has cut trees and other lands, we will exchange it with a car, urgentlyTranslated from Armenian",Dec-12-2022_21-18,,,https://list.am/en/item/17009762,,,
House,Monolith,54 sq.m.,1,3,1,Not available,Not available,Partial Renovation,300 sq.m.,,,,,,"Բուլղարական ավան 2-րդ թաղամաս 63, Վանաձոր","2,500,000 ֏",AMD,"It has a garden with productive trees, a capital building (monolithic) has 3 roomsGas, constant water, electricityThe house has a certificate of ownership and is in habitable conditionAddress: Bazumi Bulgarian settlement 2Translated from Armenian",Dec-12-2022_21-18,,,https://list.am/en/item/18655787,"Electricity, water supply, natural gas, sewerage",,Barbecue oven
House,Stone,350 sq.m.,2,5,1,By agreement,1 spot,Old Renovation,450 sq.m.,,,,,,Lorri › Vanadzor,"$39,000",USD,"The house is located next to the Palace of Culture of Ansnaur, for details you can call the numbers, or via Viber, it's my son (Sergey)Translated from Armenian",Dec-12-2022_21-18,,,https://list.am/en/item/18670118,"Electricity, water supply, natural gas, sewerage",,Barbecue oven
House,Stone,400 sq.m.,2,8+,1,Available,Not available,Cosmetic Renovation,,,,,,,"Улица Хай-Фидаиннери 25, Раздан","$65,000",USD,I will answer the questions by phoneTranslated from Armenian,Dec-12-2022_21-18,,"Fridge, stove",https://list.am/en/item/18669787,"Electricity, water supply, natural gas, sewerage",,
House,Stone,131 sq.m.,3,5,2,,,Partial Renovation,550 sq.m.,,,,,,"Alek Manoukyan street, Spitak","$30,000",USD,"3 STORY HOUSE FOR SALE IN SIPITAK CITY.There are productive trees in the plot of the house and a small building in the back where pets can be kept.The house has 3 floors (2 floors are residential, one is a basement with the entire surface of the house)On the FIRST floor there is a corridor, one bedroom, one living room, one kitchen, one bathroom, renovated. They can go down to the basement from the first floor. The kitchen window is made of euro, the other rooms are made of wood.On the SECOND floor there is one corridor, three rooms, one bathroom, not renovated. All windows - Euro.ADDRESS:K. WHITE, POLICE DISTRICT K9, 5/28-----Translated from Armenian",Dec-12-2022_21-18,,,https://list.am/en/item/18124953,,,
House,Stone,274 sq.m.,1,6,2,Not available,1 spot,Partial Renovation,,,,,,,"Nar-Dos street, Yerevan","$50,000",USD,"Own house for sale in the 2nd lane of Nar-Dos street, Vanadzor city. There are 3 buildings in one yard, 2 are residential. One: Partially renovated - euro door, window. The house is very close to Kpazt, 21st school. There is also a kindergarten in the area.Translated from Armenian",Dec-12-2022_21-18,,,https://list.am/en/item/18585599,,,
House,Stone,140 sq.m.,1,6,2,,,Old Renovation,810 sq.m.,,,,,,"1-й переулок улици Мясникяна, Ванадзор","$60,000",USD,2 stone house poles made of woodWill also be sold separatelyTranslated from Armenian,Dec-12-2022_21-18,,,https://list.am/en/item/16636532,,,
House,Stone,300 sq.m.,1,5,1,Not available,Not available,Partial Renovation,,,,,,,Lorri › Vanadzor,"$19,000",USD,"Stone house in Bosch burial, the price is negotiable, call for detailsTranslated from Armenian",Dec-12-2022_21-18,,,https://list.am/en/item/15705204,"Electricity, water supply",,
House,Stone,237 sq.m.,2,8+,2,Not available,Not available,Old Renovation,440 sq.m.,,,,,,"Ավետիք Իսահակյան փողոցի 3-րդ նրբանցք, Ստեփանավան","35,000,000 ֏",AMD,"The house is built after the earthquake, on a very strong and dry foundation. The house is located near the forest. Suitable for making a guest house. It is built very strong and earthquake resistant. The house has a basement. There are auxiliary buildings in the yard with legal grounds. Call for details.Will be exchanged for an equivalent apartment in Yerevan.Translated from Armenian",Dec-12-2022_21-18,,,https://list.am/en/item/18648720,"Electricity, water supply, natural gas, sewerage",,Fireplace
House,Stone,44 sq.m.,1,4,1,Not available,Not available,Old Renovation,699 sq.m.,,,,,,Lorri › Stepanavan,"$10,500",USD,"The house is located in Vardablur village of Lori region, the house has gas, light, water, a bakery, a plot of land, there is a barnTranslated from Armenian",Dec-12-2022_21-18,,,https://list.am/en/item/16056267,"Electricity, water supply, natural gas, sewerage",,
House,Stone,15 sq.m.,1,5,1,,,Partial Renovation,2 sq.m.,,,,,,Lorri › Vanadzor,"$25,000",USD,A 5-room private house is urgently for sale in Vanachor.The price is negotiable.Translated from Armenian,Dec-12-2022_21-18,,,https://list.am/en/item/18253672,,,
House,Stone,60 sq.m.,1,1,1,Not available,Not available,No Renovation,,,,,,,"Մոսկովյան փողոց, Վանաձոր","$5,300",USD,"Urgent land for sale with a half-built building, located in the center of the city, near the bus station, negotiable to the real buyer, I will exchange it with a carTranslated from Armenian",Dec-12-2022_21-18,,,https://list.am/en/item/17415201,,,
House,Stone,137 sq.m.,1,5,1,Available,Not available,Old Renovation,1300 sq.m.,,,,,,Lorri › Spitak,"$22,000",USD,"Продается крепкий дом 1993 года постройки из каменного туфа в селе Катнаджур ул. Первая. Крыша - металлочерепица, имеется бетонный подвал 25 кв. М, гараж в доме 21 кв. М, паровое отопление, электричество 220в, водопровод, рядом с забором проходит газопровод на расстоянии 5 метров, участок огорожен каменным туфом высотой 1,7м, на участке имеются плодотворные деревья - яблони и груши, сливы 10 шт. , имеется беседка из металлоконструкции. На окнах стоят декоративные фигурные решетки. Дом расположен в центре населенного пункта, 100м от автобусной остановки, магазины рядом, в деревне имеется школа, детский сад, деревня полностью заасфальтирована в 2021 году, в деревне проживают очень добрые люди, чистый воздух и хорошая экология, реальным покупателям торг. Переселенцам НКО хорошая скидка. Подробности по whatsup",Dec-12-2022_21-18,,,https://list.am/en/item/17662412,,,
House,Stone,1220 sq.m.,2,7,3+,By agreement,1 spot,Designer Renovation,566 sq.m.,,,,,,"Աբեղյան փողոց 23, Վանաձոր","40,000,000 ֏",AMD,"Stone, two-storey private house with 3 open balconies, 2 cellars, indoor swimming pool, garage, land near the house with orchard.Translated from Armenian",Dec-12-2022_21-18,,,https://list.am/en/item/17648649,,,
House,Stone,335 sq.m.,2,6,1,,,No Renovation,53 sq.m.,,,,,,Lorri › Vanadzor,"8,000,000 ֏",AMD,"A two-story private house for sale, it has all utilities, a garage, the house is located in the 3rd part, on Charentsi streetTranslated from Armenian",Dec-12-2022_21-18,,,https://list.am/en/item/18356184,,,
House,Stone,"10,000 sq.m.",2,3,1,,,Partial Renovation,1600 sq.m.,,,,,,Lorri › Akhtala,"$15,000",USD,"Constant water, constant electricity, gas is documented, it remains to be connected.The church of St. Mariam Astvatsatsin in Akhtala is visible from the balcony of the house.The garden is fruitful.Details by call.Price is negotiable.Translated from Armenian",Dec-12-2022_21-18,,,https://list.am/en/item/17740469,,,
House,Stone,1234 sq.m.,1,3,1,,,Old Renovation,2000 sq.m.,,,,,,Lorri › Lermontovo,"$21,500",USD,Call for urgent sales questionsTranslated from Armenian,Dec-12-2022_21-18,,,https://list.am/en/item/17508228,,,
House,Stone,195 sq.m.,1,4,1,Available,Not available,Cosmetic Renovation,831 sq.m.,,,,,,"Nizami street, Vanadzor","$32,000",USD,The house is in good condition. There are fruit trees and saplings in the land. The land is flat and well-kept. 5 minutes from the center. Everything is great with the documentation. NegotiableTranslated from Armenian,Dec-12-2022_21-18,,Stove,https://list.am/en/item/18556093,"Electricity, water supply, natural gas, sewerage",,
House,Stone,495 sq.m.,2,4,1,,,Old Renovation,495 sq.m.,,,,,,Lorri › Vanadzor,"$33,000",USD,"A two-story private house with a plot of land and a garage is for sale very urgently in the district in front of the city of Vanadzor, next to the 10th school. Price $35,000, negotiable.Translated from Armenian",Dec-12-2022_21-18,,,https://list.am/en/item/17943651,,,
House,Stone,700 sq.m.,1,5,1,Not available,Not available,Old Renovation,500 sq.m.,,,,,,Lorri › Vanadzor,"$40,000",USD,It is located next to the 8th school and the 5th kindergarten. Mashtots 28. Has an orchard. For more information call. Urgent bargainTranslated from Armenian,Dec-12-2022_21-18,,,https://list.am/en/item/18603615,"Electricity, water supply, natural gas, sewerage",,
