Type,Construction Type,Floor Area,Floors in the Building,Number of Rooms,Number of Bathrooms,Furniture,Garage,Renovation,Land Area,Number of Guests,Children Are Welcome,Pets Allowed,Utility Payments,Prepayment,Address,Price,Currency,Description,Datetime,Amenities,Appliances,Links,Service Lines,Condition,Facilities
Country House,Stone,250 sq.m.,2,4,2,Available,Not available,Major Renovation,1500 sq.m.,7,Yes,No,Included,By Agreement,Lorri › Vanadzor,"60,000 ֏ daily",AMD,"Summer house for rent, 7 km from Vanadzor city, in Pambak village. The summer house is completely renovated, it has a garden with fruit trees. There are handicraft pavilions and a swimming pool in the garden area. There is a sauna on the first floor. The sauna works for an additional fee. Call for details.Translated from Armenian",Nov-24-2022_23-03,,,https://list.am/en/item/17531644,,,
House,Stone,86 sq.m.,2,3,1,Available,1 spot,Euro Renovation,650 sq.m.,8+,Yes,No,Included,By Agreement,"Թելմանի փողոց 11, Ստեփանավան","20,000 ֏ daily",AMD,"Apartment for daily rent in the center of Stepanavan, in a convenient position, close to both city parks and supermarkets, has two bedrooms, up to 7-8 people.Translated from Armenian",Nov-24-2022_23-03,,,https://list.am/en/item/17974588,,,
House,Stone,87 sq.m.,1,3,1,Available,1 spot,Cosmetic Renovation,700 sq.m.,8+,Yes,No,Included,2 weeks,Lorri › Stepanavan,"40,000 ֏ daily",AMD,"A house is for daily rent on Telman Street, adjacent to the square of Stepanavan, 87 square meters. M. With an area that also has a garden, 700 sq. M.: The house is furnished with dishes and bedding. Internet, hot and cold water are widely available. Up to 7-8 people can stay in the house at the same time.Has,*2 bedrooms (2 double beds and 1 single bed)*living room (completely new folding sofa, TV, table, chairs)* kitchen (dishes, gas stove, refrigerator, microwave oven)* newly renovated bathroom*park (700 square meters, there are: Garage, hammock, flowers in the park)I can also offer an option for up to 12 people, as well as a 1-bedroom option.Arboretum is a 15-minute drive from the house, and the famous ""Aleia"" park can be reached on foot.There are shops, a supermarket and thrift stores in the area.The price depends on the days of the week, the number of people and the number of days.Translated from Armenian",Nov-24-2022_23-03,,,https://list.am/en/item/17741555,,,
Country House,Wooden,56 sq.m.,1,2,1,,,Cosmetic Renovation,600 sq.m.,6,Yes,Yes,By Agreement,By Agreement,"Միլիոնի փողոց 154, Ստեփանավան","15,000 ֏ daily",AMD,"A house is for daily rent in one of the most beautiful districts of Stepanavan. It is located next to the pine park։ forest.It is provided with gas, hot and cold permanent water. It has a parking space, a large, very comfortable yard with a swing, a net swing.The house is a small house with a beautiful Russian color, hidden in the lap of secular nature of Lori.Your fairytale rest is guaranteed.Address: 154 Million.It is given for at least 2 days, in case of long-term there will be price discounts. Entrance at 14:00, exit at 12:00. For more information call.#Stepanavan #oravarcov #poshotum:#dacha #antar #hangist #dusting#house #forest#for daily rent #Stepanavan #dacha#restTranslated from Armenian",Nov-24-2022_23-03,,,https://list.am/en/item/14156124,,,
House,Stone,100 sq.m.,2,8+,3+,Available,Not available,Euro Renovation,400 sq.m.,5,Yes,Yes,Not included,2 months,"Sos Sargsyan Street 12, Stepanavan","140,000 ֏ monthly",AMD,"Being located in the center of the city, directly in the square, gives an opportunity to carry out office, banking, cafe, hotel and other activities. New heating system, Ariston. It is for long-term rent (the sale option can be considered)Translated from Armenian",Nov-24-2022_23-03,,,https://list.am/en/item/17117241,,,
House,Stone,80 sq.m.,1,3,1,Available,3 or more spots,Euro Renovation,400 sq.m.,8+,Yes,Yes,By Agreement,Without prepayment,"Sos Sargsyan Street 1, Stepanavan","15,000 ֏ daily",AMD,"Near Stepanavan forest, a private house is for daily rent. The house is in a clean and perfect condition. It is very close to the forest, where the pollination of pines will start soon. The pictures are real.Translated from Armenian",Nov-24-2022_23-03,,,https://list.am/en/item/17692686,,,
House,Stone,100 sq.m.,1,2,1,Available,1 spot,Designer Renovation,,6,Yes,No,Not included,1 month,Lorri › Stepanavan,"60,000 ֏ monthly",AMD,"Сдается частный дом в СтепанаванеПостоянный газ, горячая и холодная водаДом отапливается газовой печкоймебельтехникаавтостоянкабарбекюՎարձով է տրվում առանձանտուն Ստեփանավանումմշտական գազ, տաք և սառը ջուրառանձնատունը ջեռուցվում է գազի վառարանով,կահույք, տեխնիկասանհանգույցը սալիկապատմեքենայի կայանատեղիմանղալ",Nov-24-2022_23-03,,,https://list.am/en/item/15547674,,,
House,Stone,160 sq.m.,2,4,1,,2 spots,Euro Renovation,450 sq.m.,8+,Yes,No,Included,By Agreement,Lorri › Stepanavan,"50,000 ֏ daily",AMD,"Օրավարձով է տրվում տուն` Կապիտալ վերանորոգված, ունի գազ, լույս, մշտական տաք և սառը ջուր, բաց պատշգամբ, ավտոկայանատեղի:Частный дом с капитаьным ремонтом здаётся в аренду со всеми комунальными удобствами. Также имеется открытый большой балкон для посиделок и автостоянка.",Nov-24-2022_23-03,,,https://list.am/en/item/17107742,,,
House,Stone,130 sq.m.,2,5,1,,,Major Renovation,200 sq.m.,,,,,,Lorri › Vanadzor,"35,000 ֏ daily",AMD,"Dream house Vanadzor:Dream house VanadzorDAILY HOUSE is located in the center of Vanadzor, next to a new church and hospital, close to the botanical garden, the square, Artsakh Park. 13 people can spend the night in a family-friendly environment. THE PRICE CAN DECREASE ալ increase depending on the number of people և, the heating season. In the garden there is a barbecue, a pavilion, an open balcony with a swing-corner, a pond with fish and water lilies. 3 cars can be parked in the garage.ACCOMMODATION FOR DAILYTranslated from Armenian",Nov-24-2022_23-03,,,https://list.am/en/item/16186376,,,
House,Stone,100 sq.m.,2,1,2,,,Cosmetic Renovation,,,,,,,"Surb Nshan street, Stepanavan","90,000 ֏ monthly",AMD,"The 2nd floor of a private house with all communal amenities is for daily rent, monthly payment. It has an open balcony, constant hot-cold water, gas, washing machine, WI-FI, refrigerator and TV. If you wish, you can order food. Networks are set up with European windows. There is a big garden around the house, a swing for children, there is a barbecue.Only for a short period of the year, in May-June, pine forests produce phytoncide substances, which are extremely invigorating for people with respiratory problems.It is a pleasant, bright, comfortable home for living.Home has a carpenter, all necessary furniture, set of courts, internet, Clean bed, washing machineA large yard around the house with a well-organized children's square, and a barbecueHome is located in Konce Goroda, in Shagovi Dostupnosti - two magazines.15 minutes walk to the center:Translated from Armenian",Nov-24-2022_23-03,,,https://list.am/en/item/17810528,,,
House,Stone,70 sq.m.,2,2,2,,,Cosmetic Renovation,120 sq.m.,4,Yes,Yes,Not included,By Agreement,"Surb Nshan street, Stepanavan","70,000 ֏ monthly",AMD,"Сдаю 1 этаж собственного дома в Степанаване со всеми удобствами. Газ, постоянная вода, Wi-fi, чистая постель, вся необходимая посуда. Нахрдится в прекрасном для отдыха месте.",Nov-24-2022_23-03,,,https://list.am/en/item/17811637,,,
House,Stone,300 sq.m.,3,6,2,,,Euro Renovation,600 sq.m.,8+,Yes,No,Included,By Agreement,"Կամոյի փողոց 30, Ստեփանավան","20,000 ֏ daily",AMD,"A spacious private house is for daily rent in c. In Stepanavan, provided with all communal facilities, 5 bedrooms, living room, kitchen, on both floors there is a bathroom, the house is located in the central part, 7 km away from the arboretum, 1 km from the alley, there is a barbecue, an open-air pavilion, a flower garden, for families, Wi Fi, backgammon, lottoTranslated from Armenian",Nov-24-2022_23-03,,,https://list.am/en/item/17758771,,,
House,Bricks,150 sq.m.,2,5,2,,,Major Renovation,1100 sq.m.,,,,,,"Forest Street, Stepanavan","40,000 ֏ daily",AMD,"It is for daily rent in 2022. Fully renovated, private house with all living conditions in Gyulagarak village (3 km away from Dendropark) The house is designed for 10 people. The guest house has 2 different entrances, can accommodate for 2 different groups. The house has a hundred-year history, was built in 1905.House for daily rent in Stepanavan, arboretum, dusting, Lori rest. House for rent in GyulagarakTranslated from Armenian",Nov-24-2022_23-03,,,https://list.am/en/item/17876658,,,
Country House,Stone,200 sq.m.,2,4,2,,,Euro Renovation,2000 sq.m.,,,,,,Lorri › Gyulagarak,"50,000 ֏ daily",AMD,"A private house is for daily rent in Gyulagarak, 2 km away from Dendropark Botanical Garden. The house has all the communal facilities, 3 bedrooms, a large living room, a kitchen, 2 bathrooms, a spacious yard with a large pavilion, a summer kitchen (hot water available), a barbecue.: Designed for 10-15 people. Price: Up to 10 people - 50,000 drams.Gyulagarak, Dendropark, StepanavanGulagarag, Dendropark,Gyulagarak, Dendropark, gyulagarak, GyulagarakTranslated from Armenian",Nov-24-2022_23-03,,,https://list.am/en/item/17699801,,,
House,Stone,80 sq.m.,1,2,1,,,Designer Renovation,2500 sq.m.,5,Yes,Yes,Not included,By Agreement,Lorri › Gyulagarak,"200,000 ֏ monthly",AMD,"6 месяцев 150.000 др3 месяцев 200.000 дрСдается без посредника собственный дом в Глагараке. Расположен от Еревана 140 км, от Степанавана 10 км, от Ванадзора 25 км, от Дендропарка 3 км.Предусмотрены все необходимые удобства.Около 2500 квм плодовой сад, большая парковка.",Nov-24-2022_23-03,,,https://list.am/en/item/17467202,,,
House,Stone,100 sq.m.,1,3,1,Available,Not available,Major Renovation,400 sq.m.,4,Yes,No,Not included,2 months,"409 Դիվիզիայի փողոց, Ստեփանավան","300,000 ֏ monthly",AMD,Զանգեք վատսափին։տրվում է միայն երկարաժամկետ. Звоните на WhatsApp. Дом сдается на длительный срок. Обязательно за 3 месяца в перёд...Translated from Armenian,Nov-24-2022_23-03,,,https://list.am/en/item/18240399,,,
Country House,Wooden,35 sq.m.,2,2,1,,,Designer Renovation,300 sq.m.,,,,,,"Hakob Meghapart street, Stepanavan","20,000 ֏ daily",AMD,"A two-storey wooden house is for daily rent in Stepanavan city for 4-5 people, permanent hot-cold water, gas, light, wifi, small garden swing besedka barbecue fireplace. You can call the mentioned phone numbersTranslated from Armenian",Nov-24-2022_23-03,,,https://list.am/en/item/17768123,,,
House,Stone,300 sq.m.,2,8+,2,,,Major Renovation,1300 sq.m.,,,,,,Lorri › Vanadzor,"7,000 ֏ daily",AMD,"Беспрецедентные временные скидки в наших гостевых домах:1 человек1 отдельная уютная комната1 ночь /Постель без завтрака/7.000 драмовВ наших объявлениях мы стремились предложить всевозможные доступные и удобные варианты проживания для каждого гостя!Капитальный каменный дом полностью оборудованный бытовой техникой и мебелью - со всеми удобствами в тихом и спокойном месте в городе Ванадзор.Доступное предложение:*За ежемесячную плату, то есть намного доступными средствами, чем посуточные цены, но те же самыми условиями можете прожить в гостевых домах ""Винтаж"" & ""Мансард"" бронируя только отдельную комнату, ту, которую предпочтете:*Двухместная комната- 95.000 драмов ежемесячно.*3-4 местный - 115.000 др.* 5-6 местный - 145.000 др.*** Для размещения больших групп по требованию гостей мы готовыпредложить добавочные спальные места в нашей уютной и просторной гостиной, по 30.000 драмов ежемесячно.****Ежемесячной платой вы можете бронировать дом целиком, которая в зависимости от числа гостей будет стоить примерно 250.000 - 350.000 драмов.Каменный капитальный дом, прекрасная природа, просторные комнаты, элегантный винтажный дизайн интерьера, замечательный вид из балкона, большой гараж, просторный садовой участок с деревьями, туалет и ванная отдельны друг от друга, центральное отопление в доме.Мы пытаемся организовать для вас домашнюю атмосферу теплоты и уюта, позаботиться о вашем комфорте.*Посуточные условия։1 день- 50.0002 д. - 60.0003 д. - 80.0004 д. - 100.0005 д. - 120.0006 д. - 140.0007 д. - 160.000При более длительном сроке проживания условия и цены рассмотриваются.Наше следующее предложение, это проживание в нашем гостевом доме в качестве типа ""Постель и завтрак"" со следующими скидками:* 1 человек - 9.000 драмов* 2 ч. - 15.000 д.Гостевые дома ""Винтаж & Мансард"" приветсвуют вас на северном уголке Армении в прекрасной на все времена года области Лори. Окружённый горами и глубокими ущельями Лори поражает своей красотой.Из окон почти каждого дома в нашем городе можно любоваться неповторимым горным пейзажом- зрелище которое наполняет душу каким то неповторимым ощущением тишины и покоя...""Vintage & Mansard"" հյուրատները սիրով ողջունում են Ձեզ և հոգ տանում յուրաքանչյուրիդ հարմարավետության և յուրահատուկ ընդունելության համար։ Վարում ենք ճկուն և բազմազան գնային քաղաքականություն.5 և ավել հյուրերի դեպքում կգործեն աննախադեպ զեղչեր.*Գիշերակաց և նախաճաշ1 անձ 9.000 դրամ2 անձ 15.000 դրամ*Տունը վարձակալելու դեպքում օրավարձի արժեքն է 40.000 դրամ, որն իր մեջ ներառում է'*3 ընդարձակ ննջասենյակ' 8 մահճակալով (ըստ անհրաժեշտության մահճակալների թիվը կարող ենք ավելացնել)* մեծ հյուրասենյակ*հարմարավետ խոհանոց' հագեցած սպասքով* ընդարձակ բաց պատշգամբ* առանձին լոգասենյակ* ընդարձակ բակ* այգի* ավտոտնակԱպահովված կլինեն.* բարձրորակ ճերմակ անկողնային պարագաներ*լվացքի մեքենա*արդուկ*հիգիենայի պարագաներ *վարսահարդարիչ*սպասք* թեյնիկ* թեյ* սուրճ և այլն։Օրավարձի համար գործում է գնային ճկուն համակարգ.1օրը 50.000դրամ2 օրը 60.000 դրամ3 օրը 80.000 դրամ4 օրը 100.000 դրամ5 օրը 120.000 դրամ6 օրը 140.000 դրամ7 օրը 160.000 դրամ1 շաբաթից ավել վարձակալելու դեպքում գները և պայմանները կփոփոխվեն' նաև կախված անձանց քանակից։ՇԱՀԱՎԵՏ ԱՌԱՋԱՐԿ.Ամսավարձով, այսինքն առավել մատչելի տարբերակով կարող եք վարձակալել առանձին սենյակ հյուրատանը և օգտվել հյուրատան վերը նշված բոլոր հարմարություններից և առաջարկվող պայմաններից.Սենյակների արժեքները.**Երկտեղանոց-ամսական 95.000 դրամ*** 3-4 տեղանոց- ամսական 115.000 դրամ****5-6 տեղանոց- ամսական 145.000 դրամ*Եթե հյուրերը մեկ խումբ են և նրանց թիվը գերազանցում է նշված 10-12 անձը, առաջարկում ենք մեր ընդարձակ հյուրասենյակը ևս հագեցնել անհրաժեշտ քանակությամբ մահճակալներով, յուրաքանչյուր ավելացրած մահճակալի համար վճարելով ամսական ընդամենը 30.000 դրամ։* Ամսավարձով ամբողջ տունը վարձակալելու դեպքում արժեքը կլինի մոտ 250.000-350.000 դրամի սահմաններում' կախված հյուրերի քանակից։Նկարագրությունը.Քարե երկհարկանի առանձնատուն Լոռվա հրաշք բնության գրկում' Գուգարք համայնքում' Վանաձորի կենտրոնից ընդամենը 5 րոպեի հեռավորության վրա։Հիանալի փայտե մանրահատակով, առանձին լոգասենյակով և սանհանգույցով, ննջասենյակներն ընդարձակ են, միայն մեկ հարկը նախատեսված է 10 և ավելի անձանց համար։ Կահավորված է նրբաճաշակ վինտաժային ոճով։ Ջեռուցվում է անհատական ջեռուցման համակարգով։ Բարձրադիր դիրքի շնորհիվ պատշգամբից ունի գեղեցիկ տեսարան։ Ունի ավտոտնակ' նախատեսված երկու ավտոմեքենայի համար, ունի ընդարձակ բակ և այգի։Գինը և պայմանները փոփոխական են (Սնունդով կամ առանց սննդի)**Նախաճաշ, ճաշ, ընթրիք, աղանդեր։Պայմանները և արժեքները' կախված անձանց քանակից։Զանգահարեք, սիրով կպատասխանենք։",Nov-24-2022_23-03,,,https://list.am/en/item/17039240,,,
House,Stone,186 sq.m.,2,4,2,Available,1 spot,Major Renovation,300 sq.m.,7,Yes,Yes,Not included,By Agreement,"Сottage 4th street 4, Vanadzor","200,000 ֏ monthly",AMD,"Տրվում է վարձով երկարաժամկետ (օրավարձով) ։Մանրամասների համար զանգեք։ (Նաև վաճառվում է)Сдаётся на аренду 2 этажный дом в городе Ванадзор.От центральной площади расстояние 3 километров.Отопление-газовый печь (Экономичная) Рядом есть супермаркет, общественный транспорт, пикарня. Дом комфортный с мебелью. Могут жить до 7 человек. Потробности звоните по номеру.",Nov-24-2022_23-03,,,https://list.am/en/item/17547193,,,
Country House,Stone,72 sq.m.,1,3,1,Available,Not available,Major Renovation,1000 sq.m.,8+,Yes,Yes,Included,2 weeks,Lorri › Stepanavan,"5,000 ֏ daily",AMD,"The private house is located in Gargar village, Stepanavan region, Luri region, on the river bank, near Dendropark. It is newly built, all the communal and household amenities are available.Hot առը cold watergas stoverefrigeratorվայֆայ:Bathroom, 2 bedrooms with double beds, children's bed, dining room furniture opening (for 4 people to sleep) The house has a big yard. There is a pavilion in the yard (besetka) with its barbecue, big swinging deer. The price varies depending on the number of people: Days#Holiday in Lori#Dendropark# Stepanavan#Pine# Dusting# River # riverbank#Dendropark_dustingDendropark ###Dendropark ###Gargar ###Gyulagarak ###Pushkino ###Stepanavan ###Lori berd ###1 person - 5000 dailyMinimum daily housekeeping - 20000 AMDTranslated from Armenian",Nov-24-2022_23-03,,,https://list.am/en/item/17325633,,,
Country House,Stone,75 sq.m.,1,3,1,Available,Not available,Cosmetic Renovation,120 sq.m.,4,Yes,No,By Agreement,By Agreement,Lorri › Stepanavan,"30,000 ֏ daily",AMD,"READ CAREFULLY NEW CALL!In the city of Stepanavan (long-term until spring, beginning of May) a 3-room private house is for daily rent (two to three) Suitable for (seasonal) recreation, provided with all utilities(cylinder gas)A beautiful view of the colorful forests and mountains of Lorva. A very suitable place for nature lovers, to get away from the noise of the city, to organize a complete rest.It has a very convenient yard for parking 3 cars at once, a barbecue grill.Daily wage, 20,000 AMD. (the price is negotiable depending on the number of persons and days)Hot and cold waterrefrigeratordishes2 bedrooms with double bedsdining room furniture#HangistLori# Arboretum#Stepanavan#Pine#Pollination#Arboretum_pollinationDendropark###Arboretum###vayber:Translated from Armenian",Nov-24-2022_23-03,"TElevision, barbecue oven","FRidge, stove, microwave, coffee maker, washing machine, water heater, iron",https://list.am/en/item/16866821,,,
House,Stone,78 sq.m.,1,3,1,Available,Not available,Cosmetic Renovation,140 sq.m.,5,Yes,No,By Agreement,By Agreement,"Գերմանական թաղամաս 3, Ստեփանավան","30,000 ֏ daily",AMD,"In the city of Stepanavan (long-term until the beginning of May) a 3-room private house is for daily rent (two with three units) Suitable for (seasonal) recreation, provided with all utilities(cylinder gas)A beautiful view of the colorful forests and mountains of Lorva. A very suitable place for nature lovers, to get away from the noise of the city, to organize a complete rest.It has a very convenient yard for parking 3 cars at once, a barbecue grill.Daily wage, 20,000 AMD. (the price is negotiable depending on the number of persons and days)Hot and cold waterrefrigeratordishes2 bedrooms with double bedsdining room furniture#HangistLori# Arboretum#Stepanavan#Pine#Pollination#Arboretum_pollinationDendropark###Arboretum###Translated from Armenian",Nov-24-2022_23-03,"TElevision, barbecue oven","FRidge, microwave, coffee maker, washing machine, water heater, iron",https://list.am/en/item/17869892,,,
