House,Stone,185 sq.m.,1,8+,1,,,Old Renovation,682 sq.m.,,,,,,"Գետափնյա փողոց 5, Ստեփանավան","$20,000",USD,Call for more informationTranslated from Armenian,Dec-12-2022_21-18,,,https://list.am/en/item/17808599,,,
House,Stone,65 sq.m.,1,2,1,,,Partial Renovation,370 sq.m.,,,,,,"Բաղրամյան փողոց 130, Ստեփանավան","$26,000",USD,"One-storey private house with all communal facilities is for sale on the central street. Has one room, one living room, renovated kitchen, bathroom, heating system (Baxi) Euro windows are installed. There is a basement along the house. In the front there is a garden with fruit trees. The front is suitable for creating a business space. There is also an old house in the yard.Translated from Armenian",Dec-12-2022_21-18,,,https://list.am/en/item/17234183,,,
,Stone,1500 sq.m.,,7,,,,,,,,,,,Lorri › Tashir,"$30,000",USD,"Վաճառվում է երկհարկանի տուն, ներքին հարդարման աշխատանքները անավարտ են (11,4×12) մ, մանսարդ։ Ընդհանուր հողամասը 1500 քմ։ առկա է շինանյութ օժանդակ կառույցի համար։ Հասցեն Լոռու մարզ, քաղաք Տաշիր, Բաղրամյան (Կրուպսկայա) 1 ա, հասանքը և ջրամատակարարումը առկա, գազաֆիկացված չէ, գազատարը մոտ 10մ։Տարածքը ցանկապատված է։ Շինության նախագիծում նախատեսված է բազմաֆունկցիոնալ կիրառում, բնակելի, հյուրանոց սննդի և այն ըստ նպատակի։ Տարածքը հարմար է անասնապահություն կազմակերպելու տեսանկյունից։ գինը 30000 $ սակարկելի։Հնարավորա նաև փոխանակել բնակարանի հետ Երևանում:",Dec-12-2022_21-18,,,https://list.am/en/item/11481665,,,
House,Stone,240 sq.m.,2,6,1,,,Cosmetic Renovation,120 sq.m.,,,,,,"Baghramyan Str, Stepanavan","25,000,000 ֏",AMD,"СРОЧНО! Продаётся дом магазины, в центре г Степанаван, по адресу Бахрамян 27, могазины в данном время задаются и приносят прибыли! Также можно оформить в ипотеку! Рялному покупателя ест не большой Торг, подробно по телефону... Цена окончательно. Это цена до конца месяца",Dec-12-2022_21-18,,,https://list.am/en/item/12891822,,,
House,Stone,240 sq.m.,2,5,3+,,Not available,Major Renovation,2200 sq.m.,,,,,,Lorri › Dsegh,"$220,000",USD,"Продаётся гостевой дом.Находится на самой оживленной туристической дороге в сторону озера. 80 от центра Дсеха.Общая площадь территории 2200 квадратных метра, из которых 240 кв. М. Жилой площади.6 спальных комнат общей вместимостью 18 человек. Возможно расширить / достроить до 1650 кв м.4 санузла.Кухня - закрытая часть 36 кв м, веранда 36 кв м.Со всеми коммуникациям по всей территории. Собственная выделенная канализация. Электричество, газ, холодная и горячая вода, с баком и бойлером для горячей воды.По всем помещениям проведено отопление по системе Бакси.Средний доход в месяц от работы в качестве гостиницы от 3000$ и выше.Проект сдаётся под ключ до 2023 года.",Dec-12-2022_21-18,,,https://list.am/en/item/18396745,,,
House,Stone,272 sq.m.,2,4,1,,,No Renovation,600 sq.m.,,,,,,Lorri › Stepanavan,"$11,000",USD,"A half-built house is for sale in K. STEPANAVAN 4 MICROSHRJANOLM 1A STREET House 23 IN. 600 square meters of land. The building is 272 square meters, all communications, water, electricity, gas, sewer, 3 meters away, for details, call the given number on WhatsApp.Translated from Armenian",Dec-12-2022_21-18,,,https://list.am/en/item/17857864,,,
House,Stone,196 sq.m.,2,7,1,Not available,2 spots,Partial Renovation,1260 sq.m.,,,,,,"Griboyedov street, Tashir","$12,000",USD,"Ташир, Село Дзорамут, находитса рядом ташир-тблиси межгасудаствени траси. Фруктови садови участк, гараж, каровник, вада, територя 1260 кв. М. Огарожена;",Dec-12-2022_21-18,,,https://list.am/en/item/17669773,,House is Finished,
House,Stone,300 sq.m.,1,3,1,,,Old Renovation,300 sq.m.,,,,,,"Նելսոն Ստեփանյան փողոց 2-րդ նրբանցք 10, Վանաձոր","$15,000",USD,"Stone house in Vanadzor, 300 sq. M. Call real buyers, the house is located in the front district, near the 10th school, there is everything near the bus stop, the area for sale is mainly negotiable for the real buyer.Translated from Armenian",Dec-12-2022_21-18,,,https://list.am/en/item/17359480,,,
House,Stone,100 sq.m.,3,5,2,Not available,1 spot,No Renovation,200 sq.m.,,,,,,"Улица Ширакаци, Ванадзор","$18,000",USD,Продается два дома в деревне ваагни кировакан. Для подробной информации просьба обращаться по данному номеру.Продажа возможна и по отдельности,Dec-12-2022_21-18,,,https://list.am/en/item/16911322,,House is Unfinished,
House,Monolith,290 sq.m.,3,8+,3+,,,Cosmetic Renovation,427 sq.m.,,,,,,"Vardanants Street, Vanadzor","$99,000",USD,"Two-storey private house with an attic is for sale:Vardanants 62b address. Newly built stone building, has a basement, the internal renovation works are unfinished.Translated from Armenian",Dec-12-2022_21-18,,,https://list.am/en/item/17876773,,,
House,Stone,400 sq.m.,3,7,2,Available,Not available,No Renovation,,,,,,,Lorri › Vanadzor,"$40,000",USD,"АДРЕС УЛИЦА ГРИГОРА НАРЕКАЦИ ДОМ 11 В ШАГОВОЙ ДОСТУПНОСТИ НЕДАВНО ПОСТРОЕННЫЙ ОТ ШКОЛЫ АКСЕЛА БАКУНЦА 7 Продается каменный дом, трехэтажный построен после землетрясения ЦЕНА ЗА ДОМ 40 000$ Площадь дома 400м2 имеется железобетонный монолитный подвальный этаж площадь его равна 80м2 + маран 10м2,высота потолков 3 метра на всех этажах и в подвале. Все потолки монолитные. Рядом с домом есть школа имени Аксела Бакунца 7, недавно построена в шаговой доступности. В доме имеются с фасадной стороны две железные ворота один маленький для легковых машин, вторые большие заезд под дом для грузового транспорта, площадь которого 70м2,ширина и высота 4 метра длинна 18 метров. На первом этаже сан узел и отдельный туалет кухня одна комната и большой гараж на две машины в котором есть смотровая яма. На втором этаже 5 комнат гостинная и сан узел, имеется недостроенный мансардный этаж площадь которого 90м2 высота потолков 2,5 м. В доме есть канализационный септик. Рядом с домом проходит новая водопроводная магистраль котораяподведена к дому. Есть электричество вода и газ. Удобен для постоянного проживания и также для бизнеса. С документами все в порядке. ЦЕНА ДОГОВОРНАЯ. СОБСТВЕННИК, ЗВОНИТЕ КАЖДЫЙ ДЕНЬ С 9 ДО 23 8-968-633-51-51",Dec-12-2022_21-18,,,https://list.am/en/item/17615139,,House is Finished,
House,Stone,200 sq.m.,2,7,1,Not available,Not available,Old Renovation,,,,,,,Lorri › Vanadzor,"$59,000",USD,"ПРОДАЮТСЯ ДВА КАМЕННЫХ ДОМА ПО АДРЕСУ УЛИЦА НАРЕКАЦИ ДОМ 11 В ШАГОВОЙ ДОСТУПНОСТИ ОТ ШКОЛЫ НЕДАВНОЙ ПОСТРОЕННОЙ АКСЕЛА БАКУНЦА 7 В одном участке площадь участка равна 600 м2, цена за два дома 59 000$ Если имеется нехватка денежных средств то частью суммы можно расплатиться (обмен) машиной (2010-2015 год выпуска) и квартирой в городе. Второй дом отдельно не продается, только вместе с первым. Первый дом продается отдельно, построен после землетрясения. Цена за первый дом 39000$ который находится вдоль улицы. Торг уместен только для тех кто купит два дома без обмена, можно договориться об отсрочке если нет возможности оплатить сразу за второй дом. Первый дом трехэтажный который с фасадной стороны имеет арочные окна и две металлические ворота один большой для грузовых машин второй маленький для легкового транспорта два машинных места, а также есть железобетонный монолитный подвальный этаж площадь которого 80 м2 и маран с площадью 10 м2 для хранения овощей фруктов и домашних консервов. Все перекрытия этажей железобетонные монолитные. На первом этаже одна спальная комната, кухня, совместный санузел и отдельный туалет, гараж, в гараже имеется смотровая яма. Высота потолков на втором этаже три метра, 4 спальни, гостевая комната, балкон по всей ширине дома и недостроенный совместный санузел, мансардный этаж не построен площадь 90 м2.В доме есть электричество газ и вода, все этажи полностью оштукатурены, есть канализационный септик. Рядом с домом проходит новая водопроводная магистраль котораяподведена к дому. Документация в порядке. СОБСТВЕННИК. ЦЕНА ДОГОВОРНАЯ. Очень удобное расположение для бизнеса а также для постоянного проживания. Звоните в любой день с 9 до 23. 8-968-633-51-51 Миша",Dec-12-2022_21-18,,,https://list.am/en/item/16419647,,House is Finished,
House,Stone,200 sq.m.,1,8+,3+,,,Partial Renovation,,,,,,,Lorri › Vanadzor,"$40,000",USD,Private house at 5 Paronyan Street has 3 entrances to a very big houseTranslated from Armenian,Dec-12-2022_21-18,,,https://list.am/en/item/15958069,,,
House,Panels,240 sq.m.,2,5,1,Not available,3 or more spots,Major Renovation,500 sq.m.,,,,,,"Երևանյան խճուղի, Վանաձոր","$60,000",USD,"The house is located on the sidewalk directly in front of the Glori sewing factory. The first floor is not renovated, it is very convenient to use as a workshop, the second floor is renovated and is not inhabited and has never been. Water and electricity availableTranslated from Armenian",Dec-12-2022_21-18,,,https://list.am/en/item/18070656,,House is Unfinished,
House,Stone,179 sq.m.,1,3,1,Not available,1 spot,Old Renovation,,,,,,,Lorri › Tashir,"$20,000",USD,The house is located on 12 Abovyan Street in Tashir city. The house is 1 story and has a basement. It has 3 rooms. The bathroom and toilet are located on the basement floor. In the yard of the house there is a garage of 46 square meters. M: There is a plot of land at the back of the house.Translated from Armenian,Dec-12-2022_21-18,,,https://list.am/en/item/18629133,"Electricity, water supply, natural gas, sewerage",House is Finished,
House,Stone,119 sq.m.,1,4,2,Not available,Not available,Euro Renovation,,,,,,,"11-րդ փողոց, Արջուտ","$25,000",USD,"Newly built private house in Lernapat village for sale, newly built and uninhabited. The kitchen and bathroom are tiled. Laminate flooring in the interior and rooms. All the pictures are his.Translated from Armenian",Dec-12-2022_21-18,,,https://list.am/en/item/18156993,,House is Finished,
House,Stone,213 sq.m.,2,5,1,Available,Not available,Cosmetic Renovation,180 sq.m.,,,,,,"Նանսենի փողոց 1, Ստեփանավան","17,000,000 ֏",AMD,"A two-story stone house is for sale in the city of Stepanavan.The residential house is 187.12 square metersLivestock building 20.96 square metersEconomy room 4.86 square metersEnclosure 2.7 sq m and 1.4 sq mThe house is located next to Alea, from where there is a beautiful view of the pine forest. The house is very sunny and bright. It is sold with kitchen furniture.The price of the house: 17,000,000 AMD.Translated from Armenian",Dec-12-2022_21-18,,,https://list.am/en/item/18143426,,House is Finished,
House,Stone,300 sq.m.,3,5,2,By agreement,1 spot,Euro Renovation,520 sq.m.,,,,,,"Մանուշյան փողոց, Վանաձոր","$147,000",USD,It is possible to exchange with an apartment for an additional fee. Some property is also given with the house.Only genuine buyers please callTranslated from Armenian,Dec-12-2022_21-18,,,https://list.am/en/item/16513168,,House is Finished,"Barbecue oven, gazebo"
House,Stone,400 sq.m.,2,4,3+,Not available,1 spot,No Renovation,,,,,,,"Forest Street 1/1, Stepanavan","$12,000",USD,"Տունը գտնվում է կիսակառույց վիչակում առաչի հարգի առաստաիւը բիտօնիցե (մոնոլիտ) տան հասցեն նանսենի թաիւամասում առաչվա (սովետների) մօտե ալեա այգուն 500Մ հեռավորությամբ, մոտե քաղաքի այգուն, կփոխանակեմ մեքենայի հետ",Dec-12-2022_21-18,,,https://list.am/en/item/14471824,,House is Unfinished,
House,Stone,200 sq.m.,2,4,2,Available,1 spot,Cosmetic Renovation,1000 sq.m.,,,,,,Lorri › Tashir,"10,000,000 ֏",AMD,"A two-story private house is for sale in Tashir. The 2nd floor has been renovated, some of the windows have been replaced. There are several other buildings attached to the house, including a large garage, and there is also land. The house is located in a good location, the street is paved, it has night lighting.Translated from Armenian",Dec-12-2022_21-18,,,https://list.am/en/item/17980753,,House is Finished,
House,Stone,800 sq.m.,2,4,1,Not available,Not available,Partial Renovation,3000 sq.m.,,,,,,"3rd lane 3rd street, Darpas","$25,000",USD,"The house is in Dapas village, everything is in the center of the village, the kindergarten is very close, the rest of the details, callTranslated from Armenian",Dec-12-2022_21-18,,,https://list.am/en/item/18489664,,House is Unfinished,
House,Stone,360 sq.m.,3,6,3+,Available,2 spots,Major Renovation,600 sq.m.,,,,,,"Զորավար Անդրանիկի փողոց 50/1, Վանաձոր","39,900,000 ֏",AMD,"Own 3-storey house for sale at Zoravar Andranik 50 (camp district), total 600 sq/m, each floor of the house is 120 sq/m, the house was built in 2000, 3 bathrooms, each floor has individual heating system (baxi), garage + basement floor, apartment has security system (The apartment is sold with the entire property.Translated from Armenian",Dec-12-2022_21-18,,,https://list.am/en/item/18436095,,House is Finished,
House,Stone,267 sq.m.,3,8+,2,,,No Renovation,95 sq.m.,,,,,,"Լոռու խճուղի, Վանաձոր","$20,000",USD,"The apartment is located in Gugark (Meghrut) community, 2nd apartment on 12th street, on 3rd street, has all the communal facilities, big garage (boxing), price is negotiableTranslated from Armenian",Dec-12-2022_21-18,,,https://list.am/en/item/17492671,,,
House,Stone,500 sq.m.,3,8+,3+,,,Partial Renovation,3000 sq.m.,,,,,,Lorri › Vanadzor,"$35,000",USD,The house is located in Darpas. With all the amenities J. 044200540:Translated from Armenian,Dec-12-2022_21-18,,,https://list.am/en/item/16884733,,,
Country House,Stone,78 sq.m.,2,2,1,Available,Not available,Cosmetic Renovation,2800 sq.m.,,,,,,Lorri › Gyulagarak,"$75,000",USD,"Do not call with meaningless questions, I will exchange with your car for an additional fee or with an apartment in Vanadzor, I will also sell some plots of landTranslated from Armenian",Dec-12-2022_21-18,,,https://list.am/en/item/17936043,,House is Finished,
House,Bricks,90 sq.m.,1,4,2,,,Partial Renovation,1000 sq.m.,,,,,,Lorri › Vanadzor,"$15,500",USD,"A detached house is for sale in the village of Pushkino, the condition is residential, it has a garden with fruit trees, as well as shared land, 1000m of arable land and a grass area of 1500m, there is water and electricity, gas is attached to the house, the basement is separate from the house, there is a barn for 2 cattle, there is also a room for small cattle attached to the barn. 4 rooms, call for details.Translated from Armenian",Dec-12-2022_21-18,,,https://list.am/en/item/17428305,,,
House,Stone,160 sq.m.,2,5,1,Not available,1 spot,No Renovation,3600 sq.m.,,,,,,Lorri › Akhtala,"$45,000",USD,A house near Akhtala church is for sale. It is suitable for a guest house.Translated from Armenian,Dec-12-2022_21-18,,,https://list.am/en/item/18480950,,House is Unfinished,
House,Stone,225 sq.m.,2,3,2,By agreement,2 spots,Euro Renovation,780 sq.m.,,,,,,Lorri › Vanadzor,"12,500,000 ֏",AMD,"Продаётся частный двухэтажный дом со всеми удобствами в Гугарке. Рядом с домом есть большой участок земли. Есть большой гараж на две машины, подвал и постоянная вода. Дом расположен в центральной части. Цена договорная.",Dec-12-2022_21-18,,,https://list.am/en/item/18429254,,House is Finished,
House,Stone,150 sq.m.,2,8+,1,Not available,Not available,No Renovation,,,,,,,"Erevanyan street, Tashir","$10,000",USD,"Առաջին հարկում առկա է ավտոտնակ, կից առկա է հողամաս, գինը սակարկելի։ Ք. Տաշիր փ. Երևանյան Թաղ. 14",Dec-12-2022_21-18,,,https://list.am/en/item/14848420,,House is Unfinished,
House,Stone,90 sq.m.,1,5,1,,,No Renovation,25 sq.m.,,,,,,Lorri › Vanadzor,"16,000,000 ֏",AMD,"Capital needs renovation.On Moskovyan, almost to the center of the city.Translated from Armenian",Dec-12-2022_21-18,,,https://list.am/en/item/18526890,,,
House,Stone,268 sq.m.,2,3,1,Partial Furniture,1 spot,Partial Renovation,600 sq.m.,,,,,,Lorri › Stepanavan,"$18,000",USD,For more information call.Translated from Armenian,Dec-12-2022_21-18,,,https://list.am/en/item/18682446,,House is Finished,
House,Stone,100 sq.m.,1,3,1,By agreement,Not available,Euro Renovation,1600 sq.m.,,,,,,Lorri › Saramej,"$15,000",USD,Newly built and uninhabited house. Call for other questionsTranslated from Armenian,Dec-12-2022_21-18,,,https://list.am/en/item/18182111,,House is Finished,
House,Stone,100 sq.m.,1,4,2,By agreement,1 spot,Cosmetic Renovation,69 sq.m.,,,,,,Lorri › Spitak,"$40,000",USD,"Q. Spitak Opyan str. A stone house is for sale near the Ega market, near the school, kindergarten, municipality. It has all the communal facilities - permanent water, individual heating, cosmetic repairs, laminate flooring, euro windows, has a barn, 8 m. Wagon hut (Can be used as a garage), basement, fruit trees. Area size (ha) -0.088NEGOTIABLETranslated from Armenian",Dec-12-2022_21-18,,,https://list.am/en/item/17580562,,House is Finished,
House,Stone,328 sq.m.,2,8+,3+,,,No Renovation,440 sq.m.,,,,,,Lorri › Stepanavan,"$15,000",USD,"A two-storey private house is for sale in the cozy town of Stepanavan. The building is half-built. With all utilities. After construction, it can be used as a summer house or as a guest house business.Price is negotiable.Translated from Armenian",Dec-12-2022_21-18,,,https://list.am/en/item/16846295,,,
House,Stone,700 sq.m.,2,4,1,By agreement,2 spots,Major Renovation,700 sq.m.,,,,,,Lorri › Vanadzor,"$41,000",USD,"A two-story stone house is for sale. With. 700 sq. M area, of which 222 sq. M house area, 480 sq. M land area.Chemists 2nd street (Khimzavod)It has a corridor, living room, kitchen, 3 bedrooms, bathroom + toilet.The main entrance door is made of heavy iron.The kitchen and bathroom are tiled, the floor of the house is laminate.The windows are euro. Interior doors: New.The house is bright. 2 rooms on the 1st floor. 2 garages.It has internet, gas, electricity, hot and cold water.There is a bus, the stop is near the house. Write or call for details.Translated from Armenian",Dec-12-2022_21-18,,,https://list.am/en/item/17560650,,House is Finished,
House,Stone,320 sq.m.,3,7,3+,Not available,Not available,No Renovation,1220 sq.m.,,,,,,"Անտառային փողոց, Ստեփանավան","$39,900",USD,"A house-guest house is for sale in Agarak, a village near Stepanavan in Lori marz.It is under renovation, unfinished.All bedrooms have separate bathrooms.The roof, windows, heating system, water pipes, electric wires are new.A security system, cameras are installed. WF.The total area of the house is 320 square meters.Land area: 1220 square meters,Balcony: 60 square meters.Cost: $60,000 (the land, the house and the works done on it cost that much)The above price of $39,900 is an urgent sale price due to the urgent need for funds.After a small investment, you will have an excellent opportunity to live in this paradise and to develop a business (taxes are separate)Rental prices in this location are 10-25 thousand AMD per day (depending on what is included)It is possible to live with a family and rent out 4 bedrooms at the same time.Translated from Armenian",Dec-12-2022_21-18,,,https://list.am/en/item/18591041,"Electricity, natural gas, sewerage",House is Unfinished,Alarm system
House,Stone,100 sq.m.,1,3,1,Partial Furniture,Not available,Old Renovation,509 sq.m.,,,,,,"Սայաթ-Նովա փողոց, Ստեփանավան","$15,000",USD,It is in good condition and has a basement. It will be negotiated at real pricesTranslated from Armenian,Dec-12-2022_21-18,,,https://list.am/en/item/18202744,,House is Finished,
House,Stone,240 sq.m.,1,4,2,Not available,Not available,No Renovation,200 sq.m.,,,,,,"1-й переулок улици Мясникяна 3, Ванадзор","$21,000",USD,"200кв/м, участок, 40 кв/ м дом, газ рядом в участке, свет есть вода есть. Дом требуется капитальный ремонт. Центр города, дом расположен рядом с новой церковью, требуется вложение по этому цена такая! Все вопросы ро телефону (разумный торг)",Dec-12-2022_21-18,,,https://list.am/en/item/18702497,,House is Unfinished,
House,Stone,2000 sq.m.,1,5,1,Not available,1 spot,Old Renovation,2000 sq.m.,,,,,,Lorri › Stepanavan,"6,000,000 ֏",AMD,"For details, call the indicated phone numbers located in the village of Stepanavan's fortressTranslated from Armenian",Dec-12-2022_21-18,,,https://list.am/en/item/18453915,,House is Finished,
House,Stone,327 sq.m.,2,3,1,,,No Renovation,600 sq.m.,,,,,,"Forest Street, Stepanavan","$30,000",USD,"PRICE NEGOTIABLESemi-detached house with its own plot of land on Antara Street, Stepanavan, near Vahagn boarding house, next to Allea.The price is negotiableCall AshotTranslated from Armenian",Dec-12-2022_21-18,,,https://list.am/en/item/18209965,,,
House,Wooden,10 sq.m.,1,2,1,,,No Renovation,27 sq.m.,,,,,,Lorri › Tashir,"$5,000",USD,Last price is not negotiableTranslated from Armenian,Dec-12-2022_21-18,,,https://list.am/en/item/18172300,,,
House,Stone,186 sq.m.,3,4,2,Available,2 spots,Major Renovation,300 sq.m.,,,,,,"Քոթեջ 4, Վանաձոր","$55,000",USD,"A 2-storey house is for sale in the city of Vanadzor.The house is located 3 km from the center.Located nearbysupermarket, public transport, bakery. WholeHeating: Gas stove (saving)It is sold with furniture. The house has a basement with the floor plan of the whole house and a parking space on the 0th floor.Translated from Armenian",Dec-12-2022_21-18,,,https://list.am/en/item/18444438,,House is Finished,
