Stone,No,Not available,2.0,55 sq.m.,2.0,1,from 3.5 m,2.0,Not available,Euro Renovation,"Hansoglyan Street, Gyumri","10,000 ֏ daily",AMD,"Цены проживания с расчетом за 1 деньОт 1 до 2 дней – 25.000 драмот 3 до 5 дней – 22.000 драмот 6 до 10 дней – 20.000 драмот 10 до 20 дней – 18.000 драмот 21 до 30 дней – 15.000 драм31 дней и более – 13.000 драмСдается в аренду двухкомнатный апартамент в историческом центре г. Гюмри, /общая жилая площадь 55 кв. М/ на улице Анесоглян, возле центрального парка им. Горького.Дом имеет свой собственный двор в 300 кв. М, с терассой и зеленным участком.Дом находится в самом центре города, где особенно ощущается его неповторимый колорит. В непосредственной близости находятся парк, центральная библиотека,Гюмрийский технологический центр, детский технопарк ТУМО, магазины, кафе и рестораны.Расстояние от дома до центральной площади Вардананц составляет 650 метров.Апартамент подходит для туристов, супружеской пары, субъектов и лиц находящихся в служебной командировке. Апартамент расчитан на 3 человека.Есть интернет Wi-Fi и цифровое телевидение. Вода полностью питьевая.Дом имеет свою парковку на улице и гараж.Аппартамет оборудован всем необходимым инвентарем для бытового пользования. Есть холодильник, электроплита, газовый котел для горячей воды и отопления, стиральная машина, телевизор, 2х спальная кровать, раскладной диван, кухонная мебель, сушилка в ванной комнате. Аппартамет полностью отремонтирован.Апартамент сдается как на долгосрочной основе так и в режиме Hotel.Потребление воды, газа, электричества, и интернета входит в общую плату.Оплата за проживание производится как в наличной так и в безналичной форме /по выставленным счетам для юр. Лиц и посредством оплаты Visa и Master Card/.В апартаментах предусмотрено все для организации собственного комунального хозяйства как на краткосрочной так и на долгосрочной основе.Accommodation prices for 1 dayFrom 1 to 2 days – 25.000 AMDfrom 3 to 5 days – 22.000 AMDfrom 6 to 10 days – 20.000 AMDfrom 10 to 20 days – 18.000 AMDfrom 21 to 30 days – 15.000 AMD31 days or more – 13.000 AMDTwo-room apartment for rent in the historical center of Gyumri, /total living area 55 sq. M/ on Anesoglyan street, near the central park of Gorky.The house has its own yard of 300 sq. M, with a terrace and a green area.The house is located in the very center of the city, where the city’s main culture and vibe is demonstrating. In the neighborhood are the park, the central library, Gyumri Technology Center, TUMO children's Technopark, shops, cafes and restaurants.The distance from the house to the central square of Vardanants is 650 meters.The apartment are suitable for tourists, couples, business trips. Each apartment is designed for 3 people.All apartments include Wi-Fi and digital TV. The water is completely drinkable.The house has its own parking on the street and a garage.The apartment are are completely renovated and equipped with all the necessary equipment for domestic use, including: A refrigerator, electric stove, gas boiler for hot water and heating, washing machine, TV, double bed, sofa bed, kitchen furniture, dryer in the bathroom.The apartments are rented both on a long-term basis and in the Hotel mode.Consumption of water, gas, electricity, and internet is included in the total fee.Payment for accommodation is made both in cash and in a non-cash form /according to invoices issued for legal entities and through payment by Visa and Master Card.The apartments provide everything for organizing your own public utilities, both on a short-term and long-term basis (catering services are not yet provided)",Nov-27-2022_18-52,Available,3,Yes,No,Included,2 months,"FRidge, stove, coffee maker, washing machine, water heater, iron, hair dryer","YArd view, street view, park view","OUtdoor parking, garage","TElevision, internet, parking space",PLayground,https://list.am/en/item/18614985
Monolith,Yes,Not available,4.0,60 sq.m.,2.0,1,from 2.8 m,4.0,Closed balcony,Cosmetic Renovation,"Minas Avetisyan street 1, Gyumri","100,000 ֏ monthly",AMD,Для получения информации информации звоните.,Nov-27-2022_18-52,Available,4,Yes,Yes,Not included,1 month,,,,,,https://list.am/en/item/18549981
Monolith,No,Not available,3.0,88 sq.m.,3.0,1,from 2.8 m,2.0,Multiple balconies,Major Renovation,"Անի թաղամասի 9-րդ փողոց 5, Գյումրի","200,000 ֏ monthly",AMD,"The apartment is renovated, clean, with all utilities.Apartment with renovation, clean, with all amenities.Translated from Armenian",Nov-27-2022_18-52,Available,4,Yes,Yes,Not included,1 month,,,,,,https://list.am/en/item/18487032
Stone,No,Not available,5.0,56 sq.m.,2.0,1,from 3.2 m,2.0,Closed balcony,Major Renovation,"Անտառավան 4-րդ փողոց 1Ա, Գյումրի","200,000 ֏ monthly",AMD,"Վարձով է տրվում 2 սենյականոց բնակարան Մանուշյանում (20-դպրոցի մոտակայքում) : Բնակելի, գույքով, ջեռուցման համակարգ, տաք և սառը ջուր, փակ պատշգամբ, հագեցած ամեն ինչով:Сдается 2-комнатная квартира в Манушян (возле 20-й школы) Жилая, с собственностью, отопление, горячая и холодная вода, закрытый балкон, есть все необходимое.",Nov-27-2022_18-52,Available,3,Negotiable,No,Not included,1 month,,,,,,https://list.am/en/item/18627774
Stone,No,Not available,2.0,58 sq.m.,2.0,1,from 3.2 m,1.0,Not available,Euro Renovation,"Կայարանամերձ հրապարակ 1, Գյումրի","100,000 ֏ monthly",AMD,"Apartment for rent, with all amenitiesTranslated from Armenian",Nov-27-2022_18-52,Available,8+,Yes,Yes,Not included,By Agreement,,,,,,https://list.am/en/item/18542346
Stone,No,Not available,4.0,65 sq.m.,2.0,1,from 2.8 m,3.0,Multiple balconies,Euro Renovation,"Տրդատ Ճարտարապետի փողոց 32А, Գյումրի","130,000 ֏ monthly",AMD,"The apartment is in a very good condition, all utilities are available, internet connection is available.Translated from Armenian",Nov-27-2022_18-52,Available,3,Yes,No,By Agreement,1 month,,,,,,https://list.am/en/item/18432249
Stone,Yes,Not available,2.0,110 sq.m.,4.0,1,from 3 m,2.0,Open balcony,Designer Renovation,"Myasnikyan Street, Gyumri","300,000 ֏ monthly",AMD,"Сдается 4комнатный частный дом в центре Гюмри, новый ремонт, новая техника, со всеми удобствами",Nov-27-2022_18-52,Available,6,Yes,No,Not included,1 month,"FRidge, microwave, coffee maker, washing machine, water heater, iron","YArd view, street view",,"TElevision, internet, parking space",,https://list.am/en/item/18614609
Panels,No,Not available,9.0,75 sq.m.,3.0,1,from 2.75 m,4.0,Open balcony,Partial Renovation,"Sargsyan 2nd row, Gyumri","60,000 ֏ monthly",AMD,"В кваримре долгое время не кто не жил. Почти вся необходимая мебель есть, по договорености можно докупить. Хорошая транспортная доступность. Остальные вопросы по телефону СОБСТВЕННИК",Nov-27-2022_18-52,Available,5,Yes,No,Not included,Without prepayment,,,,,,https://list.am/en/item/18565595
Stone,No,Not available,3.0,100 sq.m.,4.0,1,from 2.8 m,3.0,Open balcony,Cosmetic Renovation,"Մսի կոմբինատ 1-ին շարք 5, Գյումրի","150,000 ֏ monthly",AMD,"The apartment is furnished with property, heating system.Translated from Armenian",Nov-27-2022_18-52,Available,6,Yes,No,Not included,2 months,,,,,,https://list.am/en/item/18569474
Stone,No,Not available,4.0,75 sq.m.,2.0,1,from 2.7 m,4.0,Open balcony,Euro Renovation,"Shirakatsi St, Gyumri","140,000 ֏ monthly",AMD,Здаётся Двухкомнтня кварцира. Тёпли дом. С атаплениям... Требуеться семя.,Nov-27-2022_18-52,,3,Yes,No,Not included,2 months,,,,,,https://list.am/en/item/18278885
Panels,Yes,Not available,5.0,60 sq.m.,2.0,1,from 2.75 m,2.0,Open balcony,Cosmetic Renovation,"Trdat Architector street, Gyumri","80,000 ֏ monthly",AMD,Сдается 2 комнатная квартира в Ани квартале.Можно с питомцами.Для подробностей позвоните на указанный номер. (Агенство),Nov-27-2022_18-52,Available,3,Yes,Yes,Not included,1 month,,,,,,https://list.am/en/item/18489499
Panels,No,Not available,4.0,110 sq.m.,5.0,1,from 2.6 m,4.0,Open balcony,Cosmetic Renovation,"Savoyan street, Gyumri","150,000 ֏ monthly",AMD,Сдается 5 комнатный дом га улице Савояна.Отопления будет сделано через 5 дней.Пля подробности позвоните на указанный номер. (Агенство)Կոդ Cv1993,Nov-27-2022_18-52,Available,7,Yes,No,Not included,1 month,,,,,,https://list.am/en/item/18457865
Stone,No,Not available,2.0,105 sq.m.,4.0,2,from 3.5 m,2.0,Open balcony,Cosmetic Renovation,"Գարեգին Նժդեհ պողոտա 10, Գյումրի","230,000 ֏ monthly",AMD,"In case of questions, call the specified phone numberTranslated from Armenian",Nov-27-2022_18-52,Available,6,Yes,No,Not included,By Agreement,"FRidge, stove, microwave, coffee maker, washing machine, water heater, iron","YArd view, street view",GArage,"TElevision, internet, parking space",,https://list.am/en/item/18593051
Stone,Yes,Not available,3.0,60 sq.m.,2.0,1,from 2.7 m,2.0,Not available,Designer Renovation,"Կոշտոյան փողոց 3, Գյումրի","200,000 ֏ monthly",AMD,A clean house equipped with all utilitiesTranslated from Armenian,Nov-27-2022_18-52,Available,3,No,No,Not included,By Agreement,,,,,,https://list.am/en/item/18479254
Stone,Yes,Not available,5.0,61 sq.m.,2.0,1,from 2.8 m,5.0,Open balcony,Euro Renovation,"Khrimyan Hayrik Highway, Gyumri","200,000 ֏ monthly",AMD,"Clean, bright, sunny apartment with all utilitiesTranslated from Armenian",Nov-27-2022_18-52,Available,3,No,No,By Agreement,By Agreement,,,,,,https://list.am/en/item/18459012
Stone,No,Not available,4.0,48 sq.m.,1.0,1,from 2.8 m,1.0,Not available,Major Renovation,"Shahumyan street, Gyumri","160,000 ֏ monthly",AMD,"Г. Гюмри (улица Ширакаци) Сдается однакомнатная квартира класса комфорт. Супермаркеты, рынок, аптеки, рядом (200-600м) Скоростной интернет, питьевая вода 24/7, теплая вода.В квартире есть всё необходимое для комфортного проживания.Кровать двухспальная,техника (стиральная машина, газовая плита, холодильник, чайник,Кухонные принадлежности, посуда, утюг, пылесос.Վարձով է տրվում 1 սենյականոց բնակարան Գյումրի քաղաքի Շիրակացի փողոցում- գազ լույս տաք և սառը ջուր, ջեռուցում, եվրոպատուհաններ, առաջին հարկ, կահույքով, անկողնային պարականներով, խոհանոցային պարագաններ (ամբողջ կոմպլեկտ), սառնարան, լվածքի մեքենա, հեռուստացույց, արդուկ, փոշեկուլ.Կոդ V436",Nov-27-2022_18-52,Available,3,Yes,Yes,Not included,By Agreement,"FRidge, washing machine, iron",,OUtdoor parking,"TElevision, air conditioner, internet",,https://list.am/en/item/17913172
Bricks,Yes,Not available,4.0,46 sq.m.,2.0,1,from 2.7 m,1.0,Not available,Major Renovation,Shirak › Gyumri,"260,000 ֏ monthly",AMD,"Сдается 2 комнатная уютная, стильная квартира в Гюмри, в 58 квартале со всеми удобствами, мебель, техника (стиральная машина, телевизор, пылесос, утюг, гладильная доска, постельные принодлежности) горячая вода, отопление, wi-fi. (без питомцев) Ежемесячная плата 260 000 + комунальные услуги.",Nov-27-2022_18-52,Available,3,Yes,No,Not included,1 month,"FRidge, stove, washing machine, water heater, iron",STreet view,OUtdoor parking,"TElevision, internet, parking space",PLayground,https://list.am/en/item/18515006
Monolith,Yes,Not available,4.0,100 sq.m.,4.0,2,from 3.2 m,2.0,Open balcony,Major Renovation,Shirak › Gyumri,"110,000 ֏ monthly",AMD,"Квартира находится в городе Гюмри улица ширакаци, на 8-ой городоке.Сдаётся с семью",Nov-27-2022_18-52,Available,5,Yes,No,Not included,1 month,,,,,,https://list.am/en/item/18530419
Stone,No,Not available,4.0,83 sq.m.,3.0,1,from 3.2 m,3.0,Open balcony,Major Renovation,"Улица Вазгена Саргсяна 1, Гюмри","250,000 ֏ monthly",AMD,ГюмриАдрес: Ул. Вазгена Саргсяна 1 на пл. Шарля АзнавураСдается в аренду 3-комн. КвартираВ квартире есть все коммунальные услугиудобства:* Система отопления Bosch* Тёплый пол* Панорамные окна* Газовая плита* Телевизор* Холодильник* Автоматическая стиральная машина* Мебель* Интернет* Постоянная горячая и холодная вода* Долгосрочная арендадепозит за 1 месяцЗвоните для более подробной информации:Տրվում է վարձով բնակարան։Բնակարանում առկա են կոմունալ բոլոր հարմարությունները`• Ջեռուցման համակարգ• Գազօջախ• Հեռուստացույց• Սառնարան• Ավտոմատ լվացքի մեքենաՄանրամասների համար զանգահարելApartment for rentThe apartment has all utilities amenities:* Heating system* Gas stove* TV* Refrigerator* Automatic washing machine* Long-term rentaldeposit for 1 monthCall for more information:,Nov-27-2022_18-52,Available,5,Yes,No,By Agreement,By Agreement,,,,,,https://list.am/en/item/18564603
Stone,No,Not available,4.0,70 sq.m.,3.0,1,from 2.6 m,4.0,Multiple balconies,Euro Renovation,"Տրդատ Ճարտարապետի փողոց 9/5, Գյումրի","200,000 ֏ monthly",AMD,"Վարձով է տրվում 3 սանյականոց բնակարան, Տրդատ Ճարտարապետի փողոցում Կարմիր խաչ, 4 հարկանի շենքի 4-րդ հարկում, կոմունալ բոլոր հարմարություներով, կենդանիների հետ չի տրվում, գինը պայմանագրայինСдается 3 комнатная квартира, улица Трдат Чартарапети, на 4 этаже 4 этажного дома, со всеми коммуникациями, с животными Не Сдается, цена договорная",Nov-27-2022_18-52,Available,6,Yes,No,Not included,2 months,,,,,,https://list.am/en/item/18457163
Monolith,Yes,Not available,4.0,102 sq.m.,3.0,1,from 3 m,4.0,Multiple balconies,Designer Renovation,"Պարույր Սևակի փողոց 1, Գյումրի","250,000 ֏ monthly",AMD,"Apartment for rent with all utilities, gas, hot and cold water, heating system, Wi-Fi, renovated in designer style. The door is made of iron, it has 2 balconies. It is located at the beginning of Paruyr Sevak Street.Translated from Armenian",Nov-27-2022_18-52,Available,5,Yes,No,Not included,By Agreement,,,,,,https://list.am/en/item/18408736
Stone,No,Not available,5.0,55 sq.m.,2.0,1,from 2.8 m,4.0,Open balcony,Euro Renovation,"Улица Паруйра Севака, Гюмри","95,000 ֏ monthly",AMD,Сдаётся 2 комнатная Квартира в городе Гюмри (улица Минас Аветисян) Квартира обеспечена необходимым имуществом и техникой. Есть 2 откритые балконы. По всем вопросам звоните по указанному номеру. Бакси нету.Translated from Armenian,Nov-27-2022_18-52,Available,4,Yes,Yes,Not included,By Agreement,,,,,,https://list.am/en/item/17863753
Panels,Yes,Not available,5.0,80 sq.m.,3.0,1,from 3 m,4.0,Open balcony,Partial Renovation,"Խրիմյան Հայրիկ մայրուղի 6Ա, Գյումրի","60,000 ֏ monthly",AMD,"Apartment for rent, the doors and windows of the house have been changed, the tiles have been laid, the walls have not been painted, the laminate in two rooms has not been done, it has gas, water, electricityTranslated from Armenian",Nov-27-2022_18-52,Not available,1,Yes,No,Included,By Agreement,,,,,,https://list.am/en/item/18404315
Stone,Yes,Not available,4.0,90 sq.m.,3.0,1,from 2.8 m,4.0,Not available,Major Renovation,"Улица Арагаца 2/8, Гюмри","350,000 ֏ monthly",AMD,3 комнатная квартира. Отопление. Есть все необходимое. Кондиционер. Комунальныех плат нет. 3этаж,Nov-27-2022_18-52,Available,4,Yes,No,Included,1 month,,,,,,https://list.am/en/item/18344443
Stone,No,Not available,2.0,72 sq.m.,3.0,1,from 3.2 m,2.0,Not available,Cosmetic Renovation,"Մաքսիմ Գորկու փողոց 22, Գյումրի","15,000 ֏ daily",AMD,"The apartment is located next to Gyumri Square, with all utilities, wifi, furnished for 5 people. It is for rent on a daily basis and on a monthly basis, long-term.AMD 15,000 - for 2 people+ 1 person - AMD 5,000Translated from Armenian",Nov-27-2022_18-52,,5,Yes,Yes,Not included,By Agreement,,,,,,https://list.am/en/item/18395889
Stone,Yes,Not available,4.0,84 sq.m.,3.0,1,from 3 m,2.0,Multiple balconies,Old Renovation,"Yerevan Highway, Gyumri","80,000 ֏ monthly",AMD,"On the 2nd floor of a newly built building, Stroymash street in Yerevan without propertyTranslated from Armenian",Nov-27-2022_18-52,Not available,7,Yes,No,Not included,By Agreement,,,,,,https://list.am/en/item/18389048
Monolith,Yes,Not available,3.0,42 sq.m.,1.0,1,from 3 m,3.0,Open balcony,Euro Renovation,Shirak › Gyumri,"200,000 ֏ monthly",AMD,Newly renovated and furnished apartment with all amenities.It is located in the building in front of Pegas store on Teryan street.Translated from Armenian,Nov-27-2022_18-52,Available,4,Yes,Negotiable,Not included,2 months,"FRidge, microwave, coffee maker, dishwasher, washing machine, water heater, iron, hair dryer",YArd view,OUtdoor parking,"TElevision, air conditioner, internet, parking space",PLayground,https://list.am/en/item/18623340
Stone,Yes,Not available,3.0,56 sq.m.,1.0,1,from 2.8 m,1.0,Closed balcony,Euro Renovation,Shirak › Gyumri,"110,000 ֏ monthly",AMD,"Affordable apartment for rent in the center of Gyumri.Near the second Russian school.With all basic utilities. (gas stove, refrigerator, washing machine, double bed, etc.)Constant hot and cold water. Baksi individual heating system.The bathroom and kitchen are tiled, in clean condition.There is internet.First line.All the necessary places are nearby, the complaint is close.The doors and windows have been replaced and are plastered.There is constant hot and cold water.You can call for details.The deposit amount for the first and last months is given in one lump sum.Translated from Armenian",Nov-27-2022_18-52,Available,4,Yes,Yes,Not included,1 month,"FRidge, stove, washing machine",YArd view,,INternet,,https://list.am/en/item/18593415
Stone,No,Not available,5.0,102 sq.m.,4.0,1,from 2.7 m,4.0,Open balcony,Cosmetic Renovation,"Khrimyan Hayrik Highway, Gyumri","250,000 ֏ monthly",AMD,Квартира с ремонтом и бытовой техникой. Есть все удобства.Детская комната-2 телевизорбыстрый интернетустановлено отопления BAXIтеплый домКоммунальные расходы максимум 50.000,Nov-27-2022_18-52,Available,4,Yes,No,By Agreement,By Agreement,"FRidge, stove, coffee maker, washing machine, water heater, iron, hair dryer","YArd view, street view, city view",OUtdoor parking,"TElevision, internet",,https://list.am/en/item/18558809
Stone,No,Not available,4.0,88 sq.m.,3.0,1,from 2.75 m,1.0,Multiple balconies,Old Renovation,"Trdat Architector street, Gyumri","80,000 ֏ monthly",AMD,Не агентство сдаётся трёхкомнатная квартира от собственника,Nov-27-2022_18-52,Available,5,Yes,No,Not included,By Agreement,,YArd view,,,,https://list.am/en/item/18490557
Stone,No,Not available,5.0,65 sq.m.,2.0,1,from 2.8 m,1.0,Closed balcony,Designer Renovation,"Movses Khorenatsi Street, Gyumri","180,000 ֏ monthly",AMD,"Сдаётся без посредников на длительный срок 2 комнатная квартира расположенная в 58-ой Квартале.Общая площадь составляет 65кв. М.Природный газ, постоянная горячая и холодная вода. Отопление BaxiВ квартире есть: Спальня, ванная комната, туалет, кухня (посуда), отопление, теплый пол, стиральная машина-автомат, холодильник, газовая плита, LCD телевизор.Translated from Armenian",Nov-27-2022_18-52,Available,4,Yes,No,Not included,1 month,"FRidge, washing machine, iron",,OUtdoor parking,"TElevision, internet",,https://list.am/en/item/17914731
Stone,Yes,Not available,3.0,56 sq.m.,1.0,1,from 2.8 m,1.0,Closed balcony,Euro Renovation,Shirak › Gyumri,"110,000 ֏ monthly",AMD,"Affordable apartment for rent in the center of Gyumri.Near the governor's office.First line.With all the utilities for the stay.All appliances are available (gas stove, refrigerator, washing machine, furniture, etc.)The doors, windows are of European production, the windows (barred), there is a Baxi individual heating system.Available with a depositlump sum for the first and last months.There is internet.Call conscientious, law-abiding and disciplined people.You can call for details.All necessary places are nearby.Apartment for rent in Gyumri.Translated from Armenian",Nov-27-2022_18-52,Available,4,Yes,Yes,Not included,1 month,,,,,,https://list.am/en/item/17971426
Stone,No,Not available,2.0,80 sq.m.,3.0,1,from 2.8 m,1.0,Not available,Designer Renovation,"Tamanyan street, Gyumri","250,000 ֏ monthly",AMD,"3 ком. ️Ул. Таманян недалеко от центра️80 квадратов️Первый этаж️Отопления ️Новый дизайнерский ремонт ️Холодильник, стиральная машина ️300.000 драм + комиссия️Торг уместен ️",Nov-27-2022_18-52,Available,4,Yes,No,Not included,1 month,,,,,,https://list.am/en/item/18569500
Stone,No,Not available,2.0,140 sq.m.,4.0,1,from 3.5 m,1.0,Open balcony,Old Renovation,"Hansoglyan Street, Gyumri","150,000 ֏ monthly",AMD,"A 4-room apartment is for rent in Gyumri, with all utilities, furnished, constant hot and cold water. There is an open balcony. The house is located in the neighborhood of the famous barem maremi, Gyumri Gorku park and the newly built Tumo technology center. Vardanants Square is a 3-minute walk from the house. The apartment will be free from November 21Translated from Armenian",Nov-27-2022_18-52,,8+,Yes,No,Not included,1 month,,,,,,https://list.am/en/item/18461673
Stone,No,Not available,5.0,69 sq.m.,3.0,1,from 2.8 m,2.0,Not available,Partial Renovation,Shirak › Gyumri,"120,000 ֏ monthly",AMD,"Տրվում է վարձով 3 սենյականոց բնակարան, կոմունալ բոլոր հարմարություններով։Հասցե՝ Երևանյան խճուղի։Сдается 3-х комнатная квартира со всеми коммуникациями.Адрес: Ереванское шоссе.",Nov-27-2022_18-52,Available,8+,Yes,No,Not included,1 month,,,,,,https://list.am/en/item/18519768
