Stone,Yes,Not available,3,34 sq.m.,1,1,from 3 m,3,Not available,Cosmetic Renovation,,,,,,"Zoravar Andranik street, Yerevan","$25,000",USD,"Продается светлая 1 - комнатная Город Мартуни Находится на 3-м этаже 3-м этажной. Общая площадь этой удобной и просторной квартиры составляет 34 кв. М. Сделан Косметический ремонт Продается вместе с мебелью и техникой+ Земля́ 2,5 Сотк+ Подвал 18 Кв, мԿոդ 0099",Dec-12-2022_19-57,Available,,,,,,https://list.am/en/item/18330718
Panels,No,Not available,5,48 sq.m.,1,1,from 2.7 m,2,Closed balcony,Partial Renovation,,,,,,Gegharkunik › Sevan,"7,500,000 ֏",AMD,"1 room is marked with a sign. Call at Shahumyan 6 for questions, I will call for details, negotiableTranslated from Armenian",Dec-12-2022_19-57,,,,,,,https://list.am/en/item/17379413
Stone,No,Not available,2,24 sq.m.,1,1,from 3 m,1,Open balcony,Cosmetic Renovation,,,,,,"Սայաթ-Նովա փողոց, Սևան","4,000,000 ֏",AMD,"Owned has cold and hot water, exchange with car at your extra cost, preferably Ford Transit, call for details.Translated from Armenian",Dec-12-2022_19-57,By agreement,,,,,,https://list.am/en/item/17419542
Stone,No,Not available,4,78 sq.m.,4,1,from 2.6 m,2,Open balcony,Major Renovation,,,,,,"Erevanyan street, Martuni","18,000,000 ֏",AMD,"The house is in perfect condition, the property and the basement specially made for that house also remain with the house. Address: Yerevanyan Proshyan 4/3 near Armenian Business Bank.Translated from Armenian",Dec-12-2022_19-57,,,,,,,https://list.am/en/item/17121750
Stone,No,Not available,5,48 sq.m.,2,1,from 2.8 m,3,Closed balcony,Cosmetic Renovation,,,,,,"Նաիրյան փողոց 175, Սևան","$25,000",USD,Apartment in Sevan.Translated from Armenian,Dec-12-2022_19-57,Available,,,,,,https://list.am/en/item/18480980
Panels,No,Not available,5,100 sq.m.,3,1,from 2.8 m,5,Closed balcony,Old Renovation,,,,,,Gegharkunik › Sevan,"$35,000",USD,"The apartment is in normal condition, there are all utilities, there is gas, electricity, water, heating system, call for details.Translated from Armenian",Dec-12-2022_19-57,Available,,,,,,https://list.am/en/item/18249599
Stone,No,Not available,1,200 sq.m.,4,1,from 2.8 m,1,Not available,Cosmetic Renovation,,,,,,Gegharkunik › Tsovak,"$27,000",USD,Own house in Tsovak for sale or rentAlong with the propertyIt has a large yardGarageA gardenThe windows are newTranslated from Armenian,Dec-12-2022_19-57,,,,,,,https://list.am/en/item/17954842
Stone,No,Not available,5,41 sq.m.,1,1,from 3 m,3,Closed balcony,Cosmetic Renovation,,,,,,"Nalbandyan street, Sevan town","$20,000",USD,"Nalbandyan 12 apartments, 34 boxes, stoneTranslated from Armenian",Dec-12-2022_19-57,Available,,,,,,https://list.am/en/item/16454093
Panels,No,Not available,9,80 sq.m.,3,1,from 2.8 m,8,Closed balcony,Old Renovation,,,,,,Gegharkunik › Sevan,"$36,000",USD,"Բնակարանը գտնվում է բարվոք վիճակում, մանրահատակը խալի պարկետ, սանհանգույցը ունի վերանորոգման կարիք, ունի ավտոտնակ՝ կիսակառույց_ (4×13) չափերով։Գինը սակարկելիԶանգահարել)",Dec-12-2022_19-57,Not available,,,,,,https://list.am/en/item/13357332
Stone,No,Not available,5,100 sq.m.,3,1,from 2.7 m,5,Open balcony,Partial Renovation,,,,,,"Նալբանդյան փողոց, Սևան","$27,000",USD,"3-room apartment converted into 4 for sale. The apartment is partially renovated. European windows have been installed, the bathroom and kitchen are tiled, the exterior door has been changed, and we have repaired the roof ourselves. The apartment has closed and open balconies, it faces the sun.Translated from Armenian",Dec-12-2022_19-57,Available,,,,,,https://list.am/en/item/18042211
Stone,No,Not available,5,124 sq.m.,6,2,from 2.8 m,4,Multiple balconies,No Renovation,,,,,,"Խաչատուր Աբովյանի փողոց 3, Սևան","$52,000",USD,"Apartment for sale c. In Sevan, on Abovyan street, in the Finnish building, next to the court, close to the 3rd and high schools, there is a kindergarten next to it. The apartment is two-story and is located on the 4th and 5th floors of the building, it is also possible to use the roof (build another floor) It is on the sunny side. It has 2 open balconies, 2 bathrooms, 5 bedrooms, a spacious living room, kitchen, 2 corridors and 2 storage rooms are also available next to the apartment, one of which is located between the 3rd and 4th floors and can be used as a room.The price is negotiable.Translated from Armenian",Dec-12-2022_19-57,,,,,,,https://list.am/en/item/18298905
Stone,No,Not available,4,74 sq.m.,3,1,from 2.6 m,1,Not available,Major Renovation,,,,,,Gegharkunik › Martuni,"$56,000",USD,"The apartment is completely renovated, the entrance door is made of iron, the windows are of European manufacture, the floor is covered with laminate, the kitchen and bathrooms are tiled.It is equipped with all utilities.It is sold together with furniture and appliances.The apartment has another room (not in the pictures), a large hallway and a basement.Translated from Armenian",Dec-12-2022_19-57,Available,,,,,,https://list.am/en/item/18206462
Stone,No,Not available,5,98 sq.m.,4,2,from 3 m,4,Multiple balconies,Old Renovation,,,,,,Gegharkunik › Gavar,"$22,000",USD,It is in a very good condition. Basement is possible with partial paymentTranslated from Armenian,Dec-12-2022_19-57,By agreement,,,,,,https://list.am/en/item/18529796
Stone,No,Not available,5,48 sq.m.,3,1,from 2.75 m,1,Closed balcony,Cosmetic Renovation,,,,,,"Սարգիս Սևանեցու փողոց 7, Սևան","$25,000",USD,Продам 1 комнатную квартиру переделанную на 3 х комнатную. Трубы и канализация заменены. Железная дверь. Метлах в коридоре и в маленькой комнате.Translated from Armenian,Dec-12-2022_19-57,Available,,,,,,https://list.am/en/item/16898388
Bricks,No,Not available,1,3006 sq.m.,1,1,from 3.2 m,1,Not available,No Renovation,,,,,,Gegharkunik › Tsapatagh,"$18,000",USD,It is located in Tsapatagh village on the bank of Shan. Exchange with a car.Translated from Armenian,Dec-12-2022_19-57,,,,,,,https://list.am/en/item/17967397
Stone,No,Not available,5,60 sq.m.,2,1,from 2.8 m,4,Not available,Partial Renovation,,,,,,Gegharkunik › Gavar,"12,000,000 ֏",AMD,A residential building facing the sun is for sale. It is located near the market. The price is negotiable.Translated from Armenian,Dec-12-2022_19-57,,,,,,,https://list.am/en/item/18305606
Stone,No,Not available,5,84 sq.m.,3,1,from 2.7 m,3,Open balcony,Old Renovation,,,,,,"Ազատության փողոց 46, Գավառ","$20,000",USD,"A 3-room apartment is for sale in the city of Gavar.Price negotiable, including furniture and garage $20,000Translated from Armenian",Dec-12-2022_19-57,Available,,,,,,https://list.am/en/item/12852913
Stone,No,Not available,5,67 sq.m.,2,1,from 2.7 m,3,Closed balcony,No Renovation,,,,,,"Ազատության փողոց, Գավառ","7,000,000 ֏",AMD,"2-room apartment for sale,Sunny, warm, gasified, in need of renovationHas a garage spaceTranslated from Armenian",Dec-12-2022_19-57,Not available,,,,,,https://list.am/en/item/18040734
Stone,No,Not available,5,60 sq.m.,2,1,from 2.7 m,2,Multiple balconies,Partial Renovation,,,,,,"Nalbandyan street, Sevan town","10,000,000 ֏",AMD,"It is a very warm apartment, the kitchen and living room windows face south. There is 1 covered balcony that can be used as a 2nd bedroom, also has an open balcony. The No. 1 school, kindergarten, Sevan medical center are located quite close, and it is also very close to the Sevan-Yerevan car park (it is a 5-minute walk) It is a quiet neighborhood, the neighbors are very friendly.Translated from Armenian",Dec-12-2022_19-57,,,,,,,https://list.am/en/item/18516903
Stone,No,Not available,5,60 sq.m.,2,1,from 2.7 m,2,Multiple balconies,Partial Renovation,,,,,,"Nalbandyan street, Sevan town","10,000,000 ֏",AMD,"It is a very warm apartment, the kitchen and living room windows face south. There is 1 covered balcony that can be used as a 2nd bedroom, also has an open balcony. The No. 1 school, kindergarten, Sevan medical center are located quite close, and it is also very close to the Sevan-Yerevan car park (it is a 5-minute walk) It is a quiet neighborhood, the neighbors are very friendly.Translated from Armenian",Dec-12-2022_19-57,,,,,,,https://list.am/en/item/18516909
Stone,No,Not available,4,50 sq.m.,2,1,from 2.75 m,3,Open balcony,Old Renovation,,,,,,Gegharkunik › Martuni,"$24,900",USD,"The apartment is located on Myasnikyan street, next to the municipality. For sale together with the furniture. The apartment is in good condition.Translated from Armenian",Dec-12-2022_19-57,Available,,,,,,https://list.am/en/item/16902442
Stone,No,Not available,3,100 sq.m.,4,1,from 2.8 m,3,Multiple balconies,Cosmetic Renovation,,,,,,"Ազատության փողոցի 4-րդ փակուղի 1, Գավառ","8,500,000 ֏",AMD,Iron entrance door. Renovated uninhabited. There is a basement. A partial payment option is possible in two parts.Translated from Armenian,Dec-12-2022_19-57,Not available,,,,,,https://list.am/en/item/14726415
Stone,No,Not available,3,63 sq.m.,3,1,from 2.75 m,2,Multiple balconies,Major Renovation,,,,,,"Sayat Nova street, Sevan town","$32,000",USD,"It is completely renovated, there is an open and closed balcony, baxi heating system, it is sold with furniture, there is a basement, in case of additional rooms, call!Translated from Armenian",Dec-12-2022_19-57,,,,,,,https://list.am/en/item/18408602
Panels,No,Available,9,80 sq.m.,3,1,from 2.8 m,1,Closed balcony,Cosmetic Renovation,,,,,,"Գրիբոեդով փողոց 8, Սևան","$35,000",USD,Севанум васнарвум н 3 сениак бнакаран.,Dec-12-2022_19-57,Available,,,,,,https://list.am/en/item/13988455
Stone,No,Not available,5,80 sq.m.,3,1,from 3 m,1,Not available,No Renovation,,,,,,"Nalbandyan street, Sevan town","$18,000",USD,Հարմար է առևտրի կետ կամ արտադրամաս կազմակերպելու համար,Dec-12-2022_19-57,Not available,,,,,,https://list.am/en/item/8588240
Stone,No,Not available,1,84 sq.m.,3,1,from 3.2 m,1,Closed balcony,Cosmetic Renovation,,,,,,Gegharkunik › Sevan,"$20,000",USD,"Apartment for sale c. In Sevan, capital renovation is needed to live, on Shinararneri street (no dormitory), 1st floor, separate entrance, 84m. Q is currently leased (on contract) as an office. Call for questions.Translated from Armenian",Dec-12-2022_19-57,Not available,,,,,,https://list.am/en/item/18653278
Stone,No,Not available,5,50 sq.m.,1,1,from 2.8 m,4,Closed balcony,Old Renovation,,,,,,"Շահումյան փողոց, Սևան","$18,500",USD,"A 1-room apartment for sale or rent in the city of Sevan, directly by the owner, with all utilities. You can call for detailed information.Rental price: AMD 40,000Translated from Armenian",Dec-12-2022_19-57,Available,,,,,,https://list.am/en/item/17325673
Stone,No,Not available,5,64 sq.m.,3,1,from 2.7 m,4,Open balcony,Cosmetic Renovation,,,,,,"Եղիշե Չարենցի փողոց 46, Վարդենիս","5,000,000 ֏",AMD,"2 rooms with a closed niche, bright, sunnyTranslated from Armenian",Dec-12-2022_19-57,By agreement,,,,,,https://list.am/en/item/18662667
Stone,No,Not available,5,59 sq.m.,2,1,from 3 m,5,Open balcony,Old Renovation,,,,,,"Բոշնաղյան փողոց 17, Գավառ","$20,000",USD,"The apartment is located in front of the market. Doors and windows of European production, has hot and cold water for details callTranslated from Armenian",Dec-12-2022_19-57,Not available,,,,,,https://list.am/en/item/16990792
Stone,No,Not available,5,100 sq.m.,4,2,from 3 m,5,Open balcony,Euro Renovation,,,,,,Gegharkunik › Gavar,"$75,000",USD,An apartment is for sale in the 3rd part together with the property. It has been renovated and is in perfect condition. It is sunny. There is a taxi system. It is sold without property and with property and equipment. It also has a garage. Price: Negotiable.Translated from Armenian,Dec-12-2022_19-57,Available,,,,,,https://list.am/en/item/18238134
Stone,No,Not available,5,76 sq.m.,3,1,from 3 m,5,Open balcony,Cosmetic Renovation,,,,,,"Lernagorts Street, Vardenis","4,500,000 ֏",AMD,"Vardenis ДОМ КВАРТИРА Վաճառվում է բնակարան շատ չոր ու հարմար քաղաք Վարդենիսում պատուհանները եվրո, բաղնիք-զուգարան կապիտալ վերանորոգած, մաքուր ապրելու տունա։ Գտնվումա 5-րդ հարկում արևկող, չի կաթում կրիշը նոր ենք սարգել։ ՌԵԱԼ ԳՆՈՐԴԻՆ ՍԱԿԱՐԿԵԼՒ tnerПродается квартира в очень сухом и благоустроенном городе Варденис, окна евро, ванная-туалет капитально отремонтирована, чистый жилой дом. Находится на 5 этаже крыша отремонтирована. РЕАЛЬНОМУ ПОКУПАТЕЛЮՀնարավոր է նաև վարձով ամսեկան 60000 դրամ",Dec-12-2022_19-57,Not available,,,,,,https://list.am/en/item/17155412
Stone,No,Not available,5,71 sq.m.,3,1,from 2.8 m,4,Multiple balconies,Euro Renovation,,,,,,"Lernagorts Street, Vardenis","$16,000",USD,"A renovated apartment in the city of Vardenis is for sale or exchange. There is a heating system, a garage...Translated from Armenian",Dec-12-2022_19-57,Available,,,,,,https://list.am/en/item/18396108
Stone,No,Not available,5,93 sq.m.,4,1,from 2.7 m,1,Open balcony,Partial Renovation,,,,,,"Ազատության փողոց 30, Գավառ","8,500,000 ֏",AMD,"Töpli pole, changed the sewage system, changed the electric wires, changed the water supply, the windows are euro, premium quality.Translated from Armenian",Dec-12-2022_19-57,Not available,,,,,,https://list.am/en/item/18402026
Stone,No,Not available,5,54 sq.m.,2,1,from 2.8 m,5,Open balcony,No Renovation,,,,,,"Գարեգին Նժդեհի փողոց 9, Մարտունի","€23,000",EUR,The apartment is located on the BoulevardTranslated from Armenian,Dec-12-2022_19-57,Not available,,,,,,https://list.am/en/item/18676076
Stone,No,Not available,5,67 sq.m.,3,1,from 3.5 m,4,Open balcony,Euro Renovation,,,,,,Gegharkunik › Gavar,"$25,000",USD,"A 3-room apartment is for sale in the city of Gavar. It is renovated in Euro, equipped with all utilities. Possible sale together with the property. Details will be discussed during the phone call.Translated from Armenian",Dec-12-2022_19-57,Not available,,,,,,https://list.am/en/item/18145481
Stone,No,Not available,3,40 sq.m.,2,1,from 2.7 m,3,Open balcony,Partial Renovation,,,,,,"Ազատության փողոց 16, Գավառ","$15,800",USD,"Urgent very urgent Apartment for sale, on the 3rd floor of a 3-storey building, the apartment has all utilitiesFacilities, constant hot and cold water, gas, the bathroom is tiled, located at 15 Azatutyun street, Araj lineTranslated from Armenian",Dec-12-2022_19-57,Available,,,,,,https://list.am/en/item/10094755
Stone,No,Not available,5,40 sq.m.,2,1,from 2.75 m,1,Closed balcony,Old Renovation,,,,,,"Ազատության փողոց, Գավառ","$16,000",USD,"A 1-room apartment is for sale in the city of Gavar - on Azatutyun Street1st floor of stone building.The apartment is partially renovated.The pipes and wires have been changed, the floor has been leveled (syaschka)Windows partially replaced.For more information call:Translated from Armenian",Dec-12-2022_19-57,Not available,,,,,,https://list.am/en/item/18671120
Stone,No,Not available,5,80 sq.m.,3,2,from 2.8 m,2,Not available,Major Renovation,,,,,,"Khaghagutyan street, Sevan town","100,000 ֏",AMD,"For rent, price, call for contract detailsTranslated from Armenian",Dec-12-2022_19-57,Available,,,,"Air conditioner, fridge, stove, washing machine","Street view, city view, park view",https://list.am/en/item/18606751
Stone,No,Not available,5,41 sq.m.,1,1,from 2.7 m,4,Closed balcony,Old Renovation,,,,,,Gegharkunik › Vardenis,"3,200,000 ֏",AMD,"A one-room apartment with a niche, converted into 2 rooms, is for sale, located in the busiest part of the park.Translated from Armenian",Dec-12-2022_19-57,Not available,,,,,,https://list.am/en/item/18646324
Stone,Yes,Not available,5,72 sq.m.,3,1,from 3 m,3,Open balcony,Old Renovation,,,,,,"Erevanyan street, Vardenis","5,000,000 ֏",AMD,Վաճառվում է 3 սենյականոց բնակարան Վարդենիս քաղաքում՝ հինգ հարկանի քարե շենք երրորդ հարկում։ Ունի նաև ավտոտնակ և բակում հողատարածք։,Dec-12-2022_19-57,Available,,,,,Street view,https://list.am/en/item/18369312
Stone,No,Not available,5,99 sq.m.,4,1,from 2.7 m,1,Closed balcony,Major Renovation,,,,,,"Ազատության փողոցի 4-րդ փակուղի 1, Գավառ","$34,000",USD,"Quotes.A four-room apartment is for sale in Gavar, near the school. It is in a capitally renovated state, has all the amenities, permanent water, gas, heating as well as a floor-standing oven, a garage and a chat room.Translated from Armenian",Dec-12-2022_19-57,Available,,,,,,https://list.am/en/item/16677844
Stone,No,Not available,3,36 sq.m.,2,1,from 2.8 m,3,Not available,Euro Renovation,,,,,,"Mamikonyan street 4, Martuni","$20,000",USD,"Վերանորոգված, չբնակեցված",Dec-12-2022_19-57,Not available,,,,,,https://list.am/en/item/12361407
Stone,No,Not available,4,50 sq.m.,2,1,from 2.7 m,3,Closed balcony,Old Renovation,,,,,,Gegharkunik › Sevan,"$25,000",USD,Дом не ремантирован,Dec-12-2022_19-57,Not available,,,,,,https://list.am/en/item/18662031
Stone,Yes,Available,9,88 sq.m.,2,1,from 2.5 m,1,Open balcony,Major Renovation,,,,,,"Nairyan Street 13, Sevan town","$30,000",USD,"3 Room Flat near stadium, in Sevan for sale. 1of 9 floorsMajor renovation done. Stone building",Dec-12-2022_19-57,Available,,,,,,https://list.am/en/item/18362565
Panels,No,Available,9,90 sq.m.,4,1,from 2.75 m,6,Closed balcony,Old Renovation,,,,,,Gegharkunik › Sevan,"$45,000",USD,"A 4-room apartment is urgently for sale in the city of Sevan. The price is negotiable. For details, call or on the spot.It has all utilities, it is sunny, there are schools and a kindergarten nearby. Center...Translated from Armenian",Dec-12-2022_19-57,Available,,,,,City view,https://list.am/en/item/18565603
Panels,No,Available,9,67 sq.m.,3,1,from 2.75 m,1,Closed balcony,No Renovation,,,,,,"Khaghagutyan street, Sevan town","$25,000",USD,"10 minutes walk from the apartment to Lake Sanaa, and only 3 minutes by car.We bought it in the 2000s for a vacation. We have not used it at all for about 10 years. The apartment needs renovation. Suitable for serving as a hostel, shop, office or other commercial space.Translated from Armenian",Dec-12-2022_19-57,Available,,,,,,https://list.am/en/item/16786247
Stone,No,Not available,2,60 sq.m.,2,1,from 2.8 m,1,Open balcony,Euro Renovation,,,,,,Gegharkunik › Sevan,"$20,000",USD,"2-room apartment is for sale in Chkalovka village, Sean city, 1 street, 5 building, 3b. It has all the communal facilities, Euro windows, it is on the side, it has a bathroom, a shower room. The apartment is for sale at a distance of about 200 meters from the lake. It is a comfortable warm apartment ready for accommodation.Translated from Armenian",Dec-12-2022_19-57,,,,,,,https://list.am/en/item/17665167
Stone,No,Not available,4,46 sq.m.,2,1,from 2.6 m,2,Closed balcony,Cosmetic Renovation,,,,,,Gegharkunik › Chambarak,"$11,500",USD,"The apartment has permanent water and gas, it faces the sun, it has its own basement. It is 15 km away from Lake Sevan, and there are shops, a school, and a hospital next to the apartment. For sale with partial ownership. In case of questions, call the indicated phone number.Translated from Armenian",Dec-12-2022_19-57,Available,,,,,,https://list.am/en/item/18015742
Stone,No,Not available,5,78 sq.m.,3,1,from 2.75 m,5,Closed balcony,Major Renovation,,,,,,"Nalbandyan street, Sevan town","15,300,000 ֏",AMD,"The apartment is completely renovated. It has a permanent heating system, a storage room (chulan) built at the expense of the porch. It is ready for occupancy. In case of other questions, you can call the same number at 094.Translated from Armenian",Dec-12-2022_19-57,,,,,,,https://list.am/en/item/18138897
Stone,No,Not available,5,72 sq.m.,3,1,from 2.8 m,5,Multiple balconies,Old Renovation,,,,,,Gegharkunik › Vardenis,"$13,000",USD,Call for detailsTranslated from Armenian,Dec-12-2022_19-57,Available,,,,,,https://list.am/en/item/18170432
Monolith,No,Not available,5,90 sq.m.,4,1,from 2.8 m,1,Open balcony,Cosmetic Renovation,,,,,,"Nalbandyan street 41, Yerevan","$25,000",USD,"The apartment is located in Shan city, Nalbandyan str. , Has a shop on both sides with its basement, is in a normal living condition Exchange it with an equivalent car;Translated from Armenian",Dec-12-2022_19-57,Not available,,,,,,https://list.am/en/item/14665168
Stone,No,Not available,3,38 sq.m.,1,1,from 2.7 m,2,Open balcony,Major Renovation,,,,,,Gegharkunik › Sevan,"$23,000",USD,"It is a sunny, warm apartment, with all utilities (hot water) Renovated, ready to move in. It is sold with the whole property. It is also given with a daily rent of 10,000 AMD, and a monthly rent of 100,000 AMD. The price is not negotiable.Translated from Armenian",Dec-12-2022_19-57,Available,,,,,,https://list.am/en/item/18354204
Panels,No,Not available,5,45 sq.m.,1,1,from 2.8 m,4,Closed balcony,No Renovation,,,,,,"Ազատության փողոց 21, Գավառ","$7,000",USD,"Apartment in Gavar, 2 Azatutyun street, 2nd passage, it is a 1-room apartment, but you can make it into 2 rooms, it is with a niche.Translated from Armenian",Dec-12-2022_19-57,Not available,,,,,,https://list.am/en/item/18564667
Stone,No,Not available,4,32 sq.m.,2,1,from 3.2 m,3,Multiple balconies,Euro Renovation,,,,,,"Կարմիր Բանակի փողոց, Սևան","$35,000",USD,"2-room renovated apartment in the center of Shan.The price includes all the furniture (completely new), basement, and garage. There is a bad վրա viber on the number, just call or write thereTranslated from Armenian",Dec-12-2022_19-57,Available,,,,,,https://list.am/en/item/17858280
Stone,No,Not available,1,2000 sq.m.,4,1,from 2.5 m,1,Not available,Partial Renovation,,,,,,Gegharkunik › Vardenis,"6,000,000 ֏",AMD,"The house is located in Pambak village of Vardenis region. 4 rooms and 1 balcony. There is land next to the house, 2 barns, productive trees in the garden, fertile soil, the bathroom and the bathroom together have been completely renovated with euro door and window, the exterior and interior doors of the house are euro doors, the windows in both rooms are euro, permanent water, there is also a solar water heater. It opens from the garden. Beautiful view of Lake Sevan, you can walk to the shore in 10 minutes. The price is negotiable.Translated from Armenian",Dec-12-2022_19-57,By agreement,,Outdoor parking,,,"Yard view, park view",https://list.am/en/item/18640541
Stone,No,Not available,5,93 sq.m.,4,1,from 2.8 m,5,Closed balcony,Major Renovation,,,,,,"Улица Саркиса Севанеци 7, Севан","$65,000",USD,"Selling a 4-room apartment in the city of Sevan, in 3 micro-neighborhoods. It was completely renovated 10 years ago with a comfortable modification and interesting solutions. It has not been inhabited in the last 6 years, it is in perfect condition. It is a bright, sunny apartment. It has a separate storage room on the roof. Lake Sevan can be seen from the balcony, 5-10 minutes walk to the city beach. The apartment is sold with furniture for $65,000, without furniture for $60,000. For additional questions, call the Russian number (Viber, Whatsapp) or write a message. Do not call the Armenian number, it is not the owner of the house.The price is negotiable.Translated from Armenian",Dec-12-2022_19-57,Available,,,,,,https://list.am/en/item/16938251
Stone,No,Available,5,63 sq.m.,2,1,from 2.8 m,5,Closed balcony,Cosmetic Renovation,,,,,,"Պռոշյան փողոց, Մարտունի","$22,000",USD,"A good apartment is for sale urgently. If you have any questions, write to me. The number is not workingTranslated from Armenian",Dec-12-2022_19-57,,,,,,,https://list.am/en/item/18339877
Stone,No,Not available,5,91 sq.m.,4,1,from 2.8 m,4,Multiple balconies,Partial Renovation,,,,,,"Улица Егише Чаренца 48, Варденис","$13,500",USD,"The apartment is located on the 4th floor of a 5-storey building in Vardenis. It is partially renovated, 91 sq. M. There is hot-cold water (with separate water line), gas water heater, kitchen and bathroom tiled, rooms are parquet, 2 balconies, the price includes a mobile garage. For more information callTranslated from Armenian",Dec-12-2022_19-57,Not available,,,,,,https://list.am/en/item/16797082
Stone,No,Not available,4,70 sq.m.,3,1,from 2.8 m,1,Closed balcony,No Renovation,,,,,,Gegharkunik › Sevan,"14,200,000 ֏",AMD,"Квартира без ремонта, прсредников не беспокоить. Торг.",Dec-12-2022_19-57,,,,,,,https://list.am/en/item/18411920
Stone,No,Not available,3,39 sq.m.,2,1,from 2.75 m,1,Not available,No Renovation,,,,,,Gegharkunik › Sevan,"$20,000",USD,A 2-room apartment is for sale in Kayaran district of Sevan city. Not repaired.Translated from Armenian,Dec-12-2022_19-57,Not available,,,,,,https://list.am/en/item/18558929
