Stone,No,Not available,5,62 sq.m.,3,1,from 2.75 m,2,Open balcony,Old Renovation,,,,,,Gegharkunik › Vardenis,"$10,500",USD,"The apartment (2 rooms with niche) is sunny, has 2 balconies (open and closed), water, gas and electricity. Not for rent. Price negotiableTranslated from Armenian",Dec-12-2022_19-56,Not available,,,,,,https://list.am/en/item/18041453
Stone,No,Not available,5,87 sq.m.,4,1,from 2.6 m,4,Closed balcony,Euro Renovation,,,,,,"Erevanyan street, Vardenis","$18,000",USD,"It is for sale without property. I am selling very urgently, only real people can call. Negotiable:Translated from Armenian",Dec-12-2022_19-56,Not available,,,,,,https://list.am/en/item/14437879
Panels,Yes,Not available,4,65 sq.m.,2,1,from 3 m,1,Open balcony,Euro Renovation,,,,,,"Main Square, Gavar boundary","8,000,000 ֏",AMD,"A 2-room apartment for sale in Gavar, renovated, equipped with gas, water, individual heating, sunny, has an open balcony, basement. The floor is laminate, the kitchen, the bathroom are tiled. Along with the furniture. It is also available for rent.Translated from Armenian",Dec-12-2022_19-56,,,,,,,https://list.am/en/item/15850506
Panels,No,Available,9,80 sq.m.,3,1,from 2.75 m,9,Closed balcony,Euro Renovation,,,,,,Gegharkunik › Sevan,"$35,000",USD,"The front door is iron, the windows are euro, it has a heating system, the outer walls are fixed, it is on the side.Translated from Armenian",Dec-12-2022_19-56,,,,,,,https://list.am/en/item/17276528
Stone,No,Not available,5,77 sq.m.,3,1,from 2.8 m,4,Multiple balconies,Old Renovation,,,,,,"Улица Микаэла Налбандяна 45, Севан","$31,500",USD,"Продам 3 комнатную квартиру 5 этажного дома в 4 этаже г. Севан ул. Налбандяна 45.Окна пвх, дверь металлическая, солнечная сторона, недалеко от дома школа, рынок, озера. Вайбер кам ватсап + 375291926690",Dec-12-2022_19-56,Not available,,,,,,https://list.am/en/item/18646725
Stone,No,Not available,5,42 sq.m.,1,1,from 2.8 m,4,Open balcony,Old Renovation,,,,,,"Երիտասարդության փողոց 11, Վարդենիս","2,700,000 ֏",AMD,"A one-room apartment is for sale in Vardenis, near the municipality. On the 4th floor of a 5-story stone building, it has an open balcony. Water supply and electricity are available.Translated from Armenian",Dec-12-2022_19-56,,,,,,,https://list.am/en/item/18062654
Stone,No,Not available,5,58 sq.m.,2,1,from 2.75 m,1,Multiple balconies,Old Renovation,,,,,,"Կենտրոնական հրապարակ, Գավառ","$12,000",USD,"2 rooms for sale. Apartment 58 sq. M. M.K. Gavar Kabelvostner str. 60:First floor, has a closed balcony, basement.Translated from Armenian",Dec-12-2022_19-56,Available,,,,,,https://list.am/en/item/18571220
Stone,Yes,Not available,3,1500 sq.m.,7,2,from 3 m,3,Open balcony,No Renovation,,,,,,"Sayadyan street, Gavar boundary","$25,000",USD,"Semi-constructed, negotiable, exchangeTranslated from Armenian",Dec-12-2022_19-56,Not available,,,,,,https://list.am/en/item/16344489
Panels,No,Available,9,65 sq.m.,2,1,from 2.7 m,1,Closed balcony,Major Renovation,,,,,,Gegharkunik › Sevan,"$30,000",USD,"2-room, renovated apartment in the city of Sevan, 1st floor, has a basement, the entrance of which is from the balcony of the houseAt the beginning of the city, the building is on the streetthe price is 28,000 dollarsIt is also available on a daily basisTranslated from Armenian",Dec-12-2022_19-56,By agreement,,,,,,https://list.am/en/item/13650222
Stone,No,Not available,5,57 sq.m.,2,1,from 2.8 m,5,Open balcony,Major Renovation,,,,,,"Nalbandyan street, Sevan town","$28,000",USD,"A 2-room apartment is for sale, on the 5th floor of a 5-story building, it is renovated. For other information, call the indicated phone number.Translated from Armenian",Dec-12-2022_19-56,,,,,,,https://list.am/en/item/18119904
Stone,No,Not available,5,80 sq.m.,3,1,from 2.8 m,4,Multiple balconies,Euro Renovation,,,,,,Gegharkunik › Martuni,"$47,000",USD,"Продается три комнаты квартира город мартуни улица ереванян, находится гостиница Aлашкерт",Dec-12-2022_19-56,Available,,,,,,https://list.am/en/item/17182021
Stone,Yes,Not available,1,100 sq.m.,3,1,from 3 m,1,Open balcony,Major Renovation,,,,,,Gegharkunik › Chambarak,"13,500,000 ֏",AMD,"The apartment is for sale with gas, along with the house, it is sunny, if you have any questions, callTranslated from Armenian",Dec-12-2022_19-56,Available,,,,,,https://list.am/en/item/17242884
Stone,No,Not available,2,60 sq.m.,4,1,from 2.8 m,2,Not available,Cosmetic Renovation,,,,,,Gegharkunik › Martuni,"$26,000",USD,"There are all conditions for accommodation, the rest is available by callingTranslated from Armenian",Dec-12-2022_19-56,Available,,,,"Air conditioner, fridge, stove, washing machine",Yard view,https://list.am/en/item/18705060
Stone,No,Not available,1,180 sq.m.,5,1,from 2.8 m,1,Multiple balconies,Partial Renovation,,,,,,Gegharkunik › Shatvan,"$11,000",USD,"Private house for sale in the center of the village. It has a cellar. 2 garages, a barn and another house as a warehouse. It also has half-fruited trees.Translated from Armenian",Dec-12-2022_19-56,,,,,,,https://list.am/en/item/17461478
Panels,No,Available,9,35 sq.m.,2,1,from 2.8 m,7,Closed balcony,Old Renovation,,,,,,Gegharkunik › Sevan,"$6,000",USD,It is a sunny apartment. Old repair. Without property. Former dormitory buildings. It makes no sense not to call brokersTranslated from Armenian,Dec-12-2022_19-56,Not available,,,,,,https://list.am/en/item/17814190
Stone,No,Not available,2,365 sq.m.,8+,3+,from 3.5 m,2,Not available,Partial Renovation,,,,,,Gegharkunik › Gegharkunik,$500,USD,"Продаётся участок в районе Варденик. Крыша отремонтирована, окна в европеийском стиле, не имеет внутреннего ремонта. Имеет большой подвал. Вам нужно будет отремонтировать внутри участня: Даже есть возможность создать жительское здание. В случая покупки можете деньги отдавать по частям. По другим вопросам свяжитесь с номер.Просим звонить только реальным покупателям",Dec-12-2022_19-56,Not available,,,,,,https://list.am/en/item/17538221
Panels,Yes,Available,9,67 sq.m.,2,1,from 2.8 m,3,Closed balcony,Major Renovation,,,,,,"Sayat Nova street, Sevan town","$45,000",USD,"Քաղաք Սևանում վաճառվում է բնակարան երկու սենյակը դարձրած երեք Սայաթ Նովա փողոցում (ստադիոնի դիմաց) Վերանորոգված տաք ու լուսավոր տուն է։Շքամուտքում կա երկու խորդանոց։Продается квартира г. Севане улица Саят-Нова (напротив стадиона) Квартира 9этажный на 3 этажа 2-х комнтная 67 кв. М. Солнечная и светлая квартира. Продажа всей мебели, а также техники. На крыльце две кладовые. Звоните ватцапу.Translated from Armenian",Dec-12-2022_19-56,,,,,,,https://list.am/en/item/17479017
Stone,No,Not available,3,31 sq.m.,1,1,from 3 m,3,Open balcony,Cosmetic Renovation,,,,,,Gegharkunik › Sevan,"$27,000",USD,"Продается 1 комнатная квартира в городе Севан в трех этажном доме на третьем этаже. Квартира находится в центральном переулке рядом с рынком, окна солнечные",Dec-12-2022_19-56,By agreement,,,,,,https://list.am/en/item/17300149
Stone,Yes,Not available,5,48 sq.m.,1,1,from 3 m,5,Closed balcony,Partial Renovation,,,,,,"Nairyan Street, Sevan town","$25,000",USD,"1-room apartment for sale (with niche) in the city of Sevan, the apartment is in very good condition, the roof is repaired, it has all the amenities, the price is finalTranslated from Armenian",Dec-12-2022_19-56,Not available,,,,,Street view,https://list.am/en/item/18589489
Stone,Yes,Not available,4,50 sq.m.,3,1,from 2.75 m,4,Multiple balconies,Partial Renovation,,,,,,"Nalbandyan street, Sevan town","$15,000",USD,"3-room apartment for sale in Sevan city (former dormitory), the apartment is sunny, has gas, electricity, water, windows, European-made interior door, wooden exterior door, iron door. For all questions, call the indicated phone number.Translated from Armenian",Dec-12-2022_19-56,Not available,,,,,Yard view,https://list.am/en/item/18589403
Panels,No,Not available,4,74 sq.m.,2,1,from 2.8 m,2,Closed balcony,Old Renovation,,,,,,Gegharkunik › Chambarak,"5,000,000 ֏",AMD,"2-room apartment for sale in Chambarak city, 34 Tigran Mets building, 8th apartment. The apartment is very bright and sunny. It has a closed balcony that can be used as a living room, it has a basement, a plot of land in front of the building is about 400 m, it has a storage room (chulan) both inside the house and in the corridor, the floor is parquet, the apartment is gasified.2-room apartment for sale in Chambarak street. Тиграна Меца дом 34 квартира 8.Translated from Armenian",Dec-12-2022_19-56,Available,,,,,,https://list.am/en/item/18249483
Stone,No,Not available,5,82 sq.m.,4,1,from 2.75 m,1,Open balcony,Major Renovation,,,,,,"Խ․ Ստեփանյան փողոց, Վարդենիս","$14,500",USD,A part of the apartment can be used for a small business if you wish.The apartment is located at 29/17 Khachik Stepanyan street in Banavan (pasyolok)NEGOTIABLE.Translated from Armenian,Dec-12-2022_19-57,By agreement,,,,,,https://list.am/en/item/16701442
Stone,No,Not available,1,"10,000 sq.m.",8+,1,from 3 m,1,Open balcony,Major Renovation,,,,,,"Viktor Hambartsumyan street, Vardenis","$35,000",USD,"The apartment is located in the city of Vardenis. It has all utilities. It has a boiler room, storage room, pantry, warehouse, 2 garages. A large plot of land with fruit trees. Permanent drinking and irrigation water. Separate road. The apartment is renovated. It is possible to exchange with an apartment in Yerevan.Translated from Armenian",Dec-12-2022_19-57,Available,,,,,,https://list.am/en/item/18059313
Stone,No,Not available,5,47 sq.m.,1,1,from 2.8 m,1,Closed balcony,Euro Renovation,,,,,,"Նալբանդյան փողոց, Սևան","$25,000",USD,An apartment is for sale on the 1st floor of a micro 5-storey building in Sevan 1. It has a heating system and is sunny. It is sold together with furniture and appliances.Translated from Armenian,Dec-12-2022_19-57,Available,Playground,Outdoor parking,,,,https://list.am/en/item/18490648
Stone,No,Not available,4,75 sq.m.,4,1,from 3 m,4,Open balcony,Cosmetic Renovation,,,,,,Gegharkunik › Sevan,"$45,000",USD,"Q. Սևան, փ. Nairyan 153 building 4 floors, 2 open balconies, heating system also exchange with car with G classTranslated from Armenian",Dec-12-2022_19-57,,,,,,,https://list.am/en/item/16953198
Stone,Yes,Not available,5,120 sq.m.,4,1,from 2.8 m,1,Not available,No Renovation,,,,,,"Սարգիս Սևանեցու փողոց, Սևան","$48,000",USD,"With all communications, BAXI system, Euro windows,School, kindergarten, I will also listen to your options.Translated from Armenian",Dec-12-2022_19-57,Available,,,,,,https://list.am/en/item/17218616
Panels,No,Available,9,80 sq.m.,3,2,from 2.75 m,8,Closed balcony,Partial Renovation,,,,,,Gegharkunik › Sevan,"17,700,000 ֏",AMD,"Վաճառվում է բնակարան 3ս. , պատրաստ է բնակեցման, ունի անհատական ջեռուցման համակարգ, պատուհաննեն եվրոպական արտադրության, արևկողմ, լուսավոր ու տաք բնակարան է, վաճառվում է կահույքով (խոհանոց ամբողջ. , ննջասենյակներ ամբողջ. , հյուրասենյակ մասնակի) բնակարանի հետ վաճառվում է նաև խորդանոց վերելակի կողքին։ Պատուհանից բացվում է գեղեցիկ տեսարան դեպի Սևանա լիճը. Մոտակայքում է կա 2 դպրոց և մանկապարտեզ։ Գինը սակարկելի։Продаётся трёх комнатная квартира, готова к проживанию полностью установленное утопление, высокого качества установлены евро окна-стеклопакеты, квартира очень солнечная, светлая и тёплая. Квартира продаётся с мебелью так же с квартирой продаётся отдельная кладовка находящаяся на этаже у лифта. Вид из окна превосходный на озеро Севан, дом находится на расстоянии 1км до берега озёра Севана.",Dec-12-2022_19-57,,,,,,,https://list.am/en/item/17375722
Panels,No,Available,9,82 sq.m.,5,1,from 3 m,4,Open balcony,Partial Renovation,,,,,,Gegharkunik › Sevan,"$15,000",USD,"The apartment is located on Nalbandyan street, has all the communal facilities, needs renovation. Do not call for an exchange.Translated from Armenian",Dec-12-2022_19-57,,,,,,,https://list.am/en/item/17406370
Stone,Yes,Not available,5,109 sq.m.,4,2,from 2.75 m,1,Open balcony,Major Renovation,,,,,,"Երիտասարդության փողոց, Վարդենիս","$40,000",USD,"A 4-room apartment for sale, on the 1st and 2nd floor of a 5-story stone building/duplex/. The apartmentit is gasified, an individual heating system has been installed for the entire 109.9 square meter two-story area, all the hot and cold water lines have been changed, the bathroom is separated from the bathroom of the residential building. The bathrooms are tiled with Spanish tiles, the interior doors are wooden, the exterior is iron-clad, the windows are Euro, the floor is laminated and tiled. The apartment has 3 bedrooms, 1 dining room connected to the kitchen, 2 bathrooms, 1 of which has a bathtub. The stairs from inside to the 2nd floor are handmade, made of beech and walnut wood. The area of the 1st floor is 36.6 square meters, the 2nd floor is 72 square meters. Entrance door from the 1st floor. For sale without property and equipment. A warehouse-shop area is also for sale, which is a separate value, suitable for setting up a pantry, warehouse, any shop, hair salon or other service, 43 square meters. The price is negotiable.Translated from Armenian",Dec-12-2022_19-57,Not available,,,,,,https://list.am/en/item/16907726
Stone,No,Not available,3,40 sq.m.,2,1,from 2.8 m,2,Closed balcony,Partial Renovation,,,,,,"Sayat Nova street, Sevan town","$30,000",USD,"Продаётся квартира в центре г. Севан, дом 3-х этажный каменный, кв. На 2 этаже, 2 комнатная, недавно сделан качественный и красивый ремонт, электрика и все трубы менялись на новые, имеется стиральная машина, газ, холодильник, и вся необходимая мебель для проживания, один взрослый собственник, по всем вопросам звоните, можно оформить ипотекуՎաճառվում է 2 սենյականոց բնակարան, հնարավոր է նաև ձևակերպել հիփոթեքով, արևվկողմ, տաք և հարմարավետ բնակարան, վաճառվում է գույքով, խոհանոցի կահույքն ամբողջովին նոր, գազօջախն և սառնարանն նոր գնված, մուտքի դուռն նոր, պատշգամբն մեծացրած, հավելյալ հարցերի դեպքում կարող եք զանգել նշված համարներով",Dec-12-2022_19-57,,,,,,,https://list.am/en/item/18334182
Stone,No,Not available,5,450 sq.m.,8+,3+,from 3.5 m,1,Multiple balconies,No Renovation,,,,,,"Ազատության փողոցի 4-րդ փակուղի, Գավառ","$130,000",USD,"The total area is about 450 square meters...The internal height is about 4 m...50-60 cm above the ground...In case of cash, the price is negotiable...It is also possible to exchange it with a car (in the amount corresponding to the price of your car)According to the cadastral certificates, it is divided into 4 80 sq. M. Apartments, the rest is a public shop.! GREAT PLEASE!Cars worth 60,000-70,000 $ 130,000 Do not call and do not be interested!He will be rented...Translated from Armenian",Dec-12-2022_19-57,Available,,,,,,https://list.am/en/item/17924380
Stone,No,Not available,4,40 sq.m.,1,1,from 3 m,4,Closed balcony,Old Renovation,,,,,,"Nalbandyan street, Sevan town","10,000,000 ֏",AMD,An apartment is for sale in the city of SevanTranslated from Armenian,Dec-12-2022_19-57,Available,,,,,,https://list.am/en/item/18656361
Stone,No,Not available,4,105 sq.m.,5,1,from 2.75 m,4,Multiple balconies,Old Renovation,,,,,,"Կարմիր Բանակի փողոց, Սևան","$29,500",USD,"The apartment is dry and sunny, it has open and closed balconies on both sides of the building. The kitchen is spacious and sunny.Translated from Armenian",Dec-12-2022_19-57,Available,,,,,,https://list.am/en/item/16732504
Stone,No,Not available,5,66 sq.m.,3,1,from 3 m,5,Open balcony,Cosmetic Renovation,,,,,,"Երևանյան փողոց, Մարտունի, 25","$33,000",USD,"A three-room, cosmetically renovated apartment is for sale. In Martuni. The apartment is bright, facing the sun, the outer door is iron.Price negotiable.Translated from Armenian",Dec-12-2022_19-57,By agreement,,Outdoor parking,,,"Yard view, street view",https://list.am/en/item/18667034
Stone,No,Not available,5,59 sq.m.,2,1,from 2.75 m,5,Closed balcony,Cosmetic Renovation,,,,,,"Էներգետիկների փողոց 3, Սևան","$29,000",USD,"A 2-room apartment converted into 3 is for saleIt has all utilities, the apartment faces the sun and is ready to move in.For details, call the indicated phone numberTranslated from Armenian",Dec-12-2022_19-57,Partial Furniture,Playground,Outdoor parking,,,Yard view,https://list.am/en/item/18700146
Panels,No,Available,9,37 sq.m.,2,1,from 2.7 m,5,Not available,Partial Renovation,,,,,,Gegharkunik › Sevan,"$9,500",USD,"It needs repair, in case of questions, call the indicated number. NEGOTIABLETranslated from Armenian",Dec-12-2022_19-57,,,,,,,https://list.am/en/item/18228521
Stone,No,Not available,4,59 sq.m.,2,1,from 2.8 m,2,Closed balcony,Partial Renovation,,,,,,Gegharkunik › Vardenis,"7,500,000 ֏",AMD,"2 + 1 Room.The apartment is located in the center of Vardenis. A school, a kindergarten, a garden and shops are nearby.The apartment is provided with all the communal amenities. It has a closed balcony that can be used as a room. The bathroom and toilet are fully renovatedTranslated from Armenian",Dec-12-2022_19-57,,,,,,,https://list.am/en/item/16927480
Stone,No,Not available,5,63 sq.m.,3,1,from 3 m,1,Open balcony,Partial Renovation,,,,,,"Main Square, Gavar boundary","$14,000",USD,Վաճառվում է բնակարան կաբելագործների փող. 3-սեն. Գազ. Ջուր. Նորմալ վիճակ ու մեծ նկուղ. Շտապ.,Dec-12-2022_19-57,Not available,,,,,,https://list.am/en/item/14276585
Stone,No,Not available,2,53 sq.m.,2,1,from 3 m,2,Not available,Cosmetic Renovation,,,,,,"Nairyan Street, Sevan town","$25,000",USD,"Apartment for sale in the city of Sevan, the apartment is located on the main road. Call for details, negotiable.Translated from Armenian",Dec-12-2022_19-57,Available,,,,,,https://list.am/en/item/17829953
Stone,No,Not available,3,75 sq.m.,3,1,from 2.7 m,2,Open balcony,No Renovation,,,,,,"Եղիշե Չարենցի փողոց 54, Վարդենիս","$12,000",USD,URGENT. An apartment is for sale. It is in state condition. Call the numbers listed for detailsTranslated from Armenian,Dec-12-2022_19-57,By agreement,,,,,,https://list.am/en/item/14075743
Stone,No,Not available,1,260 sq.m.,6,1,from 2.75 m,1,Closed balcony,Major Renovation,,,,,,Gegharkunik › Sevan,"$56,000",USD,"Very good condition, all utilities are available, located within walking distanceTranslated from Armenian",Dec-12-2022_19-57,Available,,,,,,https://list.am/en/item/18070659
Stone,No,Not available,4,86 sq.m.,3,1,from 2.7 m,4,Closed balcony,Cosmetic Renovation,,,,,,Gegharkunik › Sevan,"$38,000",USD,"A modified 3-room apartment on the 4th floor of a four-story stone building is for sale. Replaced by (n005) plate, e. Wires and water pipes changed, clean condition, very bright apartment.The price is $38,000Translated from Armenian",Dec-12-2022_19-57,Available,,,,,,https://list.am/en/item/17984091
Stone,No,Not available,2,63 sq.m.,3,1,from 2.7 m,1,Not available,No Renovation,,,,,,"Sevan street 2/1, Yerevan","$5,000",USD,"K. Sevan. C. Hair. The house is on the first floor of a two-story building, in front of the house there is a plot of about 300 square meters, it has the possibility of a barn, it needs repair next to the garden.Also exchange with a car for an additional fee from you and usTranslated from Armenian",Dec-12-2022_19-57,Not available,,,,,,https://list.am/en/item/15714524
Stone,Yes,Not available,5,47 sq.m.,1,1,from 2.8 m,1,Closed balcony,Partial Renovation,,,,,,Gegharkunik › Sevan,"$24,000",USD,"1-room apartment for sale, converted into 3-room, Czech project.Renovated, high 1st floor. Located on the 2nd micro, has a large basement, box, 10 minutes away from the lake.Real buyers will call.Translated from Armenian",Dec-12-2022_19-57,,,,,,,https://list.am/en/item/17871827
Stone,No,Not available,5,100 sq.m.,4,1,from 3 m,4,Open balcony,Major Renovation,,,,,,Gegharkunik › Sevan,"$56,000",USD,"The apartment is located in the central part of Sean city, in front of the market, it is a 5-storey stone building with high ceilings. Address Nairyan 139. The apartment is fully repaired, heating system is installed, all the windows are of European production, Jacuzzi is installed, all the interior doors are made of pure wood. There is a large storage room. Separate water tanks are installed. In a word, all the amenities are available. It is sunny and very bright. The price includes the property partially. URGENTTranslated from Armenian",Dec-12-2022_19-57,By agreement,,,,,,https://list.am/en/item/17218302
Stone,No,Not available,2,130 sq.m.,5,1,from 2.8 m,2,Closed balcony,No Renovation,,,,,,"Nairyan Street, Sevan town","$90,000",USD,"5-room apartment for sale, 151 Nairyan street, Sevan citystone building, roof repaired130 square meters There is water and electricity, a world of clothes in front of the storeNegotiable priceTranslated from Armenian",Dec-12-2022_19-57,Not available,,,,,,https://list.am/en/item/17678456
Panels,No,Available,9,81 sq.m.,3,1,from 2.8 m,8,Multiple balconies,Cosmetic Renovation,,,,,,"Nairyan Street, Sevan town","$35,000",USD,"3-room apartment is for sale at 141 Nairyan street, in front of the market. The apartment is on the other side, it is ready for living, European windows, heating baxi.In the center of Sean, a beautiful view of the lake and cityTranslated from Armenian",Dec-12-2022_19-57,,,,,,,https://list.am/en/item/16216533
Stone,No,Not available,1,1000 sq.m.,3,1,from 3 m,1,Not available,No Renovation,,,,,,Gegharkunik › Sevan,"$12,000",USD,Վաճառվում է 3 սեն. Սեփական տուն ՝ավտոտնակի հետ միասին Ծովագյուղում։Ունի Հողատարածք և անասնագոմ: Գինը սակարկելի։ Զանգահարել նշված հեռախոսահամարով։,Dec-12-2022_19-57,Available,,,,,,https://list.am/en/item/13160440
Stone,No,Not available,5,42 sq.m.,3,1,from 3 m,1,Not available,Old Renovation,,,,,,Gegharkunik › Martuni,"$40,000",USD,Bargain urgently in the city of Martuni. Privatized. Գ. Ziroyan 29 building 44 apartment. Has the opportunity to move forward.Translated from Armenian,Dec-12-2022_19-57,,,,,,,https://list.am/en/item/16691996
Stone,No,Not available,3,70 sq.m.,3,1,from 2.7 m,3,Closed balcony,Old Renovation,,,,,,Gegharkunik › Chambarak,"$15,000",USD,"Tigran Metsi street, old renovation, the bathroom and the bathroom are tiled, parquet, sunny, gasified, for sale together with the propertyPrice: $15,000Translated from Armenian",Dec-12-2022_19-57,Available,,,,,,https://list.am/en/item/15681622
Stone,No,Not available,3,74 sq.m.,3,1,from 2.7 m,2,Closed balcony,Partial Renovation,,,,,,"Sayat Nova street, Sevan town","$34,000",USD,"3-room apartment for sale in In the center of Sevan, next to the Vahagn store. European windows are installed, the bathroom is tiled. The apartment has a large closed balcony.For details, call the indicated phone number.Translated from Armenian",Dec-12-2022_19-57,Not available,,,,,,https://list.am/en/item/18476614
Stone,No,Not available,5,47 sq.m.,1,1,from 3 m,5,Not available,Old Renovation,,,,,,"Միքայել Նալբանդյանի փողոց, Սևան","$20,950",USD,"It is in residential condition, old repair, there is gas, light and water. The outer door is iron. Living room. Clean and tidy condition. Urgent.Translated from Armenian",Dec-12-2022_19-57,Available,,,,,,https://list.am/en/item/18102564
