Type,Elevator,Floors in the Building,Room Area,Renovation,Balcony,Floor,Number of Guests,Children Are Welcome,Pets Allowed,Prepayment,Utility Payments,Address,Price,Currency,Description,Datetime,Links
Guesthouse,Not available,2,30 sq.m.,Euro Renovation,Open balcony,2,2,Yes,No,By Agreement,Included,Vayots Dzor › Yeghegnadzor,"7,000 ֏ daily",AMD,"Guesthouse, hotel, in YeghegnadzorA guest house is for daily rent.Translated from Armenian",Dec-12-2022_21-23,https://list.am/en/item/17612616
Guesthouse,Not available,2,30 sq.m.,Major Renovation,Open balcony,1,2,Yes,No,By Agreement,Included,Vayots Dzor › Yeghegnadzor,"7,000 ֏ daily",AMD,"Guesthouse, hotel, in YeghegnadzorA four-room guest house is for daily rent, has hot and cold water, TV, balcony.Translated from Armenian",Dec-12-2022_21-23,https://list.am/en/item/17581314
,Not available,2,10 sq.m.,Euro Renovation,Closed balcony,1,8+,Yes,Yes,By Agreement,Included,"Momik street, Yeghegnadzor","70,000 ֏ monthly",AMD,Дом находится в Ехегнадзоре.Есть постоянно WIFIАдрес Г. Ехеднадзор ул. Маршала Баграмяна,Dec-12-2022_21-23,https://list.am/en/item/18464827
,Not available,2,40 sq.m.,Euro Renovation,Not available,1,8+,Yes,Yes,By Agreement,Included,Vayots Dzor › Yeghegnadzor,"70,000 ֏ monthly",AMD,Дом находиться в ЕхегнадзореЕсть постоянно wifiTranslated from Armenian,Dec-12-2022_21-23,https://list.am/en/item/17854022
,Available,5,40 sq.m.,Major Renovation,Closed balcony,2,,,,,,Vayots Dzor › Jermuk,"20,000 ֏ daily",AMD,"Jermuk Guesthouse For any other questions, please call: R:Translated from Armenian",Dec-12-2022_21-23,https://list.am/en/item/16453209
