Stone,No,Not available,5,110 sq.m.,4,1,from 2.8 m,1,Multiple balconies,Designer Renovation,"Mesrop Mashtots street, Vagharshapat","250,000 ֏ monthly",AMD,"Վարձով է տրվում 4 սենյականոց բնակարան ք. Էջմիածնի Վռամ Մեսրոպ Մաշտոց փողոցում փողոցում (1-ին հարկ) ։ Բնակարանն ունի բոլոր կոմունալ հարմարաթյունները (BAXI ՝ տաք-սառը ջուր, գազ) ։»Մանրամասների համար զանգահարել։Здаётся в аренду квартира в городе Эчмиадзин (Улица Месооп Маштоца), квартира полностью отремонтирована, 4-х комнатная, этаж 5/1, есть все коммунальные услуги (Baxi Wi-Fi, горячая-холодная вода, отопление, стиральная машина, холодильник, мебель будет установлена во время арендыԿոդ MA134Translated from Armenian",Nov-27-2022_18-50,Available,5,Yes,No,Not included,By Agreement,,,,,,https://list.am/en/item/18564562
Stone,No,Not available,1,150 sq.m.,3,1,from 2.5 m,1,Not available,Euro Renovation,"Սուրբ Հարություն փողոց, Փարաքար","250,000 ֏ monthly",AMD,"Сдам дом недалеко от Еревана в селе Паракар... Теплая горячая вода, газ, отопление. В доме есть все необходимое` Мебель техника... Стоимость 250000 драм.Телефон` 89086858241 Вадим.Живёть 1 человек, нужен ещё 2.",Nov-27-2022_18-50,Available,8+,Yes,No,Not included,1 month,,,,,,https://list.am/en/item/18350232
Panels,No,Available,9,67 sq.m.,2,1,from 3 m,9,Not available,Euro Renovation,"Misak Manushyan street 12, Vagharshapat","15,000 ֏ daily",AMD,"2 սենյականոց բնակարան, Քաղաք Էջմիածնում, 67 ք. Մ. , 9/9 հարկ, ԵվրովերանորոգվածՕրավաձով և երկարաժամկետ 2 սենյականոց բնակարան Քաղաք Էջմիածնում, Զվարթնոցի սկզբի շենքերը, անհնրաժեշտ բոլոր հարմարություններով, 1 օրվա գինը 15.000 դրամ, գինը կարող է տարբեր լինել' կախված նրանից, թե քանի հոգով եք ապրելու և քանի օր2-х комнатная квартира в Эчмиадзине, корпуса в начале Звартноца, со всеми необходимыми удобствами, цена за 1 сутки 15.000 тысяч драм, цена может меняться, в зависимости от того, со сколькими людыми вы будете проживать и сколько дней",Nov-27-2022_18-50,,3,Yes,No,Included,By Agreement,,,,,,https://list.am/en/item/18432398
Stone,No,Not available,3,40 sq.m.,2,1,from 2.75 m,3,Closed balcony,Old Renovation,Armavir › Norakert,"4,000 ֏ daily",AMD,"The apartment is for rent both long-term and short-term, it is located in the village of Norakert, 15 km from Yerevan, on the way to the village of Merdzavan, the property is provided, there is a large supermarket, a kindergarten near the house, the village is the terminus of the 205 number transport, for the rest of the information, call The apartment will be provided from November 21Translated from Armenian",Nov-27-2022_18-50,Available,4,Yes,No,Not included,1 month,,,,,,https://list.am/en/item/18440035
Stone,No,Not available,3,50 sq.m.,2,1,from 2.75 m,3,Open balcony,Euro Renovation,"Արամ Մանուկյան փողոց 5, Մուսալեռ","250,000 ֏ monthly",AMD,"2-room apartment for rent in Musaler. Completely renovated, with all utilities, has an open balconyTranslated from Armenian",Nov-27-2022_18-50,Available,4,Yes,No,Included,By Agreement,,,,,,https://list.am/en/item/18556136
Stone,Yes,Not available,1,100 sq.m.,3,1,from 2.5 m,1,Open balcony,Major Renovation,"Khachatur Abovyan Street 4th Lane 4, Armavir","120,000 ֏ monthly",AMD,It has been completely renovatedI will also provide an officeTranslated from Armenian,Nov-27-2022_18-50,Available,8+,Negotiable,No,Not included,3 months,OUtdoor parking,"TElevision, parking space","FRidge, stove, microwave, coffee maker, washing machine, water heater","YArd view, street view, park view",INtercom entry,https://list.am/en/item/18602373
Stone,No,Not available,5,18 sq.m.,1,1,from 2.6 m,1,Not available,Euro Renovation,"1district, Metsamor","85,000 ֏ monthly",AMD,"A 1-room apartment is for rent in Metsamor, it is renovated, it has all utilities, what you see is in 1 room.Translated from Armenian",Nov-27-2022_18-50,Available,5,Yes,No,Not included,1 month,OUtdoor parking,AIr conditioner,"FRidge, stove, washing machine",STreet view,,https://list.am/en/item/18635391
Stone,No,Not available,5,60 sq.m.,2,1,from 2.7 m,3,Not available,Major Renovation,Armavir › Echmiadzin,"200,000 ֏ monthly",AMD,"It is located in the immediate vicinity of the unquenchable fire, the newly renovated apartment has the necessary furniture (bedroom, living room, kitchen), heating, gas, the bathroom is completely renovated by the owner of the house.Translated from Armenian",Nov-27-2022_18-50,Available,8+,Yes,Negotiable,Not included,2 months,,,"FRidge, washing machine",,,https://list.am/en/item/18491618
Stone,No,Not available,5,100 sq.m.,3,2,from 2.75 m,5,Not available,Major Renovation,"Mesrop Mashtots street 14, Vagharshapat","150,000 ֏ monthly",AMD,"The apartment is fully renovated, has hot and cold water, gasification. It is sunny.Translated from Armenian",Nov-27-2022_18-50,Available,4,Yes,No,Not included,1 month,OUtdoor parking,,"FRidge, stove, washing machine, water heater","YArd view, street view, city view, park view",PLayground,https://list.am/en/item/18599271
Stone,Yes,Not available,3,81 sq.m.,3,1,from 2.8 m,3,Not available,Cosmetic Renovation,Armavir › Echmiadzin,"100,000 ֏ monthly",AMD,"Code 7863A 3-room apartment is for rent on the 3rd floor of a new 5-story building on Shahumyan Street in Etchmiadzin. There are appliances, a stove, a gas stove, an open balcony, a wardrobe, etc. Commission required.Translated from Armenian",Nov-27-2022_18-50,By agreement,6,Yes,No,Not included,1 month,,,"FRidge, washing machine","YArd view, street view, view of ararat",,https://list.am/en/item/15289511
Stone,No,Not available,4,98 sq.m.,3,1,from 2.5 m,3,Open balcony,Major Renovation,"Vazgen Arajin street 6, Vagharshapat","400,000 ֏ monthly",AMD,"Վարձով է տրվում 3 սենյականոց ընդարձակ բնակարան, հիմնավերանորոգված, մոդերն դիզայնով և կահույքով (լիովին նոր, չօգտագործված, կոմունալ բոլոր հարմարություններով) ։ Բնակարանը գտնվում է Էջմիածին քաղաքի սրտում՝ հրապարակից 5 րոպե հեռավորությամբ (քայլելով) ։ Բնակարանի հարևանությամբ են գտնվում սննդի կետեր, սրճարաններ, մթերային խանութներ (տաշիր պիցա, լոշիկ, բուխարի, ցորեն և այլն), բանջարեղենի և մրգի կետեր, ինչպես նաև հագուստի խանութներ, մի խոսքով ամեն ինչ հարմարավետ և բարեկեցիկ ապրելու համար…Ամսական վարձը 400. 000Դրամ ։ Հնարավոր է նաև օրավարձով՝ 20.000 դրամ (օրերի քանակը մինիմում 15 օր) ։Հարցերի դեպքում զանգահարել վերոնշյալ հեռախոսահամարով:Сдается просторная 3-комнатная квартира с евроремонтом, современным дизайном и мебелью (совершенно новая, неиспользованная, со всеми коммуникациями) Квартира расположена в самом центре Эчмиадзина, в 5 минутах ходьбы от площади (пешком) В непосредственной близости от квартиры находятся продовольственные рынки, кафе, овощные и фруктовые магазины (ташир пицца, лошик, бухари, пшеница, Fruit land и т. Д.), а также магазины одежды, словом, все для комфортной и легкой жизни...Посуточная аренда: 20.000 драм (минимум 15 дней), месячная аренда: 400. 000 драм.В случае возникновения вопросов звоните по номеру телефона:!A spacious 3-room apartment for rent, completely renovated, with modern design and furniture (completely new, unused, with all utilities) The apartment is located in the heart of Etchmiadzin, 5 minutes away from the square (by walking) In the vicinity of the apartment there are food markets, cafes, vegetable and fruit stores (Tashir pizza, loshik, bukhari, wheat, fruit land etc. As well as clothing stores, in short, everything for a comfortable and easy life...Daily rent is also possible: 20,000 AMD (minimum 15 days), monthly rent: 400,000 AMD.In case of questions, call the phone number mentioned! I’m",Nov-27-2022_18-50,,4,No,No,Not included,By Agreement,,,,,,https://list.am/en/item/18553023
Stone,No,Not available,4,50 sq.m.,2,1,from 2.6 m,4,Open balcony,Cosmetic Renovation,Armavir › Aragats,"30,000 ֏ monthly",AMD,"An apartment is for rent in Aragatsavan, it is an apartment in a warm stone building, there are some furniture, beds, table, chair, wardrobe, etc. , there is a geyser to provide hot water, there is no gas, 90 km from YerevanTranslated from Armenian",Nov-27-2022_18-51,,3,Yes,No,Not included,1 month,,,,,,https://list.am/en/item/18381544
Stone,No,Not available,5,47 sq.m.,1,1,from 2.7 m,2,Closed balcony,Cosmetic Renovation,Armavir › Echmiadzin,"120,000 ֏ monthly",AMD,"A 1-room apartment (with niche) is for rent in the Charents district of Echmiadzin, on the 2nd floor of a 5-story building, the apartment is on the sunny side, it is a stone building.The rent is 120,000Call for detailsHas constant water, electricity, gas.Translated from Armenian",Nov-27-2022_18-51,Available,4,Negotiable,No,Not included,2 months,,,,,,https://list.am/en/item/18040204
Stone,No,Not available,5,71 sq.m.,2,1,from 2.75 m,3,Multiple balconies,Cosmetic Renovation,"Kamo street 4, Vagharshapat","190,000 ֏ monthly",AMD,"Сдаётся двухкомнатная квартира на 3 из 5 этажей в центральной части Эчмиадзина на улице Камо 4. В квартире есть все удобства. Стиральная машина, холодильник, газовая плита, душ с ванной, туалет отдельно, просторная кухня, газ, вода холодная и горячая. Закрытая кладовка, два балкона на две стороны дома. Всё что на фото включено в стоимость.Վարձով է տրվում 2 սենյականոց բնակարան Էջմիածնի կենտրոնական մասում ՝ Կամո 4 հասցեում, 5 հարկից 3-ում։ Բնակարանը ունի բոլոր հարմարությունները։ Լվացքի մեքենա, սառնարան, գազօջախ, ցնցուղ լոգարանով, առանձին զուգարան, ընդարձակ խոհանոց, գազ, սառը և տաք ջուր։ Փակ Մառան, երկու պատշգամբ Տան երկու կողմերում։ Լուսանկարում ամեն ինչ ներառված է գնի մեջ:",Nov-27-2022_18-51,Available,6,Yes,Negotiable,Not included,1 month,OUtdoor parking,,"FRidge, stove, washing machine, water heater, iron",,,https://list.am/en/item/18632807
Panels,No,Not available,5,66 sq.m.,3,1,from 2.7 m,3,Closed balcony,Euro Renovation,Armavir › Metsamor,"200,000 ֏ monthly",AMD,"Сдается 2 + -комнатная квартира в отличном состоянии с необходимой техникой и мебелью.Индивидуальная система отопления, железная дверь, евроокна.Депозит.Для получения дополнительной информации звоните.",Nov-27-2022_18-51,Available,4,Yes,Negotiable,Included,2 months,OUtdoor parking,"TElevision, air conditioner, internet, parking space","FRidge, stove, washing machine, water heater, iron, hair dryer","YArd view, street view, city view, park view",,https://list.am/en/item/18632612
Stone,No,Available,5,78 sq.m.,3,1,from 3 m,4,Closed balcony,Euro Renovation,"Vazgen Arajin street, Vagharshapat","280,000 ֏ monthly",AMD,"There are all utilities, fast Wi-Fi connection, TV with cable channels, Fondital heating system, euro windows, sunny side, there are kindergarten, shops, school nearby, there is also daily rent for minimum 5 days, 13000 drams per day.Translated from Armenian",Nov-27-2022_18-51,Available,6,Yes,No,Not included,By Agreement,OUtdoor parking,"TElevision, internet, parking space","FRidge, coffee maker, washing machine, iron","YArd view, park view",PLayground,https://list.am/en/item/18538991
Stone,No,Not available,5,78 sq.m.,2,1,from 2.7 m,3,Open balcony,Major Renovation,Armavir › Echmiadzin,"200,000 ֏ monthly",AMD,"K. A 3-room apartment on the 5th/3rd floor is for rent on Patkanyan Street in Etchmiadzin. The apartment is completely renovated, the common floor is tiled, there is property, equipment, heating system, air conditioner and wifi.Agency address - c. Etchmiadzin, Baghramyan 18a/1bTranslated from Armenian",Nov-27-2022_18-51,Available,4,Yes,Yes,Not included,By Agreement,,,,,,https://list.am/en/item/18443683
Stone,No,Not available,5,60 sq.m.,2,1,from 2.7 m,2,Open balcony,Major Renovation,Armavir › Echmiadzin,"250,000 ֏ monthly",AMD,"K. Not far from the center of Etchmiadzin, a 2-room apartment is for rent on the 5th/2nd floor. The apartment is completely renovated and furnished very nicely. It is equipped with property, equipment and heating system. The cost is AMD 300,000.Agency address - c. Etchmiadzin, Baghramyan 18a/1bTranslated from Armenian",Nov-27-2022_18-51,Available,3,Yes,No,Not included,By Agreement,,,,,,https://list.am/en/item/18597109
Stone,No,Not available,5,50 sq.m.,2,1,from 2.7 m,1,Not available,Major Renovation,Armavir › Echmiadzin,"200,000 ֏ monthly",AMD,"K. A 2-room apartment on the 5/1st floor is for rent in Etchmiadzin. The apartment has just been fully renovated and is provided with new property and appliances. The cost is AMD 200,000.Agency address - c. Etchmiadzin, Baghramyan 18a/1bTranslated from Armenian",Nov-27-2022_18-51,Available,3,Yes,Yes,Not included,By Agreement,,,,,,https://list.am/en/item/18518620
Stone,No,Not available,5,50 sq.m.,2,1,from 2.8 m,2,Not available,Major Renovation,"Mesrop Mashtots street, Vagharshapat","250,000 ֏ monthly",AMD,"From November 2A 2-room apartment is for rent. In Echmiadzin. It is completely renovated, European windows are installed, the floor is laminated, the bathroom is tiled. The apartment is provided with necessary property and equipment. There is a school, kindergarten, shops, bus stop near the building.Commission: 50%Code 02147Translated from Armenian",Nov-27-2022_18-51,Available,3,Yes,Yes,Not included,By Agreement,,,,,,https://list.am/en/item/18467398
Stone,No,Not available,5,80 sq.m.,3,1,from 3 m,3,Open balcony,Euro Renovation,"Jivani street 15, Armavir","150,000 ֏ monthly",AMD,"In the center, close to 2~schools. The house is securedREFRIGERATOR,WASHING MACHINE,GAS STOVE,KITCHEN CABINETS,HALL FURNITURE,SCURL GAS BOILER,central heating, euro windows and doors as well. The house has been renovated and is not inhabited. Rent with deposit. In the case of short-term 1-6 months, 200,000 AMD per month. In case of long term, from 6 months. 150,000 AMD for up to one year.Translated from Armenian",Nov-27-2022_18-51,Available,4,Yes,No,Not included,2 months,,,,,,https://list.am/en/item/18511908
Stone,No,Not available,1,30 sq.m.,2,1,from 2.5 m,1,Not available,Partial Renovation,Armavir › Parakar,"150,000 ֏ monthly",AMD,"Отдельно стоящее дом, двухспальная кровать, отдельный санузел, холодильник, телевизор, обогреватель, бесплатный WI-FI",Nov-27-2022_18-51,Available,2,No,Yes,Not included,By Agreement,,,,,,https://list.am/en/item/18392467
Stone,No,Not available,5,74 sq.m.,3,2,from 3 m,4,Closed balcony,Euro Renovation,"Vazgen Arajin street, Vagharshapat","280,000 ֏ monthly",AMD,"There are all utilities, fast Wi-Fi connection, TV with cable channels, Fondital heating system, euro windows, sunny side, there are kindergarten, shops, school nearby, there is also daily rent for minimum 5 days, 13000 drams per day.Translated from Armenian",Nov-27-2022_18-51,Available,6,Yes,No,Not included,By Agreement,,,,,,https://list.am/en/item/18538875
Stone,No,Not available,5,48 sq.m.,2,1,from 2.8 m,3,Closed balcony,Old Renovation,Armavir › Armavir,"50,000 ֏ monthly",AMD,1 room with niche. Property: Gas. Water and light. Family is desirable. Write about yourself and then write new questions.Translated from Armenian,Nov-27-2022_18-51,Available,3,Yes,No,Not included,6 months,,,,,,https://list.am/en/item/18540347
Stone,No,Not available,5,72 sq.m.,3,1,from 2.7 m,5,Multiple balconies,Euro Renovation,Armavir › Echmiadzin,"14,000 ֏ daily",AMD,"ATTENTION!NOT PROVIDED FOR 1 DAYMINIMUM 3 DAYSA 3-room fully renovated apartment for rent in the center of Etchmiadzin: 2 living rooms, 1 bedroom, two open balconies with a beautiful view. The apartment has a refrigerator, a washing machine, a dishwasher, an oven, an air cupboard, an iron, a hair dryer, a vacuum cleaner. Provides dishes, linen.Translated from Armenian",Nov-27-2022_18-51,,,,,,,,,,,,https://list.am/en/item/18314634
Stone,No,Not available,3,104 sq.m.,5,1,from 2.8 m,3,Not available,Euro Renovation,Armavir › Echmiadzin,"400,000 ֏ monthly",AMD,"Сдается в аренду просторная квартира в городе Эчмиадзин, ул. Маштоц. На третьем этаже каменного здания.! Просьба агентам НЕ беспокоить!",Nov-27-2022_18-51,Available,5,Yes,No,Not included,1 month,,,,,,https://list.am/en/item/18532494
Panels,No,Not available,5,48 sq.m.,2,1,from 2.75 m,2,Open balcony,Partial Renovation,Armavir › Echmiadzin,"300,000 ֏ monthly",AMD,"An apartment for rent in the center of Etchmiadzin, 3 rooms converted into 2, is in good conditionTranslated from Armenian",Nov-27-2022_18-51,Available,4,Yes,No,Included,1 month,,,,,,https://list.am/en/item/18412647
Stone,Yes,Not available,2,30 sq.m.,1,1,from 2.6 m,2,Not available,Cosmetic Renovation,Armavir › Echmiadzin,"130,000 ֏ monthly",AMD,"1 bedroom apartment with all utilities for rent.Located in a busy part of townThere is a supermarket, pharmacy, beauty salon nearby.Translated from Armenian",Nov-27-2022_18-51,Available,3,Yes,No,Not included,1 month,,TElevision,FRidge,STreet view,,https://list.am/en/item/18598405
Stone,No,Not available,1,120 sq.m.,4,2,from 2.5 m,1,Not available,Major Renovation,Armavir › Parakar,"250,000 ֏ monthly",AMD,"It is provided with constant hot and cold water. The Internet is available, it has all the conditions for living.Translated from Armenian",Nov-27-2022_18-51,Available,8+,Yes,No,Not included,By Agreement,,"TElevision, air conditioner, internet","FRidge, microwave, coffee maker, washing machine, drying machine, water heater, iron, hair dryer",YArd view,,https://list.am/en/item/18609074
Stone,No,Not available,4,35 sq.m.,2,1,from 2.7 m,4,Not available,Designer Renovation,"Մովսես Խորենացի փողոց 26, Վաղարշապատ","200,000 ֏ monthly",AMD,"The apartment is completely renovated, it is located next to the Mother's chair, thanks to which the church bells can be heard.The apartment is equipped with the necessary equipment, as well as dishes, bedding, etc. Are available. 4/4 floorTranslated from Armenian",Nov-27-2022_18-51,Available,2,Yes,No,Not included,1 month,,,,,,https://list.am/en/item/18132303
Stone,No,Available,9,130 sq.m.,4,2,from 2.8 m,2,Open balcony,Major Renovation,"Marshal Baghramyan avenue, Yerevan","$1,100 monthly",USD,"A 4-room apartment of 130 square meters is for rent in Etchmiadzin, on Baghramyan street. M. With an area located on the 3rd floor of a 5-story stone building. The apartment is fully renovated. The floor is covered with parquet. It is provided with permanent water supply and gas supply. The heating system is heated. Euro windows and iron door installed. The apartment has air conditioner, intercom. It has an open balcony.Code 19562Translated from Armenian",Nov-27-2022_18-51,Available,6,Yes,No,Not included,1 month,,,,,,https://list.am/en/item/18165013
Panels,No,Not available,5,61 sq.m.,3,1,from 2.8 m,5,Open balcony,Major Renovation,Armavir › Echmiadzin,"400,000 ֏ monthly",AMD,"A completely renovated apartment is for rent, the apartment has all the amenities.Gas:LightWaterBucks systemКвартира с ремонтом for rent.There are all amenities in the apartment.The apartment is not occupied.Translated from Armenian",Nov-27-2022_18-51,Available,4,Yes,No,Not included,1 month,,,,,,https://list.am/en/item/18396501
Panels,No,Not available,2,86 sq.m.,4,1,from 2.8 m,2,Open balcony,Major Renovation,Armavir › Merdzavan,"350,000 ֏ monthly",AMD,"Կոդ` B-23372Վարձով է տրվում 4 սենյականոց բնակարան Մերձավանում՝ 2 հարկանի պանելային շենքի 2-րդ հարկում։ Բնակարանը կապիտալ վերանորոգված է։ Մուտքի դուռը՝ երկաթյա, պատուհանները՝ եվրո, հատակը՝ լամինատ, պրեսգրանիտ։ Սանհանգույցը՝ համակցված, սալիկապատ, էլ․ լարերը և խողովակները՝ փոխված։ Ունի բաց լոջա, ջեռուցման համակարգ, մշտական ջուր և գազ։ Տրվում է վարձով անհրաժեշտ գույքի և տեխնիկայի հետ միասին։Գործակալության միջնորդավճարը կազմում է 50%: Ցուցադրությունների համար կնքվում է ցուցադրման պայմանագիր։ Խնդրում ենք Ձեզ մոտ ունենալ անձը հաստատող փաստաթուղթ։An apartment for rent in Merdzavan. The rooms' quantity is 4 (1 hall and 3 bedrooms) The apartment is newly renovated and is located on the 2nd floor of the 2-storey panel building. The entrance door is iron-made, the windows are euro-based, the floor is covered by laminate and solid-granite. The bathroom is combined and tiled, the electric wires and pipes are newly changed. The apartment has a balcony, heating system and is supplied with constant water and gas. The apartment is being rented with necessary furniture and technique devices.The commission of the Real Estate Agency is 50%. For showing the real estate, a contract is signed. Please have a passport, ID or driving-license with You.",Nov-27-2022_18-51,Available,8+,Yes,Yes,Not included,6 months,,,,,,https://list.am/en/item/18568523
Stone,No,Not available,4,115 sq.m.,3,1,from 2.75 m,1,Open balcony,Major Renovation,"Զվարթնոց թաղամաս 11, Վաղարշապատ","250,000 ֏ monthly",AMD,"Կոդ՝ B-23346Վարձով է տրվում 3 սենյականոց բնակարան Էջմիածնի Զվարթնոց թաղամասում, 4 հարկանի քարե շենքի 1-ին հարկում։ Բնակարանը կապիտալ վերանորոգված է։ Մուտքի դուռը՝ երկաթյա, պատուհանները՝ եվրո, հատակը՝ մանրահատակ, սալիկ։ Սանհանգույցը՝ համակցված, սալիկապատ, էլ․ լարերը և խողովակները՝ փոխված։ Ունի բաց լոջա, ավտոտնակ, ջեռուցման համակարգ, մշտական ջուր և գազ։ Տրվում է կահույքի և տեխնիկայի հետ միասին։Գործակալության միջնորդավճարը կազմում է 50%: Ցուցադրությունների համար կնքվում է ցուցադրման պայմանագիր։ Խնդրում ենք Ձեզ մոտ ունենալ անձը հաստատող փաստաթուղթ։An apartment for rent in Zvartnots District of Echmiadzin. The apartment is newly renovated and is located of the ground floor of the 4-storey stone building. The entrance door is iron-made, the windows are euro-based, the floor is covered by parquet and is tiled. The bathroom is combined and is tiled, the electric wires and pipes are newly changed. It has a balcony, garage, heating system and is supplied with constant water and gas. The apartment is being rented with furniture and electronic devices.The commission of the Real Estate Agency is 50%. For showing the real estate, a contract is signed. Please have a passport, ID or driving-license with You.",Nov-27-2022_18-51,Available,5,Yes,No,Not included,By Agreement,,,,,,https://list.am/en/item/18539024
