Construction Type,New Construction,Elevator,Floors in the Building,Floor Area,Number of Rooms,Number of Bathrooms,Ceiling Height,Floor,Balcony,Renovation,Address,Price,Currency,Description,Datetime,Furniture,Number of Guests,Children Are Welcome,Pets Allowed,Utility Payments,Prepayment,Parking,Amenities,Appliances,Window Views,The House Has,Links
Stone,Yes,Not available,4,70 sq.m.,2,1,from 3 m,1,Not available,Major Renovation,"Baghramyan street, Vagharshapat","10,000 ֏ daily",AMD,"The apartment is designed for 3-4 people.Very nice, bright and comfortable apartment in the center of Etchmiadzin. The apartment is newly renovated and uninhabited.Completely renovated with all utilities and appliancesConstant hot and cold water,Baxi heatingRefrigeratorWashing machineDishLinenHouse TV channels and Wifi.For more information call:Translated from Armenian",Nov-24-2022_17-51,,,,,,,,,,,,https://list.am/en/item/15825923
Stone,No,Not available,5,45 sq.m.,2,1,from 2.7 m,5,Closed balcony,Cosmetic Renovation,"Mesrop Mashtotsi St, Vagharshapat","200,000 ֏ monthly",AMD,"A 2-room apartment is for rent in the center of Etchmiadzin, in a stone building next to the Square, on the 5th floor.Has all utilities, property, taxiTranslated from Armenian",Nov-24-2022_17-51,,,,,,,,,,,,https://list.am/en/item/18286265
Stone,No,Not available,5,80 sq.m.,3,1,from 2.7 m,2,Open balcony,Designer Renovation,Armavir › Echmiadzin,"150,000 ֏ monthly",AMD,"AS121:K. A 3-room apartment on the 5th/2nd floor is for rent in the Charents district of Etchmiadzin. The apartment has old repairs, but is in a clean condition. A heating system is installed, property and equipment are available. You can rent the apartment until June. The cost is AMD 150,000.Agency address - c. Etchmiadzin, Baghramyan 18a/1bTranslated from Armenian",Nov-24-2022_17-51,Available,7.0,Yes,Yes,Not included,By Agreement,,,,,,https://list.am/en/item/18374784
Stone,No,Not available,5,96 sq.m.,2,1,from 2.7 m,1,Closed balcony,Designer Renovation,Armavir › Echmiadzin,"230,000 ֏ monthly",AMD,"From January 1, 2023Not far from the center of Etchmiadzin, a 4-room apartment is for rent on the first floor of a 2-story stone building. It has a balcony, air conditioning, expensive furniture and appliances, a tiled bathroom, another separate entrance, closets, a garage, etc. Deposit and commission required.Daily wage: 20,000.Code 7587Translated from Armenian",Nov-24-2022_17-51,,,,,,,,,,,,https://list.am/en/item/17610922
Stone,No,Not available,5,69 sq.m.,3,1,from 2.75 m,2,Open balcony,Euro Renovation,Armavir › Echmiadzin,"250,000 ֏ monthly",AMD,"250,000 AMD for rent3-room apartmentEchmiadzin in the Central part50% commissionUtilitiesThe floor will be heatedWith property, equipmentCode VA002Translated from Armenian",Nov-24-2022_17-51,,2.0,Yes,Yes,Not included,Without prepayment,,,,,,https://list.am/en/item/14182352
Stone,No,Not available,5,80 sq.m.,3,1,from 2.75 m,4,Not available,Partial Renovation,Armavir › Echmiadzin,"170,000 ֏ monthly",AMD,"170,000 AMD for rent3-room apartmentEchmiadzin in the Central partOn Mashtots street50% commissionUtilitiesWith property, equipmentTranslated from Armenian",Nov-24-2022_17-51,,5.0,Yes,Yes,Not included,Without prepayment,,,,,,https://list.am/en/item/15343929
Stone,Yes,Not available,5,68 sq.m.,3,1,from 2.7 m,3,Open balcony,Major Renovation,Armavir › Echmiadzin,"200,000 ֏ monthly",AMD,"AS106:K. A 3-room apartment on the 5th/3rd floor is for rent on Khorenatsi street in Etchmiadzin. The apartment is provided with all utilities, property, equipment and heating system are available. The cost is AMD 200,000.Agency address - c. Etchmiadzin, Baghramyan 18a/1bTranslated from Armenian",Nov-24-2022_17-51,Available,3.0,Yes,Yes,Not included,By Agreement,,,,,,https://list.am/en/item/17573611
Stone,Yes,Not available,5,60 sq.m.,2,1,from 2.8 m,3,Open balcony,Designer Renovation,"Mesrop Mashtots street 10, Vagharshapat","15,000 ֏ daily",AMD,"An apartment is for rent in the center of Etchmiadzin2 rooms, possible for daily rent (15,000 AMD),thoroughly reconstructed,has all the utilities,Equipped with property and equipmentwindows and doors of European production,the bathroom is tiledconstant hot and cold water,there are 2 air conditioners,open balcony.Translated from Armenian",Nov-24-2022_17-51,Available,4.0,No,No,Not included,3 months,,,,,,https://list.am/en/item/17509528
Panels,,,5,72 sq.m.,2,1,from 3.5 m,1,,Major Renovation,"Baghramyan street, Vagharshapat","10,000 ֏ daily",AMD,"Շատ գեղեցիկ, լուսավոր և հարմարավետ բնակարան Էջմիածին քաղաքում: Բնակարանը նոր վերանորոգված է և չբնակեցված:Կապիտալ վերանորոգված բոլոր կոմունալ հարմարություններով:House TV հեռուստատեսություն 113 ալիք:Մանրամասների համար զանգահարել:IphoneSamsungHomeNokia",Nov-24-2022_17-51,,,,,,,,,,,,https://list.am/en/item/14553336
Stone,Yes,Not available,4,70 sq.m.,2,1,from 2.5 m,1,Not available,Major Renovation,"Baghramyan street, Vagharshapat","10,000 ֏ daily",AMD,"The apartment is designed for 3-4 people.Very nice, bright and comfortable apartment in the center of Etchmiadzin. The apartment is newly renovated and uninhabited.Completely renovated with all utilities and appliancesConstant hot and cold water,Baxi heatingRefrigeratorWashing machineDishLinenHouse TV channels and Wifi.For more information call:77400097.98080461.98080467.93491011Translated from Armenian",Nov-24-2022_17-51,,,,,,,,,,,,https://list.am/en/item/15653866
Stone,No,Not available,5,72 sq.m.,2,1,from 3 m,1,Closed balcony,Major Renovation,"Baghramyan street, Vagharshapat","10,000 ֏ daily",AMD,"The apartment is designed for 3-4 people.Very nice, bright and comfortable apartment in the center of Etchmiadzin. The apartment is newly renovated and uninhabited.Completely renovated with all utilities and appliancesConstant hot and cold water,Baxi heatingRefrigeratorWashing machineDishLinenHouse TV channels and Wifi.For more information call:77400097.98080461.98080467.93491011Translated from Armenian",Nov-24-2022_17-51,,,,,,,,,,,,https://list.am/en/item/18244323
Stone,No,Not available,4,72 sq.m.,2,1,from 3 m,1,Not available,Major Renovation,"Baghramyan street, Vagharshapat","10,000 ֏ daily",AMD,"The apartment is designed for 3-4 people.Very nice, bright and comfortable apartment in the center of Etchmiadzin. The apartment is newly renovated and uninhabited.Completely renovated with all utilities and appliancesConstant hot and cold water,Baxi heatingRefrigeratorWashing machineDishLinenHouse TV channels and Wifi.Translated from Armenian",Nov-24-2022_17-51,,,,,,,,,,,,https://list.am/en/item/18298093
Stone,No,Not available,5,70 sq.m.,2,1,from 3 m,3,Not available,Major Renovation,"Vazgen Arajin street, Vagharshapat","45,000 ₽ monthly",RUB,"Сдается квартира в городе Эчмиадзин, на улице Вазгена первого. Капитальный ремонт, имеет все коммунальные услуги (постоянная горячая и холодная вода, кондиционер, Wi-Fi при необходимости! Ежемесячная плата 45 000 рублей.",Nov-24-2022_17-51,,,,,,,,,,,,https://list.am/en/item/18282135
Stone,No,Not available,5,65 sq.m.,2,1,from 2.8 m,1,Closed balcony,Designer Renovation,"Movses Khorenatsi Street, Gyumri","180,000 ֏ monthly",AMD,"Сдаётся без посредников на длительный срок 2 комнатная квартира расположенная в 58-ой Квартале.Общая площадь составляет 65кв. М.Природный газ, постоянная горячая и холодная вода. Отопление BaxiВ квартире есть: Спальня, ванная комната, туалет, кухня (посуда), отопление, теплый пол, стиральная машина-автомат, холодильник, газовая плита, LCD телевизор.Translated from Armenian",Nov-24-2022_17-51,Available,4.0,Yes,No,Not included,1 month,OUtdoor parking,"TElevision, internet","FRidge, washing machine, iron",,,https://list.am/en/item/17914731
Stone,No,Not available,5,80 sq.m.,3,1,from 2.7 m,2,Closed balcony,Major Renovation,Armavir › Echmiadzin,"250,000 ֏ monthly",AMD,"AS129:K. A 3-room apartment on the 5th/2nd floor is for rent on Mashtots Street in Etchmiadzin. The apartment is completely renovated, there is an air conditioner, dishes and bed. The cost is AMD 250,000.Agency address - c. Etchmiadzin, Baghramyan 18a/1bTranslated from Armenian",Nov-24-2022_17-51,Available,3.0,Yes,Yes,By Agreement,1 month,,,,,,https://list.am/en/item/18371240
Stone,No,Not available,5,64 sq.m.,2,1,from 2.8 m,2,Not available,Partial Renovation,"Baghramyan street, Armavir","60,000 ֏ monthly",AMD,Partly furnished with all utilitiesTranslated from Armenian,Nov-24-2022_17-51,,,,,,,,,,,,https://list.am/en/item/17469875
Stone,No,Not available,5,60 sq.m.,2,1,from 2.8 m,3,Not available,Partial Renovation,"Charents street, Armavir","80,000 ֏ monthly",AMD,"The apartment is in good condition, furnished and provided with all utilitiesTranslated from Armenian",Nov-24-2022_17-51,,,,,,,,,,,,https://list.am/en/item/17094117
Stone,No,Not available,5,70 sq.m.,2,1,from 2.8 m,1,Open balcony,Euro Renovation,"Trdat Architector street, Gyumri","120,000 ֏ monthly",AMD,"Վարձով է տրվում 2 սենյականոց բնակարան ք. Գյումրիյում (квартал Ани) ։ Ապահովված է կոմունալ հարմարություններով։ Մանրամասների համար զանգահարել ։Сдается 2-х комнатная квартира в г. В Гюмри. (Квартал Ани) Оснащена всеми коммуникациями (отопление, горячая и холодная вода, стиральная машина автомат, холодильник, телевизор, комнаты меблированы), подробности по телефону.Կոդ Dr123Translated from Armenian",Nov-24-2022_17-51,Available,4.0,Yes,No,Not included,By Agreement,,"TElevision, internet, parking space","FRidge, washing machine, iron","YArd view, street view",,https://list.am/en/item/17872723
Stone,Yes,Not available,5,78 sq.m.,4,1,from 2.7 m,3,Open balcony,Major Renovation,Armavir › Echmiadzin,"200,000 ֏ monthly",AMD,"AS092:K. A 4-room apartment on the 5th/3rd floor is for rent in the Charents district of Etchmiadzin. The apartment is completely renovated, there is property and equipment. The cost is AMD 200,000.Agency address - c. Etchmiadzin, Baghramyan 18a/1bTranslated from Armenian",Nov-24-2022_17-51,Available,7.0,Yes,Yes,Not included,By Agreement,,,,,,https://list.am/en/item/14284218
Stone,No,Not available,5,50 sq.m.,2,1,from 2.8 m,3,Not available,Major Renovation,Armavir › Echmiadzin,"200,000 ֏ monthly",AMD,"K. A 2-room apartment on the 5th/3rd floor is for rent on Mashtots Street in Etchmiadzin. The apartment is fully renovated, provided with all utilities, property, equipment and heating system are available. The apartment will be available from December 15, but you can reserve it in advance. The cost is AMD 200,000.Agency address - c. Etchmiadzin, Baghramyan 18a/1bTranslated from Armenian",Nov-24-2022_17-51,Available,3.0,Yes,Yes,Not included,By Agreement,,,,,,https://list.am/en/item/14284438
Panels,No,Not available,5,80 sq.m.,3,1,from 2.7 m,5,Open balcony,Major Renovation,Armavir › Echmiadzin,"250,000 ֏ monthly",AMD,Code AV013Commission 30%3-room apartment for rentOn Patkanyan street of Etchmiadzin cityFloor 5The area is 80 square metersAshotAir conditionerHeating SystemComes with all property appliancesFor more information call...Translated from Armenian,Nov-24-2022_17-51,Available,4.0,Yes,No,Not included,1 month,OUtdoor parking,"TElevision, air conditioner, internet, parking space","FRidge, stove, microwave, coffee maker, dishwasher, washing machine, drying machine, water heater, iron","YArd view, street view",,https://list.am/en/item/18019219
Stone,No,Not available,5,46 sq.m.,2,1,from 2.75 m,5,Not available,Euro Renovation,Armavir › Merdzavan,$500 monthly,USD,Сдаётся двухкомнатная квартира в 12 километров от Еревана. Всё необходимое для проживания есть. Сдаётся на 1-2 месяцев.Կոդ 3361Translated from Armenian,Nov-24-2022_17-51,,,,,,,,,,,,https://list.am/en/item/17534085
Stone,No,Not available,5,42 sq.m.,2,1,from 2.6 m,3,Closed balcony,Designer Renovation,Armavir › Echmiadzin,"250,000 ֏ monthly",AMD,From November 21A 2-room sunny apartment on the 2nd floor of a stone building is for rent in the center of Etchmiadzin. It is provided with all property and household appliances. Deposit and commission required.Code 7833Translated from Armenian,Nov-24-2022_17-51,,3.0,Yes,No,Not included,2 months,,,,,,https://list.am/en/item/16755100
Stone,Yes,Not available,5,70 sq.m.,3,2,from 3.5 m,1,Multiple balconies,Euro Renovation,"Mesrop Mashtots St, Vagharshapat","300,000 ֏ monthly",AMD,"Newly renovated apartment in the center of Echmiadzin, equipped with everything, call for details, available both daily and monthly.Translated from Armenian",Nov-24-2022_17-51,Available,4.0,No,No,Not included,1 month,,,,,,https://list.am/en/item/18133624
Monolith,Yes,Available,11,52 sq.m.,2,1,from 3 m,4,Closed balcony,Euro Renovation,"Улица Хачатура Кечареци 17, Цахкадзор",$750 monthly,USD,Город цахказоя 2 комнаты квартира с прекрасным видом,Nov-24-2022_17-51,,,,,,,,,,,,https://list.am/en/item/18349169
Stone,No,Not available,4,70 sq.m.,3,1,from 2.5 m,4,Closed balcony,Major Renovation,"Mesrop Mashtots street, Vagharshapat","10,000 ֏ daily",AMD,Fully renovated baxi air conditioner with hot and cold waterTranslated from Armenian,Nov-24-2022_17-51,,,,,,,,,,,,https://list.am/en/item/16719385
Stone,No,Not available,3,80 sq.m.,2,1,from 3 m,3,Open balcony,No Renovation,Armavir › Metsamor,"40,000 ֏ monthly",AMD,"An apartment is for rent in Metsamor city. It has 2 rooms, an open balcony. It does not have gas, old renovated, completely empty.Translated from Armenian",Nov-24-2022_17-51,,,,,,,,,,,,https://list.am/en/item/18364744
Stone,No,Not available,5,63 sq.m.,2,2,from 2.8 m,2,Not available,Major Renovation,Armavir › Echmiadzin,"250,000 ֏ monthly",AMD,"AS124:K. A 2-room apartment on the 5th/2nd floor is for rent in Etchmiadzin. The apartment is completely renovated, has property, equipment, heating system, air conditioner, security system. The cost is AMD 250,000.Agency address - c. Etchmiadzin, Baghramyan 18a/1bTranslated from Armenian",Nov-24-2022_17-51,Available,3.0,Yes,Yes,Not included,By Agreement,,,,,,https://list.am/en/item/16302779
Stone,No,Not available,5,90 sq.m.,3,1,from 2.75 m,2,Open balcony,Major Renovation,Armavir › Echmiadzin,"270,000 ֏ monthly",AMD,"270,000 drams per month3-room apartment with all appliances is for rentIn the center of Etchmiadzin cityWith 30% commission.Constant water, gas.AshotTranslated from Armenian",Nov-24-2022_17-51,,,,,,,,,,,,https://list.am/en/item/14349261
Panels,No,Not available,5,61 sq.m.,2,1,from 2.75 m,2,Open balcony,Major Renovation,"Charents street, Vagharshapat",$800 monthly,USD,"Բնակարանը կապիտալ վերանորոգված է, ունի սեփական ջեռուցում ու շուրջօրյա ջրամատակարարում։ Տրվում է կահույքով և տեխնիկայով։ Պատերը կահավորված են պահարաններով։ Ունի նկուղ։Կատեգորիկ արգելվում է բոլոր տեսակի թռչունների ու կենդանիների մուտքը բնակարան։Եթե կա երեխա ապա, ուշադիր վերաբեևմունք գույքի նկատմամբ։ Տրվում է միայն կոկիկ ու մաքրասեր մարդկանց։Հեռավորությունը Երևանից 20 կմՀեռավորությունը օդանավակայանից 14 կմՎարձը 6֊12 ամսվա միանվագ։Լուսանկարների հղումը`/item/18055697Квартира с новым кап. Ремонтом, планировали жить сами, но пока решили сдавать. Поэтому ищем опрятных и чистоплотных жильцов.Просьба те, кто с домашними животными не беспокоить.Расстояние от Еревана 20км, от аэоропорта 14 кмОплата единовременное от 6-12 месяцевФото по ссылке /item/18055697Translated from Armenian",Nov-24-2022_17-51,Available,4.0,Yes,No,Not included,6 months,,,,,,https://list.am/en/item/18301354
Stone,No,Not available,5,70 sq.m.,4,1,from 2.7 m,5,Not available,Partial Renovation,Armavir › Echmiadzin,"280,000 ֏ monthly",AMD,3-room apartment for rent in Echmiadzin Kirovon the street40% commission1 floorUtilitiesAlong with property and equipmentTranslated from Armenian,Nov-24-2022_17-51,,,,,,,,,,,,https://list.am/en/item/13793397
Stone,No,Not available,5,45 sq.m.,2,1,from 3 m,3,Not available,Euro Renovation,"Մովսես Խորենացի փողոց 20Ա, Վաղարշապատ","250,000 ֏ monthly",AMD,"Сдается 2-комнатная квартира в центре Эчмиадзина. Квартира обеспечена всеми удобствами, сдается с мебелью и бытовой техникой. Он расположен в 18 км от центра Еревана.",Nov-24-2022_17-51,,2.0,Yes,No,Not included,2 months,,,,,,https://list.am/en/item/17542705
Stone,No,Not available,5,76 sq.m.,4,1,from 2.7 m,4,Open balcony,Euro Renovation,Armavir › Echmiadzin,"270,000 ֏ monthly",AMD,"270,000 AMD for rentNegotiable4 bedroom private luxuryMini houseIn Echmiadzin50% commissionUtilitiesBucks systemThe floor will be heatedWith property, equipmentTranslated from Armenian",Nov-24-2022_17-51,,6.0,Yes,Yes,Not included,Without prepayment,,,,,,https://list.am/en/item/17924957
Stone,No,Not available,5,78 sq.m.,3,1,from 2.75 m,2,Open balcony,Major Renovation,Armavir › Echmiadzin,"300,000 ֏ monthly",AMD,"AS133:K. A 3-room apartment on the 5th/2nd floor is for rent in Etchmiadzin. The apartment is completely renovated, all utilities, property, equipment and heating system are available. The cost is AMD 300,000.Agency address - c. Etchmiadzin, Baghramyan 18a/1bTranslated from Armenian",Nov-24-2022_17-51,Available,5.0,Yes,No,Not included,By Agreement,,,,,,https://list.am/en/item/18263077
Stone,Yes,Not available,5,70 sq.m.,3,1,from 2.8 m,3,Open balcony,Cosmetic Renovation,Armavir › Echmiadzin,"250,000 ֏ monthly",AMD,"A renovated 3-room apartment is for rent in the center of Etchmiadzin, it has equipment with all the necessary things, baxi, constant hot and cold water, it is for rent and daily and monthly;For more information callCode 1102Translated from Armenian",Nov-24-2022_17-51,,3.0,No,No,Not included,By Agreement,,,,,,https://list.am/en/item/16583103
Stone,Yes,Not available,5,70 sq.m.,3,2,from 2.75 m,1,Multiple balconies,Cosmetic Renovation,"Mashtotsi St, Vagharshapat","15,000 ֏ daily",AMD,"An apartment is for daily rent in the center of Etchmiadzin with all its amenities, it has a bathroom, constant hot and cold water, refrigerator, TV, necessary furniture for living. It is newly renovated, it is located in the canton of Etchmiadzin, next to the square, it has a beautiful yard with trees and flowers. Call for details.THE APARTMENT IS NOT RENTED FOR 1 DAY, AND NOT CALL ALL, ONLY FOR 2 DAYS OR MORETranslated from Armenian",Nov-24-2022_17-51,,3.0,Yes,No,Not included,By Agreement,,,,,,https://list.am/en/item/16665402
Stone,No,Not available,5,60 sq.m.,2,1,from 2.8 m,4,Open balcony,Major Renovation,Armavir › Echmiadzin,"200,000 ֏ monthly",AMD,"AS109:A 2-room apartment on the 5th/4th floor is for rent in Zvartnots. The apartment is fully renovated and equipped with property and equipment. The cost is AMD 200,000.Agency address - c. Etchmiadzin, Baghramyan 18a/1bTranslated from Armenian",Nov-24-2022_17-51,Available,3.0,Yes,Yes,Not included,By Agreement,,,,,,https://list.am/en/item/17524495
Stone,No,Not available,5,60 sq.m.,2,1,from 2.7 m,3,Open balcony,No Renovation,Armavir › Echmiadzin,"70,000 ֏ monthly",AMD,"AS101:K. A 2-room apartment is for rent on the 5th/3rd floor in the Charents district of Etchmiadzin. There is no property in the apartment, but there are utilities. The cost is AMD 70,000Agency address - c. Etchmiadzin, Baghramyan 18a/1bTranslated from Armenian",Nov-24-2022_17-51,Not available,3.0,Yes,Yes,Not included,By Agreement,,,,,,https://list.am/en/item/18263388
Stone,No,Not available,5,48 sq.m.,2,1,from 2.8 m,3,Open balcony,Major Renovation,Armavir › Echmiadzin,"350,000 ֏ monthly",AMD,Կոդ AV09 գինը 350000 ամսեկանՄիջնորդավճար 30%Տրվում է վարձով 2 սենյականոց բնակարանԷջմիածին քաղաքի կենտրոնումՀարկ 2Մակերեսը 43 քմԱշոտՏրվում է ամբողջ գույքի տեխնիկայի հետՄանրամասների համար զանգահարել...,Nov-24-2022_17-51,,3.0,Yes,No,Not included,1 month,,,,,,https://list.am/en/item/13805407
Stone,No,Not available,4,67 sq.m.,2,1,from 3 m,2,Open balcony,Major Renovation,"Улица Паруйра Севака 1, Гюмри","200,000 ֏ monthly",AMD,"Сдается 2 комнатная комфортабельная, стильная квартира в Гюмри, в 58 квартале со всеми удобствами, мебель, техника (стиральная машина, телевизор, пылесос, утюг, гладильная доска, горячая вода, отопление, wi-fiTranslated from Armenian",Nov-24-2022_17-51,Available,4.0,Yes,No,Not included,2 months,,"TElevision, internet, parking space","FRidge, washing machine, iron","YArd view, street view",,https://list.am/en/item/17893012
Stone,Yes,Not available,1,150 sq.m.,2,2,from 2.8 m,1,Open balcony,Major Renovation,"Սայաթ-Նովա փողոցի 5-րդ նրբանցք 2, Արմավիր","150,000 ֏ daily",AMD,Dacha for rent is heated with air conditioningTranslated from Armenian,Nov-24-2022_17-51,Available,4.0,Yes,No,Not included,By Agreement,,,,,,https://list.am/en/item/17480398
Stone,No,Not available,5,68 sq.m.,3,1,from 2.8 m,1,Open balcony,Old Renovation,Armavir › Echmiadzin,"130,000 ֏ monthly",AMD,"An apartment is for rent on Patkanyan street, with property and equipment, there is a heating system.Translated from Armenian",Nov-24-2022_17-51,,,,,,,,,,,,https://list.am/en/item/18338581
Stone,No,Not available,4,48 sq.m.,1,1,from 2.8 m,1,Not available,Major Renovation,"Shahumyan street, Gyumri","160,000 ֏ monthly",AMD,"Г. Гюмри (улица Ширакаци) Сдается однакомнатная квартира класса комфорт. Супермаркеты, рынок, аптеки, рядом (200-600м) Скоростной интернет, питьевая вода 24/7, теплая вода.В квартире есть всё необходимое для комфортного проживания.Кровать двухспальная,техника (стиральная машина, газовая плита, холодильник, чайник,Кухонные принадлежности, посуда, утюг, пылесос.Վարձով է տրվում 1 սենյականոց բնակարան Գյումրի քաղաքի Շիրակացի փողոցում- գազ լույս տաք և սառը ջուր, ջեռուցում, եվրոպատուհաններ, առաջին հարկ, կահույքով, անկողնային պարականներով, խոհանոցային պարագաններ (ամբողջ կոմպլեկտ), սառնարան, լվածքի մեքենա, հեռուստացույց, արդուկ, փոշեկուլ.Կոդ V436",Nov-24-2022_17-51,Available,3.0,Yes,Yes,Not included,By Agreement,OUtdoor parking,"TElevision, air conditioner, internet","FRidge, washing machine, iron",,,https://list.am/en/item/17913172
Stone,No,Not available,5,98 sq.m.,4,1,from 2.7 m,4,Open balcony,Cosmetic Renovation,Armavir › Echmiadzin,"100,000 ֏ monthly",AMD,"AS110:A 4-room apartment on the 5th/4th floor is for rent in Zvartnots. The apartment is provided with all utilities, partial property and equipment are available. The cost is AMD 100,000.Agency address - c. Etchmiadzin, Baghramyan 18a/1bTranslated from Armenian",Nov-24-2022_17-51,Available,4.0,Yes,Yes,Not included,By Agreement,,,,,,https://list.am/en/item/17783652
Stone,No,Not available,5,78 sq.m.,3,2,from 3 m,5,Multiple balconies,Cosmetic Renovation,"Улица Карчикяна 1, Вагаршапат","300,000 ֏ monthly",AMD,Сдаётся 3 Комнетная квартира со всеми удобствамиԿոդ 0011,Nov-24-2022_17-51,,6.0,Yes,Yes,Not included,1 month,,,,,,https://list.am/en/item/17871585
Stone,No,Not available,5,80 sq.m.,3,1,from 3 m,4,Open balcony,Major Renovation,Armavir › Echmiadzin,"250,000 ֏ monthly",AMD,"AS097:An apartment is for rent in the center of Etchmiadzin, which has property, appliances, dishes, linens, heating. Air conditioning system. The apartment is rented monthly and long-term. It is equipped with dishes and linens. The apartment is located on the 5/4th floor. The cost of renting for 1 month is 250,000 AMD.Agency address - c. Etchmiadzin, Baghramyan 18a/1bTranslated from Armenian",Nov-24-2022_17-51,Available,4.0,Yes,Yes,Not included,By Agreement,,,,,,https://list.am/en/item/17331459
